Title,Director,MetaScore,Duration (minutes),IMDb Rating,Certificates,Star Cast,Genre,Year,Genre Value
Amy,Asif Kapadia,0.8314606741573034,0.3025830258302583,0.6964285714285714,R,Amy WinehouseMitch WinehouseMark Ronson,Documentary,0.9074074074074048,0.5882352941176471
Belfast,Kenneth Branagh,0.7191011235955056,0.19188191881918817,0.5892857142857144,PG-13,Jude HillLewis McAskieCaitríona Balfe,Biography,0.9629629629629619,0.2941176470588235
Nyad,Jimmy Chin,0.5842696629213483,0.2767527675276753,0.5714285714285714,PG-13,Annette BeningJodie FosterAnne Marie Kempf,Biography,0.981481481481481,0.2941176470588235
Wild,Jean-Marc Vallée,0.7078651685393259,0.25461254612546125,0.5714285714285714,R,Reese WitherspoonLaura DernGaby Hoffmann,Adventure,0.8981481481481488,0.058823529411764705
Tetris,Jon S. Baird,0.5617977528089888,0.2656826568265682,0.6250000000000002,R,Taron EgertonMara HufMiles Barrow,Biography,0.981481481481481,0.2941176470588235
Lawless,John Hillcoat,0.5280898876404495,0.2583025830258302,0.5892857142857144,R,Tom HardyShia LaBeoufGuy Pearce,Biography,0.8796296296296298,0.2941176470588235
The Insider,Michael Mann,0.8314606741573034,0.4095940959409594,0.6964285714285714,R,Russell CroweAl PacinoChristopher Plummer,Biography,0.7592592592592595,0.2941176470588235
Bleed for This,Ben Younger,0.5730337078651685,0.26199261992619927,0.5178571428571428,R,Ben YoungerPippa BiancoAngelo Pizzo,Biography,0.9166666666666643,0.2941176470588235
Wyatt Earp,Lawrence Kasdan,0.4044943820224719,0.5350553505535055,0.5,PG-13,Kevin CostnerDennis QuaidGene Hackman,Action,0.7129629629629619,0.0
Lincoln,Steven Spielberg,0.8539325842696629,0.3837638376383763,0.6071428571428572,PG-13,Daniel Day-LewisSally FieldDavid Strathairn,Biography,0.8796296296296298,0.2941176470588235
Walk the Line,James Mangold,0.6853932584269663,0.3321033210332103,0.6964285714285714,PG-13,Johnny CashGill DennisJames Mangold,Biography,0.8148148148148131,0.2941176470588235
King Richard,Reinaldo Marcus Green,0.7303370786516854,0.36162361623616235,0.642857142857143,PG-13,Will SmithAunjanue Ellis-TaylorJon Bernthal,Biography,0.9629629629629619,0.2941176470588235
Miracle,Gavin O'Connor,0.6404494382022472,0.3284132841328413,0.642857142857143,PG,Kurt RussellPatricia ClarksonNathan West,Biography,0.8055555555555536,0.2941176470588235
Mask,Peter Bogdanovich,0.6966292134831461,0.27306273062730624,0.5892857142857144,PG-13,CherEric StoltzSam Elliott,Biography,0.6296296296296298,0.2941176470588235
Straight Outta Compton,F. Gary Gray,0.6853932584269663,0.3726937269372693,0.6964285714285714,R,Jonathan HermanAndrea BerloffS. Leigh Savidge,Biography,0.9074074074074048,0.2941176470588235
The Fighter,David O. Russell,0.7640449438202247,0.2583025830258302,0.6964285714285714,R,Scott SilverPaul TamasyEric Johnson,Action,0.8611111111111107,0.0
The King's Speech,Tom Hooper,0.8651685393258427,0.2656826568265682,0.7321428571428572,R,Colin FirthGeoffrey RushHelena Bonham Carter,Biography,0.8611111111111107,0.2941176470588235
The Theory of Everything,James Marsh,0.6741573033707865,0.2841328413284133,0.6785714285714286,PG-13,Eddie RedmayneFelicity JonesTom Prior,Biography,0.8981481481481488,0.2941176470588235
Joy,David O. Russell,0.5056179775280899,0.2878228782287823,0.4821428571428572,PG-13,David O. RussellAnnie Mumolo,Biography,0.9074074074074048,0.2941176470588235
"Extremely Wicked, Shockingly Evil and Vile",Joe Berlinger,0.4606741573033708,0.23616236162361623,0.5,R,Lily CollinsZac EfronAngela Sarafyan,Biography,0.9444444444444429,0.2941176470588235
First Man,Damien Chazelle,0.8202247191011236,0.35055350553505527,0.6071428571428572,PG-13,Ryan GoslingClaire FoyJason Clarke,Biography,0.9351851851851833,0.2941176470588235
Jerry and Marge Go Large,David Frankel,0.4606741573033708,0.18450184501845016,0.5357142857142858,PG-13,Bryan CranstonAnnette BeningRainn Wilson,Biography,0.9722222222222214,0.2941176470588235
Glory,Edward Zwick,0.7528089887640449,0.28044280442804426,0.6964285714285714,R,Kevin JarreLincoln KirsteinPeter Burchard,Biography,0.6666666666666643,0.2941176470588235
The Founder,John Lee Hancock,0.6179775280898877,0.25461254612546125,0.5892857142857144,PG-13,Michael KeatonNick OffermanJohn Carroll Lynch,Biography,0.9166666666666643,0.2941176470588235
Silkwood,Mike Nichols,0.5955056179775281,0.3136531365313653,0.5714285714285714,R,Meryl StreepKurt RussellCher,Biography,0.6111111111111107,0.2941176470588235
Dallas Buyers Club,Jean-Marc Vallée,0.7415730337078652,0.26199261992619927,0.7142857142857144,R,Matthew McConaugheyJennifer GarnerJared Leto,Biography,0.8888888888888893,0.2941176470588235
Blow,Ted Demme,0.4606741573033708,0.2878228782287823,0.642857142857143,R,Johnny DeppPenélope CruzFranka Potente,Biography,0.777777777777775,0.2941176470588235
The Aviator,Martin Scorsese,0.7415730337078652,0.45756457564575637,0.642857142857143,PG-13,Leonardo DiCaprioCate BlanchettKate Beckinsale,Biography,0.8055555555555536,0.2941176470588235
The Highwaymen,John Lee Hancock,0.5280898876404495,0.31734317343173435,0.5357142857142858,R,Kevin CostnerWoody HarrelsonKathy Bates,Biography,0.9444444444444429,0.2941176470588235
Marie Antoinette,Sofia Coppola,0.5955056179775281,0.2841328413284133,0.4642857142857144,PG-13,Kirsten DunstJason SchwartzmanRip Torn,Biography,0.8240740740740726,0.2941176470588235
Spartacus,Stanley Kubrick,0.8539325842696629,0.5571955719557194,0.7142857142857144,PG-13,Dalton TrumboHoward FastPeter Ustinov,Adventure,0.3981481481481488,0.058823529411764705
Raging Bull,Martin Scorsese,0.8876404494382023,0.30627306273062727,0.75,R,Jake LaMottaJoseph CarterPeter Savage,Biography,0.5833333333333321,0.2941176470588235
Bombshell,Jay Roach,0.5955056179775281,0.23247232472324722,0.5178571428571428,R,Charlize TheronNicole KidmanMargot Robbie,Biography,0.9444444444444429,0.2941176470588235
The Basketball Diaries,Scott Kalvert,0.3932584269662921,0.2066420664206642,0.6071428571428572,R,Leonardo DiCaprioLorraine BraccoMarilyn Sokol,Biography,0.7222222222222214,0.2941176470588235
Colonia,Florian Gallenberger,0.24719101123595508,0.23616236162361623,0.5535714285714286,R,Emma WatsonDaniel BrühlMichael Nyqvist,Biography,0.9074074074074048,0.2941176470588235
Richard Jewell,Clint Eastwood,0.6404494382022472,0.3136531365313653,0.642857142857143,R,Billy RayMarie BrennerKent Alexander,Biography,0.9444444444444429,0.2941176470588235
Free State of Jones,Gary Ross,0.4719101123595506,0.34317343173431725,0.5357142857142858,R,Gary RossLeonard Hartman,Action,0.9166666666666643,0.0
Public Enemies,Michael Mann,0.6629213483146067,0.3468634686346863,0.5535714285714286,R,Ronan BennettMichael MannAnn Biderman,Action,0.8518518518518512,0.0
The Hill,Jeff Celentano,0.4157303370786517,0.2952029520295203,0.5,PG,Angelo PizzoScott Marshall SmithBill Chaffin,Biography,0.981481481481481,0.2941176470588235
A Beautiful Day in the Neighborhood,Marielle Heller,0.7752808988764045,0.23247232472324722,0.5892857142857144,PG,Micah Fitzerman-BlueNoah HarpsterTom Junod,Biography,0.9444444444444429,0.2941176470588235
Lone Survivor,Peter Berg,0.550561797752809,0.2767527675276753,0.642857142857143,R,Mark WahlbergTaylor KitschEmile Hirsch,Action,0.8888888888888893,0.0
Everest,Baltasar Kormákur,0.5955056179775281,0.2767527675276753,0.5714285714285714,PG-13,Jason ClarkeAng Phula SherpaThomas M. Wright,Action,0.9074074074074048,0.0
"I, Tonya",Craig Gillespie,0.7415730337078652,0.2693726937269373,0.642857142857143,R,Margot RobbieSebastian StanAllison Janney,Biography,0.9259259259259238,0.2941176470588235
Hachi: A Dog's Tale,Lasse Hallström,0.6179775280898877,0.17343173431734318,0.75,G,Richard GereJoan AllenCary-Hiroyuki Tagawa,Biography,0.8518518518518512,0.2941176470588235
Thirteen Lives,Ron Howard,0.6179775280898877,0.3726937269372693,0.6964285714285714,PG-13,William NicholsonDon MacPherson,Biography,0.9722222222222214,0.2941176470588235
Spotlight,Tom McCarthy,0.9213483146067415,0.30627306273062727,0.75,R,Mark RuffaloMichael KeatonRachel McAdams,Biography,0.9074074074074048,0.2941176470588235
House of Gucci,Ridley Scott,0.5393258426966292,0.41328413284132837,0.4821428571428572,R,Becky JohnstonRoberto BentivegnaSara Gay Forden,Biography,0.9629629629629619,0.2941176470588235
The Pursuit of Happyness,Gabriele Muccino,0.5955056179775281,0.26199261992619927,0.7321428571428572,PG-13,Will SmithThandiwe NewtonJaden Smith,Biography,0.8240740740740726,0.2941176470588235
Argo,Ben Affleck,0.8426966292134831,0.27306273062730624,0.6785714285714286,R,Ben AffleckBryan CranstonJohn Goodman,Biography,0.8796296296296298,0.2941176470588235
Lion,Garth Davis,0.651685393258427,0.2656826568265682,0.7321428571428572,PG-13,Dev PatelNicole KidmanRooney Mara,Biography,0.9166666666666643,0.2941176470588235
Molly's Game,Aaron Sorkin,0.6741573033707865,0.3468634686346863,0.6250000000000002,R,Jessica ChastainIdris ElbaKevin Costner,Biography,0.9259259259259238,0.2941176470588235
12 Years a Slave,Steve McQueen,0.9550561797752809,0.32472324723247226,0.75,R,Chiwetel EjioforMichael Kenneth WilliamsMichael Fassbender,Biography,0.8888888888888893,0.2941176470588235
A Hidden Life,Terrence Malick,0.7752808988764045,0.4723247232472324,0.6250000000000002,PG-13,August DiehlValerie PachnerMaria Simon,Biography,0.9444444444444429,0.2941176470588235
Maestro,Bradley Cooper,0.7415730337078652,0.30627306273062727,0.4642857142857144,R,Carey MulliganBradley CooperMatt Bomer,Biography,0.981481481481481,0.2941176470588235
BlacKkKlansman,Spike Lee,0.8089887640449438,0.3284132841328413,0.642857142857143,R,Charlie WachtelDavid RabinowitzKevin Willmott,Biography,0.9351851851851833,0.2941176470588235
Remember the Titans,Boaz Yakin,0.4157303370786517,0.24723247232472326,0.6964285714285714,PG,Denzel WashingtonWill PattonWood Harris,Biography,0.768518518518519,0.2941176470588235
"Girl, Interrupted",James Mangold,0.449438202247191,0.29889298892988925,0.6071428571428572,R,Susanna KaysenJames MangoldLisa Loomer,Biography,0.7592592592592595,0.2941176470588235
Legend,Brian Helgeland,0.4943820224719101,0.31734317343173435,0.5357142857142858,R,Tom HardyEmily BrowningTaron Egerton,Biography,0.9074074074074048,0.2941176470588235
Lawrence of Arabia,David Lean,1.0,0.6346863468634686,0.7857142857142858,PG,Peter O'TooleAlec GuinnessAnthony Quinn,Adventure,0.4166666666666643,0.058823529411764705
Downfall,Oliver Hirschbiegel,0.7977528089887641,0.40590405904059035,0.7678571428571428,R,Bernd EichingerJoachim FestTraudl Junge,Biography,0.8055555555555536,0.2941176470588235
Rocketman,Dexter Fletcher,0.651685393258427,0.2767527675276753,0.6071428571428572,R,Taron EgertonJamie BellRichard Madden,Biography,0.9444444444444429,0.2941176470588235
Erin Brockovich,Steven Soderbergh,0.6966292134831461,0.3136531365313653,0.6250000000000002,R,Julia RobertsAlbert FinneyDavid Brisbin,Biography,0.768518518518519,0.2941176470588235
Moneyball,Bennett Miller,0.8539325842696629,0.3210332103321033,0.6607142857142858,PG-13,Steven ZaillianAaron SorkinStan Chervin,Biography,0.8703703703703702,0.2941176470588235
Beautiful Boy,Felix van Groeningen,0.5730337078651685,0.27306273062730624,0.6250000000000002,R,Luke DaviesFelix van GroeningenDavid Sheff,Biography,0.9351851851851833,0.2941176470588235
Pain & Gain,Michael Bay,0.3820224719101124,0.30627306273062727,0.4464285714285716,R,Mark WahlbergDwayne JohnsonAnthony Mackie,Action,0.8888888888888893,0.0
Young Woman and the Sea,Joachim Rønning,0.5842696629213483,0.30627306273062727,0.7321428571428572,PG,Daisy RidleyTilda Cobham-HerveyStephen Graham,Biography,0.9907407407407405,0.2941176470588235
American Sniper,Clint Eastwood,0.6966292134831461,0.3210332103321033,0.6071428571428572,R,Jason HallChris KyleScott McEwen,Action,0.8981481481481488,0.0
The Sound of Music,Robert Wise,0.5842696629213483,0.4649446494464944,0.75,G,Georg HurdalekHoward LindsayRussel Crouse,Biography,0.44444444444444287,0.2941176470588235
The King,David Michôd,0.5730337078651685,0.3468634686346863,0.6071428571428572,R,Tom Glynn-CarneyGábor CzapTom Fisher,Biography,0.9444444444444429,0.2941176470588235
The Irishman,Martin Scorsese,0.9325842696629213,0.6014760147601476,0.6964285714285714,R,Robert De NiroAl PacinoJoe Pesci,Biography,0.9444444444444429,0.2941176470588235
Hamilton,Thomas Kail,0.8651685393258427,0.4206642066420664,0.7857142857142858,PG-13,Lin-Manuel MirandaPhillipa SooLeslie Odom Jr.,Biography,0.9537037037037024,0.2941176470588235
Rush,Ron Howard,0.7078651685393259,0.2841328413284133,0.75,R,Daniel BrühlChris HemsworthOlivia Wilde,Action,0.8888888888888893,0.0
American Gangster,Ridley Scott,0.7303370786516854,0.4095940959409594,0.6964285714285714,R,Denzel WashingtonRussell CroweChiwetel Ejiofor,Biography,0.8333333333333321,0.2941176470588235
Into the Wild,Sean Penn,0.6966292134831461,0.3763837638376383,0.75,R,Emile HirschVince VaughnCatherine Keener,Adventure,0.8333333333333321,0.058823529411764705
The Social Network,David Fincher,0.9438202247191011,0.27306273062730624,0.6964285714285714,PG-13,Jesse EisenbergAndrew GarfieldJustin Timberlake,Biography,0.8611111111111107,0.2941176470588235
Cabrini,Alejandro Monteverde,0.449438202247191,0.35424354243542433,0.642857142857143,PG-13,Rod BarrAlejandro Monteverde,Biography,0.9907407407407405,0.2941176470588235
The Beach Boys,Frank Marshall,0.5842696629213483,0.24723247232472326,0.5714285714285714,PG-13,The Beach BoysMike LoveBrian Wilson,Documentary,0.9907407407407405,0.5882352941176471
BlackBerry,Matt Johnson,0.7528089887640449,0.27306273062730624,0.6250000000000002,R,Jacquie McNishSean SilcoffMatt Johnson,Biography,0.981481481481481,0.2941176470588235
Bohemian Rhapsody,Bryan Singer,0.4269662921348315,0.32472324723247226,0.7142857142857144,PG-13,Anthony McCartenPeter Morgan,Biography,0.9351851851851833,0.2941176470588235
City of Lies,Brad Furman,0.3707865168539326,0.24354243542435425,0.4642857142857144,R,Johnny DeppForest WhitakerToby Huss,Biography,0.9351851851851833,0.2941176470588235
Catch Me If You Can,Steven Spielberg,0.7191011235955056,0.35055350553505527,0.75,PG-13,Leonardo DiCaprioTom HanksChristopher Walken,Biography,0.7870370370370345,0.2941176470588235
A Beautiful Mind,Ron Howard,0.6853932584269663,0.3284132841328413,0.7678571428571428,PG-13,Russell CroweEd HarrisJennifer Connelly,Biography,0.777777777777775,0.2941176470588235
The Promised Land,Nikolaj Arcel,0.7415730337078652,0.29889298892988925,0.6785714285714286,R,Mads MikkelsenAmanda CollinSimon Bennebjerg,Action,0.981481481481481,0.0
The Pianist,Roman Polanski,0.8314606741573034,0.3837638376383763,0.8214285714285714,R,Adrien BrodyThomas KretschmannFrank Finlay,Biography,0.7870370370370345,0.2941176470588235
The Favourite,Yorgos Lanthimos,0.8988764044943821,0.2693726937269373,0.642857142857143,R,Olivia ColmanEmma StoneRachel Weisz,Biography,0.9351851851851833,0.2941176470588235
Priscilla,Sofia Coppola,0.7640449438202247,0.24723247232472326,0.4642857142857144,R,Cailee SpaenyJacob ElordiAri Cohen,Biography,0.981481481481481,0.2941176470588235
Elvis,Baz Luhrmann,0.5955056179775281,0.4169741697416973,0.6071428571428572,PG-13,Baz LuhrmannSam BromellCraig Pearce,Biography,0.9722222222222214,0.2941176470588235
The Greatest Showman,Michael Gracey,0.4157303370786517,0.21771217712177118,0.642857142857143,PG,Jenny BicksBill Condon,Biography,0.9259259259259238,0.2941176470588235
Society of the Snow,J.A. Bayona,0.6853932584269663,0.36162361623616235,0.6964285714285714,R,J.A. BayonaBernat VilaplanaJaime Marques,Adventure,0.981481481481481,0.058823529411764705
Hidden Figures,Theodore Melfi,0.7078651685393259,0.29889298892988925,0.6964285714285714,PG,Taraji P. HensonOctavia SpencerJanelle Monáe,Biography,0.9166666666666643,0.2941176470588235
War Dogs,Todd Phillips,0.5168539325842697,0.2509225092250922,0.5714285714285714,R,Stephen ChinTodd PhillipsJason Smilovic,Biography,0.9166666666666643,0.2941176470588235
Sound of Freedom,Alejandro Monteverde,0.2808988764044944,0.3136531365313653,0.6607142857142858,PG-13,Jim CaviezelMira SorvinoBill Camp,Biography,0.981481481481481,0.2941176470588235
The Imitation Game,Morten Tyldum,0.6741573033707865,0.2509225092250922,0.7321428571428572,PG-13,Benedict CumberbatchKeira KnightleyMatthew Goode,Biography,0.8981481481481488,0.2941176470588235
Dumb Money,Craig Gillespie,0.6179775280898877,0.21771217712177118,0.5357142857142858,R,Paul DanoPete DavidsonVincent D'Onofrio,Biography,0.981481481481481,0.2941176470588235
The Big Short,Adam McKay,0.7865168539325843,0.30996309963099633,0.6964285714285714,R,Christian BaleSteve CarellRyan Gosling,Biography,0.9074074074074048,0.2941176470588235
Green Book,Peter Farrelly,0.651685393258427,0.30996309963099633,0.7678571428571428,PG-13,Viggo MortensenMahershala AliLinda Cardellini,Biography,0.9351851851851833,0.2941176470588235
Amadeus,Milos Forman,0.8539325842696629,0.4206642066420664,0.8035714285714286,PG,Peter ShafferZdenek Mahler,Biography,0.6203703703703702,0.2941176470588235
The Boys in the Boat,George Clooney,0.4831460674157303,0.2841328413284133,0.5357142857142858,PG-13,Joel EdgertonCallum TurnerPeter Guinness,Biography,0.981481481481481,0.2941176470588235
Hacksaw Ridge,Mel Gibson,0.6741573033707865,0.34317343173431725,0.75,R,Andrew GarfieldSam WorthingtonLuke Bracey,Biography,0.9166666666666643,0.2941176470588235
Bob Marley: One Love,Reinaldo Marcus Green,0.3595505617977528,0.2250922509225092,0.4285714285714286,PG-13,Terence WinterFrank E. FlowersZach Baylin,Biography,0.9907407407407405,0.2941176470588235
One Life,James Hawes,0.651685393258427,0.23247232472324722,0.642857142857143,PG,Anthony HopkinsLena OlinJohnny Flynn,Biography,0.981481481481481,0.2941176470588235
Tombstone,George P. Cosmatos,0.4382022471910113,0.30996309963099633,0.6964285714285714,R,Kurt RussellVal KilmerSam Elliott,Biography,0.7037037037037024,0.2941176470588235
Braveheart,Mel Gibson,0.6404494382022472,0.48708487084870844,0.7857142857142858,R,Mel GibsonSophie MarceauPatrick McGoohan,Biography,0.7222222222222214,0.2941176470588235
Ford v Ferrari,James Mangold,0.7865168539325843,0.3911439114391143,0.75,PG-13,Matt DamonChristian BaleJon Bernthal,Action,0.9444444444444429,0.0
Schindler's List,Steven Spielberg,0.9438202247191011,0.5498154981549815,0.9107142857142858,R,Liam NeesonRalph FiennesBen Kingsley,Biography,0.7037037037037024,0.2941176470588235
Sight,Andrew Hyatt,0.348314606741573,0.21033210332103322,0.5892857142857144,PG-13,Terry ChenGreg KinnearNatasha Mumba,Biography,0.981481481481481,0.2941176470588235
Dark Waters,Todd Haynes,0.6966292134831461,0.2952029520295203,0.6607142857142858,PG-13,Mark RuffaloAnne HathawayTim Robbins,Biography,0.9444444444444429,0.2941176470588235
Ferrari,Michael Mann,0.6966292134831461,0.30996309963099633,0.4464285714285716,R,Adam DriverShailene WoodleyGiuseppe Festinese,Biography,0.981481481481481,0.2941176470588235
Back to Black,Sam Taylor-Johnson,0.3707865168539326,0.28044280442804426,0.4642857142857144,R,Marisa AbelaEddie MarsanJack O'Connell,Biography,0.9907407407407405,0.2941176470588235
Oppenheimer,Christopher Nolan,0.8876404494382023,0.49446494464944646,0.7857142857142858,R,Cillian MurphyEmily BluntMatt Damon,Biography,0.981481481481481,0.2941176470588235
The Iron Claw,Sean Durkin,0.6966292134831461,0.31734317343173435,0.6607142857142858,R,Zac EfronJeremy Allen WhiteHarris Dickinson,Biography,0.981481481481481,0.2941176470588235
The Room,Christian Volckman,0.6179775280898877,0.1992619926199262,0.375,Not Rated,Christian VolckmanEric ForestierGaia Guasti,Drama,0.9444444444444429,0.4117647058823529
Horse Girl,Jeff Baena,0.5617977528089888,0.21033210332103322,0.375,R,Alison BrieMolly ShannonGoldenite,Drama,0.9537037037037024,0.4117647058823529
The Lego Ninjago Movie,Charlie Bean,0.4943820224719101,0.2029520295202952,0.375,PG,Bob LoganPaul FisherWilliam Wheeler,Animation,0.9259259259259238,0.1176470588235294
Vesper,Kristina Buozyte,0.6629213483146067,0.2509225092250922,0.375,Not Rated,Bruno SamperKristina BuozyteBrian Clark,Adventure,0.9722222222222214,0.058823529411764705
The Last Song,Julie Anne Robinson,0.24719101123595508,0.2250922509225092,0.375,PG,Nicholas SparksJeff Van Wie,Drama,0.8611111111111107,0.4117647058823529
Backcountry,Adam MacDonald,0.5730337078651685,0.16974169741697417,0.375,R,Jeff RoopMissy PeregrymNicholas Campbell,Adventure,0.8981481481481488,0.058823529411764705
Valley of the Dolls,Mark Robson,0.4269662921348315,0.2841328413284133,0.375,PG-13,Barbara ParkinsPatty DukePaul Burke,Drama,0.4629629629629619,0.4117647058823529
Soldier,Paul W.S. Anderson,0.6179775280898877,0.19557195571955718,0.375,R,Kurt RussellJason Scott LeeJason Isaacs,Action,0.75,0.0
13,Géla Babluani,0.20224719101123598,0.16605166051660517,0.375,R,Géla BabluaniGreg Pruss,Crime,0.8611111111111107,0.1764705882352941
Come Undone,Silvio Soldini,0.5617977528089888,0.2952029520295203,0.375,Unrated,Silvio SoldiniDoriana LeondeffAngelo Carbone,Drama,0.8611111111111107,0.4117647058823529
Hope Floats,Forest Whitaker,0.3595505617977528,0.2509225092250922,0.375,PG-13,Sandra BullockHarry Connick Jr.Gena Rowlands,Drama,0.75,0.4117647058823529
The Handmaid's Tale,Volker Schlöndorff,0.4719101123595506,0.2287822878228782,0.375,R,Natasha RichardsonFaye DunawayAidan Quinn,Drama,0.6759259259259238,0.4117647058823529
First Knight,Jerry Zucker,0.5168539325842697,0.32472324723247226,0.375,PG-13,Lorne CameronDavid HoseltonWilliam Nicholson,Action,0.7222222222222214,0.0
The Treacherous,Kyu-dong Min,0.6179775280898877,0.3210332103321033,0.375,Not Rated,Ju Ji-hoonKim Kang-wooLim Ji-yeon,Crime,0.9074074074074048,0.1764705882352941
Made in Italy,James D'Arcy,0.3707865168539326,0.17712177121771214,0.375,R,Yolanda KettleMicheál NeesonSouad Faress,Comedy,0.9537037037037024,0.23529411764705882
The Signal,William Eubank,0.4831460674157303,0.18819188191881916,0.375,PG-13,Brenton ThwaitesOlivia CookeBeau Knapp,Drama,0.8981481481481488,0.4117647058823529
Class,Lewis John Carlino,0.24719101123595508,0.19188191881918817,0.375,R,Jacqueline BissetRob LoweAndrew McCarthy,Comedy,0.6111111111111107,0.23529411764705882
Mr. Malcolm's List,Emma Holly Jones,0.6067415730337079,0.26199261992619927,0.375,PG,Suzanne Allain,Comedy,0.9722222222222214,0.23529411764705882
G.I. Jane,Ridley Scott,0.5730337078651685,0.29151291512915123,0.375,R,Danielle AlexandraDavid Twohy,Action,0.7407407407407405,0.0
My Oni Girl,Tomotaka Shibayama,0.6179775280898877,0.24354243542435425,0.375,TV-PG,Kenshô OnoMiyu TomitaShintarô Asanuma,Animation,0.9907407407407405,0.1176470588235294
Greta,Neil Jordan,0.4831460674157303,0.19188191881918817,0.375,R,Ray WrightNeil Jordan,Drama,0.9351851851851833,0.4117647058823529
Breathless,Jim McBride,0.4606741573033708,0.1992619926199262,0.375,R,L.M. Kit CarsonJim McBrideJean-Luc Godard,Action,0.6111111111111107,0.0
Those Who Wish Me Dead,Taylor Sheridan,0.5393258426966292,0.1992619926199262,0.375,R,Michael KorytaCharles LeavittTaylor Sheridan,Action,0.9629629629629619,0.0
Original Sin,Michael Cristofer,0.24719101123595508,0.2583025830258302,0.375,R,Antonio BanderasAngelina JolieThomas Jane,Drama,0.777777777777775,0.4117647058823529
Never Been Kissed,Raja Gosnell,0.550561797752809,0.2250922509225092,0.375,PG-13,Drew BarrymoreDavid ArquetteMichael Vartan,Comedy,0.7592592592592595,0.23529411764705882
The Gambler,Rupert Wyatt,0.4943820224719101,0.23985239852398524,0.375,R,Mark WahlbergJessica LangeJohn Goodman,Crime,0.8981481481481488,0.1764705882352941
See You on Venus,Joaquín Llamas,0.6179775280898877,0.2594095940959409,0.375,R,Virginia GardnerAlex AionoRob Estes,Drama,0.981481481481481,0.4117647058823529
The Lodge,Severin Fiala,0.5955056179775281,0.2287822878228782,0.375,R,Riley KeoughJaeden MartellLia McHugh,Drama,0.9444444444444429,0.4117647058823529
Free Willy,Simon Wincer,0.7640449438202247,0.24354243542435425,0.375,PG,Keith WalkerCorey Blechman,Adventure,0.7037037037037024,0.058823529411764705
Rebecca,Ben Wheatley,0.3932584269662921,0.2841328413284133,0.375,PG-13,Jane GoldmanJoe ShrapnelAnna Waterhouse,Drama,0.9537037037037024,0.4117647058823529
The Substitute,Robert Mandel,0.3370786516853933,0.2509225092250922,0.375,R,Tom BerengerRaymond CruzWilliam Forsythe,Action,0.731481481481481,0.0
Becky,Jonathan Milott,0.4831460674157303,0.17343173431734318,0.375,R,Lulu WilsonKevin JamesJoel McHale,Action,0.9537037037037024,0.0
Dream House,Jim Sheridan,0.2696629213483146,0.16974169741697417,0.375,PG-13,Daniel CraigRachel WeiszNaomi Watts,Drama,0.8703703703703702,0.4117647058823529
Cat Person,Susanna Fogel,0.4157303370786517,0.2656826568265682,0.375,R,Emilia JonesNicholas BraunGeraldine Viswanathan,Drama,0.981481481481481,0.4117647058823529
Taken 3,Olivier Megaton,0.16853932584269662,0.2287822878228782,0.375,PG-13,Luc BessonRobert Mark Kamen,Action,0.8981481481481488,0.0
Joe Dirt,Dennie Gordon,0.10112359550561797,0.16605166051660517,0.375,PG-13,David SpadeBrittany DanielDennis Miller,Adventure,0.777777777777775,0.058823529411764705
Haunted Mansion,Justin Simien,0.4044943820224719,0.2841328413284133,0.375,PG-13,LaKeith StanfieldRosario DawsonOwen Wilson,Comedy,0.981481481481481,0.23529411764705882
Shallow Hal,Bobby Farrelly,0.4157303370786517,0.2509225092250922,0.375,PG-13,Jack BlackGwyneth PaltrowJason Alexander,Comedy,0.777777777777775,0.23529411764705882
Intimacy,Patrice Chéreau,0.651685393258427,0.2693726937269373,0.375,Unrated,Mark RylanceKerry FoxSusannah Harker,Drama,0.777777777777775,0.4117647058823529
Fast Charlie,Phillip Noyce,0.6067415730337079,0.2594095940959409,0.375,R,Pierce BrosnanMorena BaccarinJames Caan,Action,0.981481481481481,0.0
Ruby Red,Felix Fuchssteiner,0.6179775280898877,0.2594095940959409,0.375,R,Josefine PreußFlorian BartholomäiUwe Kockisch,Action,0.8888888888888893,0.0
Indecent Proposal,Adrian Lyne,0.3820224719101124,0.26199261992619927,0.375,R,Robert RedfordDemi MooreWoody Harrelson,Drama,0.7037037037037024,0.4117647058823529
