Title,Director,MetaScore,Duration (minutes),IMDb Rating,Certificates,Star Cast,Genre,Year,Genre Value
1900,Bernardo Bertolucci,0.6629213483146067,0.9999999999999999,0.6607142857142858,Unrated,Robert De NiroGérard DepardieuDominique Sanda,Drama,0.5462962962962941,0.4117647058823529
Defiance,Edward Zwick,0.5280898876404495,0.33579335793357934,0.5714285714285714,R,Daniel CraigLiev SchreiberJamie Bell,Action,0.8425925925925917,0.0
Tora! Tora! Tora!,Richard Fleischer,0.3932584269662921,0.36162361623616235,0.642857142857143,G,Richard FleischerKinji FukasakuToshio Masuda,Action,0.4907407407407405,0.0
The World to Come,Mona Fastvold,0.6966292134831461,0.21771217712177118,0.4464285714285716,R,Ron HansenJim Shepard,Drama,0.9537037037037024,0.4117647058823529
Flyboys,Tony Bill,0.4044943820224719,0.3468634686346863,0.4642857142857144,PG-13,Phil SearsBlake T. EvansDavid S. Ward,Action,0.8240740740740726,0.0
Letters from Iwo Jima,Clint Eastwood,0.8764044943820225,0.35055350553505527,0.6964285714285714,R,Iris YamashitaPaul HaggisTadamichi Kuribayashi,Action,0.8240740740740726,0.0
The Water Diviner,Russell Crowe,0.4382022471910113,0.23985239852398524,0.5535714285714286,R,Russell CroweOlga KurylenkoJai Courtney,Drama,0.8981481481481488,0.4117647058823529
A Passage to India,David Lean,0.7528089887640449,0.4354243542435424,0.6071428571428572,PG,E.M. ForsterSantha Rama RauDavid Lean,Adventure,0.6203703703703702,0.058823529411764705
The Peasants,DK Welchman,0.5617977528089888,0.2509225092250922,0.6785714285714286,R,Kamila UrzedowskaRobert GulaczykMiroslaw Baka,Animation,0.981481481481481,0.1176470588235294
Ammonite,Francis Lee,0.6853932584269663,0.26199261992619927,0.4642857142857144,R,Kate WinsletSaoirse RonanGemma Jones,Drama,0.9537037037037024,0.4117647058823529
Thirteen Days,Roger Donaldson,0.6292134831460674,0.3653136531365313,0.6071428571428572,PG-13,Kevin CostnerBruce GreenwoodShawn Driscoll,Drama,0.768518518518519,0.4117647058823529
Cool Runnings,Jon Turteltaub,0.550561797752809,0.19188191881918817,0.5535714285714286,PG,Lynn SiefertMichael RitchieTommy Swerdlow,Adventure,0.7037037037037024,0.058823529411764705
The Way Back,Peter Weir,0.6179775280898877,0.3210332103321033,0.6071428571428572,PG-13,Jim SturgessEd HarrisColin Farrell,Adventure,0.8611111111111107,0.058823529411764705
Anthropoid,Sean Ellis,0.5393258426966292,0.27306273062730624,0.5892857142857144,R,Jamie DornanCillian MurphyBrian Caspe,Action,0.9166666666666643,0.0
All the Money in the World,Ridley Scott,0.6853932584269663,0.31734317343173435,0.5178571428571428,R,Michelle WilliamsChristopher PlummerMark Wahlberg,Crime,0.9259259259259238,0.1764705882352941
All the President's Men,Alan J. Pakula,0.8202247191011236,0.3394833948339483,0.7142857142857144,PG,Dustin HoffmanRobert RedfordJack Warden,Drama,0.5462962962962941,0.4117647058823529
The Mission,Roland Joffé,0.4943820224719101,0.29151291512915123,0.6250000000000002,PG,Robert De NiroJeremy IronsRay McAnally,Adventure,0.6388888888888893,0.058823529411764705
She Said,Maria Schrader,0.6179775280898877,0.30627306273062727,0.6071428571428572,R,Rebecca LenkiewiczJodi KantorMegan Twohey,Drama,0.9722222222222214,0.4117647058823529
Across the Universe,Julie Taymor,0.5056179775280899,0.3210332103321033,0.6071428571428572,PG-13,Dick ClementIan La FrenaisJulie Taymor,Drama,0.8333333333333321,0.4117647058823529
The Longest Day,Ken Annakin,0.7191011235955056,0.48708487084870844,0.6785714285714286,G,Ken AnnakinAndrew MartonGerd Oswald,Action,0.4166666666666643,0.0
Newsies,Kenny Ortega,0.3932584269662921,0.2767527675276753,0.5357142857142858,PG,Christian BaleBill PullmanRobert Duvall,Drama,0.6944444444444429,0.4117647058823529
A Bridge Too Far,Richard Attenborough,0.5842696629213483,0.47601476014760147,0.6250000000000002,PG,Sean ConneryRyan O'NealMichael Caine,Drama,0.5555555555555536,0.4117647058823529
Gettysburg,Ron Maxwell,0.6179775280898877,0.8302583025830258,0.6607142857142858,PG,Tom BerengerMartin SheenStephen Lang,Drama,0.7037037037037024,0.4117647058823529
"Lust, Caution",Ang Lee,0.5617977528089888,0.4095940959409594,0.642857142857143,NC-17,Tony Leung Chiu-waiTang WeiJoan Chen,Drama,0.8333333333333321,0.4117647058823529
The Trial of the Chicago 7,Aaron Sorkin,0.7303370786516854,0.30627306273062727,0.6785714285714286,R,Eddie RedmayneAlex SharpSacha Baron Cohen,Drama,0.9537037037037024,0.4117647058823529
The 13th Warrior,John McTiernan,0.348314606741573,0.2066420664206642,0.4821428571428572,R,Antonio BanderasDiane VenoraDennis Storhøi,Action,0.7592592592592595,0.0
Hotel Mumbai,Anthony Maras,0.5730337078651685,0.2841328413284133,0.6607142857142858,R,Dev PatelArmie HammerNazanin Boniadi,Action,0.9351851851851833,0.0
The Finest Hours,Craig Gillespie,0.5280898876404495,0.26199261992619927,0.5,PG-13,Scott SilverPaul TamasyEric Johnson,Action,0.9166666666666643,0.0
The Outpost,Rod Lurie,0.6741573033707865,0.2841328413284133,0.5178571428571428,R,Scott EastwoodCaleb Landry JonesOrlando Bloom,Action,0.9444444444444429,0.0
Escape from Germany,T.C. Christensen,0.6179775280898877,0.18819188191881916,0.6250000000000002,PG,Sebastian BarrJoseph BatzelIscha Bee,Drama,0.9907407407407405,0.4117647058823529
Boston Strangler,Matt Ruskin,0.5280898876404495,0.24354243542435425,0.4642857142857144,R,Keira KnightleyCarrie CoonChris Cooper,Crime,0.981481481481481,0.1764705882352941
The Bounty,Roger Donaldson,0.5730337078651685,0.31734317343173435,0.5535714285714286,PG,Mel GibsonAnthony HopkinsLaurence Olivier,Adventure,0.6203703703703702,0.058823529411764705
Origin,Ava DuVernay,0.7191011235955056,0.35055350553505527,0.5892857142857144,PG-13,Aunjanue Ellis-TaylorJon BernthalNiecy Nash,Drama,0.981481481481481,0.4117647058823529
Patriots Day,Peter Berg,0.651685393258427,0.3210332103321033,0.6071428571428572,R,Peter BergMatt CookJoshua Zetumer,Action,0.9166666666666643,0.0
Valkyrie,Bryan Singer,0.5056179775280899,0.2767527675276753,0.5714285714285714,PG-13,Tom CruiseBill NighyCarice van Houten,Drama,0.8425925925925917,0.4117647058823529
Shakespeare in Love,John Madden,0.8539325842696629,0.2841328413284133,0.5714285714285714,R,Gwyneth PaltrowJoseph FiennesGeoffrey Rush,Comedy,0.75,0.23529411764705882
Deepwater Horizon,Peter Berg,0.6404494382022472,0.2250922509225092,0.5714285714285714,PG-13,Matthew Michael CarnahanMatthew SandDavid Barstow,Action,0.9166666666666643,0.0
Bridge of Spies,Steven Spielberg,0.7865168539325843,0.35424354243542433,0.6607142857142858,PG-13,Tom HanksMark RylanceAlan Alda,Drama,0.9074074074074048,0.4117647058823529
JFK,Oliver Stone,0.6853932584269663,0.5276752767527675,0.7321428571428572,R,Jim GarrisonJim MarrsOliver Stone,Drama,0.6851851851851833,0.4117647058823529
The Woman King,Gina Prince-Bythewood,0.7303370786516854,0.3284132841328413,0.5357142857142858,PG-13,Dana StevensMaria Bello,Action,0.9722222222222214,0.0
Silence,Martin Scorsese,0.7640449438202247,0.42435424354243534,0.5892857142857144,R,Andrew GarfieldAdam DriverLiam Neeson,Drama,0.9166666666666643,0.4117647058823529
The Ten Commandments,Cecil B. DeMille,0.6179775280898877,0.6420664206642066,0.7142857142857144,G,Dorothy Clarke WilsonJ.H. IngrahamA.E. Southon,Adventure,0.3611111111111107,0.058823529411764705
Greyhound,Aaron Schneider,0.5955056179775281,0.16605166051660517,0.5535714285714286,PG-13,Tom HanksElisabeth ShueStephen Graham,Action,0.9537037037037024,0.0
The Master,Paul Thomas Anderson,0.8426966292134831,0.3394833948339483,0.5714285714285714,R,Joaquin PhoenixPhilip Seymour HoffmanAmy Adams,Drama,0.8796296296296298,0.4117647058823529
We Were Soldiers,Randall Wallace,0.6067415730337079,0.3394833948339483,0.5892857142857144,R,Mel GibsonMadeleine StoweGreg Kinnear,Action,0.7870370370370345,0.0
12 Strong,Nicolai Fuglsig,0.4831460674157303,0.30996309963099633,0.4642857142857144,R,Chris HemsworthMichael ShannonMichael Peña,Action,0.9351851851851833,0.0
The Thin Red Line,Terrence Malick,0.7528089887640449,0.45756457564575637,0.6607142857142858,R,Jim CaviezelSean PennNick Nolte,Drama,0.75,0.4117647058823529
The Death of Stalin,Armando Iannucci,0.8651685393258427,0.2250922509225092,0.6071428571428572,R,Fabien NuryThierry RobinArmando Iannucci,Comedy,0.9259259259259238,0.23529411764705882
The Patriot,Roland Emmerich,0.5842696629213483,0.4391143911439114,0.5892857142857144,R,Mel GibsonHeath LedgerJoely Richardson,Action,0.768518518518519,0.0
13 Hours: The Secret Soldiers of Benghazi,Michael Bay,0.4157303370786517,0.36162361623616235,0.6071428571428572,R,John KrasinskiPablo SchreiberJames Badge Dale,Action,0.9166666666666643,0.0
The Long Game,Julio Quintana,0.6067415730337079,0.24354243542435425,0.4821428571428572,PG,Jennifer C. StetsonPaco FariasJulio Quintana,Drama,0.981481481481481,0.4117647058823529
Munich,Steven Spielberg,0.7078651685393259,0.4354243542435424,0.642857142857143,R,Eric BanaDaniel CraigMarie-Josée Croze,Action,0.8148148148148131,0.0
Amsterdam,David O. Russell,0.4157303370786517,0.32472324723247226,0.3928571428571428,R,Christian BaleMargot RobbieJohn David Washington,Comedy,0.9722222222222214,0.23529411764705882
The Beguiled,Sofia Coppola,0.7415730337078652,0.17343173431734318,0.4285714285714286,R,Sofia CoppolaThomas CullinanAlbert Maltz,Drama,0.9259259259259238,0.4117647058823529
Apollo 13,Ron Howard,0.7528089887640449,0.3468634686346863,0.6785714285714286,PG,Jim LovellJeffrey KlugerWilliam Broyles Jr.,Adventure,0.7222222222222214,0.058823529411764705
Robin Hood,Ridley Scott,0.4719101123595506,0.3468634686346863,0.4821428571428572,PG-13,Brian HelgelandEthan ReiffCyrus Voris,Action,0.8611111111111107,0.0
The Last Duel,Ridley Scott,0.6292134831460674,0.3911439114391143,0.6250000000000002,R,Nicole HolofcenerBen AffleckMatt Damon,Action,0.9629629629629619,0.0
Dunkirk,Christopher Nolan,0.9325842696629213,0.2214022140221402,0.6964285714285714,PG-13,Fionn WhiteheadBarry KeoghanMark Rylance,Action,0.9259259259259238,0.0
The Impossible,J.A. Bayona,0.6966292134831461,0.2509225092250922,0.642857142857143,PG-13,Naomi WattsEwan McGregorTom Holland,Drama,0.8796296296296298,0.4117647058823529
Black Hawk Down,Ridley Scott,0.7078651685393259,0.36162361623616235,0.6785714285714286,R,Josh HartnettEwan McGregorTom Sizemore,Action,0.777777777777775,0.0
The Taste of Things,Anh Hung Tran,0.8314606741573034,0.3284132841328413,0.642857142857143,PG-13,Juliette BinocheBenoît MagimelEmmanuel Salinger,Drama,0.981481481481481,0.4117647058823529
1917,Sam Mendes,0.7528089887640449,0.2693726937269373,0.7678571428571428,R,Dean-Charles ChapmanGeorge MacKayDaniel Mays,Action,0.9444444444444429,0.0
Zero Dark Thirty,Kathryn Bigelow,0.9438202247191011,0.4095940959409594,0.6250000000000002,R,Jessica ChastainJoel EdgertonChris Pratt,Drama,0.8796296296296298,0.4117647058823529
Babylon,Damien Chazelle,0.5617977528089888,0.5276752767527675,0.5714285714285714,R,Brad PittMargot RobbieJean Smart,Comedy,0.9722222222222214,0.23529411764705882
The Zone of Interest,Jonathan Glazer,0.9101123595505617,0.21771217712177118,0.6250000000000002,PG-13,Christian FriedelSandra HüllerJohann Karthaus,Drama,0.981481481481481,0.4117647058823529
Teri Baaton Mein Aisa Uljha Jiya,Amit Joshi,0.6179775280898877,0.2594095940959409,0.4285714285714286,R,Shahid KapoorKriti SanonDharmendra,Comedy,0.9907407407407405,0.23529411764705882
Wreck-It Ralph,Rich Moore,0.6853932584269663,0.2029520295202952,0.6785714285714286,PG,Rich MoorePhil JohnstonJim Reardon,Animation,0.8796296296296298,0.1176470588235294
Sky High,Mike Mitchell,0.5730337078651685,0.1992619926199262,0.4285714285714286,PG,Kurt RussellKelly PrestonMichael Angarano,Action,0.8148148148148131,0.0
The Lego Movie,Phil Lord,0.8089887640449438,0.1992619926199262,0.6785714285714286,PG,Phil LordChristopher MillerDan Hageman,Animation,0.8981481481481488,0.1176470588235294
The Return of the Living Dead,Dan O'Bannon,0.6179775280898877,0.16605166051660517,0.6071428571428572,R,Rudy RicciJohn A. RussoRussell Streiner,Comedy,0.6296296296296298,0.23529411764705882
Mars Attacks!,Tim Burton,0.4606741573033708,0.2214022140221402,0.4464285714285716,PG-13,Len BrownWoody GelmanWally Wood,Comedy,0.731481481481481,0.23529411764705882
Robots,Chris Wedge,0.5955056179775281,0.16605166051660517,0.4464285714285716,PG,David Lindsay-AbaireLowell GanzBabaloo Mandel,Animation,0.8148148148148131,0.1176470588235294
Incredibles 2,Brad Bird,0.7752808988764045,0.2656826568265682,0.642857142857143,PG,Craig T. NelsonHolly HunterSarah Vowell,Animation,0.9351851851851833,0.1176470588235294
Lilo & Stitch,Dean DeBlois,0.7078651685393259,0.1439114391143911,0.6071428571428572,PG,Chris SandersDean DeBlois,Animation,0.7870370370370345,0.1176470588235294
Minions,Kyle Balda,0.5056179775280899,0.16605166051660517,0.4464285714285716,PG,Sandra BullockJon HammMichael Keaton,Animation,0.9074074074074048,0.1176470588235294
Ghostbusters II,Ivan Reitman,0.5056179775280899,0.2287822878228782,0.4821428571428572,PG,Dan AykroydHarold Ramis,Action,0.6666666666666643,0.0
Big Hero 6,Don Hall,0.7078651685393259,0.2066420664206642,0.6964285714285714,PG,Jordan RobertsRobert L. BairdDaniel Gerson,Animation,0.8981481481481488,0.1176470588235294
Guardians of the Galaxy Vol. 2,James Gunn,0.6292134831460674,0.3321033210332103,0.6607142857142858,PG-13,James GunnDan AbnettAndy Lanning,Action,0.9259259259259238,0.0
The Adam Project,Shawn Levy,0.4943820224719101,0.2214022140221402,0.5,PG-13,Jonathan TropperT.S. NowlinJennifer Flackett,Action,0.9722222222222214,0.0
Time Bandits,Terry Gilliam,0.7640449438202247,0.23616236162361623,0.5357142857142858,PG,Sean ConneryShelley DuvallJohn Cleese,Adventure,0.5925925925925917,0.058823529411764705
"Honey, I Shrunk the Kids",Joe Johnston,0.5842696629213483,0.17343173431734318,0.4464285714285716,PG,Stuart GordonBrian YuznaEd Naha,Adventure,0.6666666666666643,0.058823529411764705
Paul,Greg Mottola,0.5168539325842697,0.21402214022140217,0.5357142857142858,R,Simon PeggNick FrostSeth Rogen,Adventure,0.8703703703703702,0.058823529411764705
Ant-Man and the Wasp: Quantumania,Peyton Reed,0.4157303370786517,0.2878228782287823,0.3928571428571428,PG-13,Jeff LovenessStan LeeLarry Lieber,Action,0.981481481481481,0.0
Teenage Mutant Ninja Turtles,Steve Barron,0.449438202247191,0.17343173431734318,0.5178571428571428,PG,Kevin EastmanPeter LairdBobby Herbeck,Action,0.6759259259259238,0.0
Death Race 2000,Paul Bartel,0.5280898876404495,0.12546125461254612,0.4107142857142858,R,David CarradineSylvester StalloneSimone Griffeth,Action,0.5370370370370345,0.0
Galaxy Quest,Dean Parisot,0.6629213483146067,0.2066420664206642,0.6250000000000002,PG,David HowardRobert Gordon,Adventure,0.7592592592592595,0.058823529411764705
Spaceballs,Mel Brooks,0.3932584269662921,0.18450184501845016,0.5714285714285714,PG,Mel BrooksJohn CandyRick Moranis,Adventure,0.6481481481481488,0.058823529411764705
Back to the Future Part II,Robert Zemeckis,0.5168539325842697,0.2287822878228782,0.6964285714285714,PG,Robert ZemeckisBob Gale,Adventure,0.6666666666666643,0.058823529411764705
Men in Black,Barry Sonnenfeld,0.6853932584269663,0.19188191881918817,0.6071428571428572,PG-13,Lowell CunninghamEd Solomon,Action,0.7407407407407405,0.0
Spider-Man: Far from Home,Jon Watts,0.651685393258427,0.30627306273062727,0.6250000000000002,PG-13,Chris McKennaErik SommersStan Lee,Action,0.9444444444444429,0.0
Thor: Ragnarok,Taika Waititi,0.7078651685393259,0.30996309963099633,0.7142857142857144,PG-13,Eric PearsonCraig KyleChristopher L. Yost,Action,0.9259259259259238,0.0
Don't Look Up,Adam McKay,0.4269662921348315,0.3394833948339483,0.5892857142857144,R,Adam McKayDavid Sirota,Comedy,0.9629629629629619,0.23529411764705882
Weird Science,John Hughes,0.3932584269662921,0.17712177121771214,0.4821428571428572,PG-13,Anthony Michael HallIlan Mitchell-SmithKelly LeBrock,Comedy,0.6296296296296298,0.23529411764705882
Guardians of the Galaxy,James Gunn,0.7303370786516854,0.2767527675276753,0.7321428571428572,PG-13,James GunnNicole PerlmanDan Abnett,Action,0.8981481481481488,0.0
Thor: Love and Thunder,Taika Waititi,0.5168539325842697,0.2656826568265682,0.4107142857142858,PG-13,Taika WaititiJennifer Kaytin RobinsonStan Lee,Action,0.9722222222222214,0.0
Asteroid City,Wes Anderson,0.7303370786516854,0.21771217712177118,0.4642857142857144,PG-13,Wes AndersonRoman Coppola,Comedy,0.981481481481481,0.23529411764705882
Free Guy,Shawn Levy,0.5730337078651685,0.25461254612546125,0.5714285714285714,PG-13,Matt LiebermanZak Penn,Action,0.9629629629629619,0.0
Guardians of the Galaxy Vol. 3,James Gunn,0.5955056179775281,0.3837638376383763,0.7142857142857144,PG-13,James GunnJim StarlinStan Lee,Action,0.981481481481481,0.0
The Suicide Squad,James Gunn,0.6853932584269663,0.31734317343173435,0.5892857142857144,R,Margot RobbieIdris ElbaJohn Cena,Action,0.9629629629629619,0.0
Back to the Future,Robert Zemeckis,0.8539325842696629,0.2583025830258302,0.8214285714285714,PG,Michael J. FoxChristopher LloydLea Thompson,Adventure,0.6296296296296298,0.058823529411764705
Idiocracy,Mike Judge,0.6179775280898877,0.1402214022140221,0.4642857142857144,R,Mike JudgeEtan Cohen,Adventure,0.8240740740740726,0.058823529411764705
21 Jump Street,Phil Lord,0.651685393258427,0.23247232472324722,0.5892857142857144,R,Michael BacallJonah HillPatrick Hasburgh,Action,0.8796296296296298,0.0
"Lock, Stock and Two Smoking Barrels",Guy Ritchie,0.6292134831460674,0.2250922509225092,0.75,R,Jason FlemyngDexter FletcherNick Moran,Action,0.75,0.0
Hundreds of Beavers,Mike Cheslik,0.7752808988764045,0.2594095940959409,0.6964285714285714,R,Ryland Brickson Cole TewsOlivia GravesWes Tank,Action,0.9722222222222214,0.0
The Man from U.N.C.L.E.,Guy Ritchie,0.5056179775280899,0.2583025830258302,0.5892857142857144,PG-13,Guy RitchieLionel WigramJeff Kleeman,Action,0.9074074074074048,0.0
Smokey and the Bandit,Hal Needham,0.4382022471910113,0.18450184501845016,0.5535714285714286,PG,Hal NeedhamRobert L. LevyJames Lee Barrett,Action,0.5555555555555536,0.0
Mr. & Mrs. Smith,Doug Liman,0.4943820224719101,0.27306273062730624,0.4642857142857144,PG-13,Brad PittAngelina JolieAdam Brody,Action,0.8148148148148131,0.0
Kick-Ass,Matthew Vaughn,0.6179775280898877,0.26199261992619927,0.6607142857142858,R,Jane GoldmanMatthew VaughnMark Millar,Action,0.8611111111111107,0.0
Tropic Thunder,Ben Stiller,0.6741573033707865,0.2250922509225092,0.5714285714285714,R,Justin TherouxBen StillerEtan Cohen,Action,0.8425925925925917,0.0
Scott Pilgrim vs. the World,Edgar Wright,0.651685393258427,0.24354243542435425,0.6607142857142858,PG-13,Michael CeraMary Elizabeth WinsteadKieran Culkin,Action,0.8611111111111107,0.0
The Mask,Chuck Russell,0.5393258426966292,0.2029520295202952,0.5357142857142858,PG-13,Jim CarreyCameron DiazPeter Riegert,Action,0.7129629629629619,0.0
Jumanji: The Next Level,Jake Kasdan,0.5280898876404495,0.2841328413284133,0.5,PG-13,Jake KasdanJeff PinknerScott Rosenberg,Action,0.9444444444444429,0.0
Jumanji: Welcome to the Jungle,Jake Kasdan,0.5280898876404495,0.2693726937269373,0.5535714285714286,PG-13,Chris McKennaErik SommersScott Rosenberg,Action,0.9259259259259238,0.0
The Unbearable Weight of Massive Talent,Tom Gormican,0.6404494382022472,0.2250922509225092,0.5535714285714286,R,Nicolas CagePedro PascalTiffany Haddish,Action,0.9722222222222214,0.0
Ocean's Eight,Gary Ross,0.5617977528089888,0.23616236162361623,0.4285714285714286,PG-13,Gary RossOlivia MilchGeorge Clayton Johnson,Action,0.9351851851851833,0.0
Kingsman: The Secret Service,Matthew Vaughn,0.550561797752809,0.30627306273062727,0.6785714285714286,R,Jane GoldmanMatthew VaughnMark Millar,Action,0.8981481481481488,0.0
The Nice Guys,Shane Black,0.6629213483146067,0.2583025830258302,0.6250000000000002,R,Russell CroweRyan GoslingAngourie Rice,Action,0.9166666666666643,0.0
Bad Boys for Life,Adil El Arbi,0.5393258426966292,0.2878228782287823,0.4642857142857144,R,Peter CraigJoe CarnahanChris Bremner,Action,0.9537037037037024,0.0
Operation Fortune: Ruse de Guerre,Guy Ritchie,0.449438202247191,0.2509225092250922,0.4285714285714286,R,Jason StathamAubrey PlazaCary Elwes,Action,0.981481481481481,0.0
Bad Boys,Michael Bay,0.3370786516853933,0.2693726937269373,0.5178571428571428,R,George GalloMichael BarrieJim Mulholland,Action,0.7222222222222214,0.0
The Family Plan,Simon Cellan Jones,0.3146067415730337,0.2656826568265682,0.4285714285714286,PG-13,Mark WahlbergMichelle MonaghanCiarán Hinds,Action,0.981481481481481,0.0
Dungeons & Dragons: Honor Among Thieves,John Francis Daley,0.6853932584269663,0.32472324723247226,0.5892857142857144,PG-13,Jonathan GoldsteinJohn Francis DaleyMichael Gilio,Action,0.981481481481481,0.0
Aavesham,Jithu Madhavan,0.6179775280898877,0.2594095940959409,0.7321428571428572,R,Fahadh FaasilHipzsterMithun Jai Shankar,Action,0.9907407407407405,0.0
Fright Night,Craig Gillespie,0.5955056179775281,0.2214022140221402,0.4464285714285716,R,Marti NoxonTom Holland,Action,0.8703703703703702,0.0
See How They Run,Tom George,0.550561797752809,0.19188191881918817,0.4642857142857144,PG-13,Kieran HodgsonPearl ChandaGregory Cox,Comedy,0.9722222222222214,0.23529411764705882
Odd Thomas,Stephen Sommers,0.3820224719101124,0.18819188191881916,0.5178571428571428,PG-13,Anton YelchinAshley SommersLeonor Varela,Comedy,0.8888888888888893,0.23529411764705882
The Losers,Sylvain White,0.3707865168539326,0.18819188191881916,0.4107142857142858,PG-13,Peter BergJames VanderbiltAndy Diggle,Action,0.8611111111111107,0.0
The One I Love,Charlie McDowell,0.6179775280898877,0.16605166051660517,0.5535714285714286,R,Mark DuplassElisabeth MossTed Danson,Comedy,0.8981481481481488,0.23529411764705882
Horns,Alexandre Aja,0.3932584269662921,0.27306273062730624,0.4464285714285716,R,Daniel RadcliffeJuno TempleMax Minghella,Comedy,0.8888888888888893,0.23529411764705882
Fletch,Michael Ritchie,0.6404494382022472,0.19188191881918817,0.5357142857142858,PG,Chevy ChaseJoe Don BakerDana Wheeler-Nicholson,Comedy,0.6296296296296298,0.23529411764705882
Gosford Park,Robert Altman,0.8876404494382023,0.33579335793357934,0.5892857142857144,R,Maggie SmithRyan PhillippeMichael Gambon,Comedy,0.777777777777775,0.23529411764705882
Charade,Stanley Donen,0.8089887640449438,0.24723247232472326,0.6964285714285714,Approved,Peter StoneMarc Behm,Comedy,0.4259259259259238,0.23529411764705882
Boss Level,Joe Carnahan,0.5056179775280899,0.1992619926199262,0.5178571428571428,TV-MA,Chris BoreyEddie BoreyJoe Carnahan,Action,0.9537037037037024,0.0
Super Troopers,Jay Chandrasekhar,0.4157303370786517,0.1992619926199262,0.5535714285714286,R,Jay ChandrasekharKevin HeffernanSteve Lemme,Comedy,0.777777777777775,0.23529411764705882
Spenser Confidential,Peter Berg,0.4269662921348315,0.23985239852398524,0.4107142857142858,R,Sean O'KeefeBrian HelgelandRobert B. Parker,Action,0.9537037037037024,0.0
Murder Mystery,Kyle Newacheck,0.3033707865168539,0.18819188191881916,0.375,PG-13,Adam SandlerJennifer AnistonLuke Evans,Action,0.9444444444444429,0.0
The 'Burbs,Joe Dante,0.3820224719101124,0.2066420664206642,0.5178571428571428,PG,Tom HanksBruce DernCarrie Fisher,Comedy,0.6666666666666643,0.23529411764705882
Kiss Kiss Bang Bang,Shane Black,0.6966292134831461,0.21033210332103322,0.642857142857143,R,Brett HallidayShane Black,Comedy,0.8148148148148131,0.23529411764705882
Chungking Express,Kar-Wai Wong,0.7528089887640449,0.2066420664206642,0.7321428571428572,PG-13,Brigitte LinTakeshi KaneshiroTony Leung Chiu-wai,Comedy,0.7129629629629619,0.23529411764705882
Happy Death Day,Christopher Landon,0.5280898876404495,0.18450184501845016,0.4821428571428572,PG-13,Jessica RotheIsrael BroussardRuby Modine,Comedy,0.9259259259259238,0.23529411764705882
They Cloned Tyrone,Juel Taylor,0.7078651685393259,0.28044280442804426,0.4821428571428572,R,John BoyegaJamie FoxxTeyonah Parris,Comedy,0.981481481481481,0.23529411764705882
Scream 4,Wes Craven,0.4606741573033708,0.23985239852398524,0.4107142857142858,R,Kevin Williamson,Comedy,0.8703703703703702,0.23529411764705882
Inherent Vice,Paul Thomas Anderson,0.7865168539325843,0.3763837638376383,0.4821428571428572,R,Joaquin PhoenixJosh BrolinOwen Wilson,Comedy,0.8981481481481488,0.23529411764705882
City Hunter,Yûichi Satô,0.6179775280898877,0.2066420664206642,0.4285714285714286,TV-MA,Ryohei SuzukiMisato MoritaMasanobu Andô,Action,0.9907407407407405,0.0
Palm Springs,Max Barbakow,0.8089887640449438,0.16236162361623616,0.6250000000000002,R,Andy SiaraMax Barbakow,Comedy,0.9537037037037024,0.23529411764705882
Clue,Jonathan Lynn,0.3370786516853933,0.17712177121771214,0.5892857142857144,PG,John LandisJonathan LynnAnthony E. Pratt,Comedy,0.6296296296296298,0.23529411764705882
Hot Fuzz,Edgar Wright,0.7865168539325843,0.2767527675276753,0.6964285714285714,R,Simon PeggNick FrostMartin Freeman,Action,0.8333333333333321,0.0
Mr. Monk's Last Case: A Monk Movie,Randy Zisk,0.6067415730337079,0.18819188191881916,0.5,TV-PG,Andy Breckman,Comedy,0.981481481481481,0.23529411764705882
The Ballad of Buster Scruggs,Ethan Coen,0.7640449438202247,0.3210332103321033,0.5892857142857144,R,Joel CoenEthan CoenJack London,Comedy,0.9351851851851833,0.23529411764705882
"Confess, Fletch",Greg Mottola,0.5955056179775281,0.19188191881918817,0.4464285714285716,R,Jon HammCaitlin Zerra RoseRoy Wood Jr.,Comedy,0.9722222222222214,0.23529411764705882
Glass Onion,Rian Johnson,0.7865168539325843,0.34317343173431725,0.5714285714285714,PG-13,Daniel CraigEdward NortonKate Hudson,Comedy,0.9722222222222214,0.23529411764705882
Knives Out,Rian Johnson,0.7977528089887641,0.30996309963099633,0.7142857142857144,PG-13,Daniel CraigChris EvansAna de Armas,Comedy,0.9444444444444429,0.23529411764705882
Ikiru,Akira Kurosawa,0.9101123595505617,0.3579335793357933,0.7857142857142858,Not Rated,Takashi ShimuraNobuo KanekoShin'ichi Himori,Drama,0.3240740740740726,0.4117647058823529
Singin' in the Rain,Stanley Donen,0.9887640449438203,0.21033210332103322,0.7857142857142858,G,Gene KellyDonald O'ConnorDebbie Reynolds,Comedy,0.3240740740740726,0.23529411764705882
