Title,Director,MetaScore,Duration (minutes),IMDb Rating,Certificates,Star Cast,Genre,Year,Genre Value
Idealnoe prestuplenie,Igor Voznesensky,0.6179775280898877,0.2594095940959409,0.3928571428571428,R,Zinovi Yuryev,Mystery,0.6759259259259238,0.8235294117647058
Steampunk,Billy T. Boyd,0.6179775280898877,0.2594095940959409,0.2857142857142858,R,Gareth EvansJaime PittengerChad Burns,Action,0.8611111111111107,0.0
Karim Patwa's Spaceship,Karim Patwa,0.6179775280898877,0.2594095940959409,0.7857142857142858,R,Daniel RadcliffeEmma WatsonRupert Grint,Biography,0.8055555555555536,0.2941176470588235
Minushi,Tyler Gibb,0.6179775280898877,0.17712177121771214,0.5892857142857144,Not Rated,Jay DonaldsonTyler GibbTara Lutchman,Animation,0.8333333333333321,0.1176470588235294
Embers of the Sky,Justin Calen-Chenn,0.6179775280898877,0.2594095940959409,0.4285714285714286,R,Hayley J WilliamsMaria OlsenRowena Sumner,Drama,0.8611111111111107,0.4117647058823529
Timeshifters 2: Alternate Present,Esses Tamás,0.6179775280898877,0.2594095940959409,0.5892857142857144,R,Szabó AntalBolla AttilaHarczi Bence,Sci-Fi,0.8796296296296298,0.7058823529411764
The Paralyzing Agent,Gene Greenlees,0.6179775280898877,0.2594095940959409,0.4107142857142858,R,Michael AndersonPatrick BarrilleauxCarlie Bass,Drama,0.8518518518518512,0.4117647058823529
Dreamscape,Curt Anderson,0.6179775280898877,0.2594095940959409,0.4285714285714286,R,Sophie BolenSamantha BerendsEthan Knoth,Sci-Fi,0.8703703703703702,0.7058823529411764
The Last Dudes on Earth,Dan Wedeking,0.6179775280898877,0.2594095940959409,0.5357142857142858,R,Courtney KatesRobert Brandon MachadoBrian Marshall,Comedy,0.8148148148148131,0.23529411764705882
Nova Express,Andre Perkowski,0.6179775280898877,0.2594095940959409,0.642857142857143,R,Peter BergmanWilliam S. BurroughsJürgen Ploog,Sci-Fi,0.8518518518518512,0.7058823529411764
Space Tours: Mission E.V.A.,Andreas Auinger,0.6179775280898877,0.2594095940959409,0.2857142857142858,R,János MischuretzUlli EmmerRainer Kantz,Comedy,0.8611111111111107,0.23529411764705882
Ratstar,Christian Bergmans,0.6179775280898877,0.2594095940959409,0.6785714285714286,R,Daniel RadcliffeEmma WatsonRupert Grint,Comedy,0.8055555555555536,0.23529411764705882
Counter-Clockwise,Denny Wilkins,0.6179775280898877,0.2594095940959409,0.375,R,Daniel RadcliffeEmma WatsonRupert Grint,Romance,0.8703703703703702,0.8823529411764706
Prodavetz vozdukha,Vladimir Ryabtzev,0.6179775280898877,0.2594095940959409,0.3392857142857144,R,Pavel KadochnikovArtyom KarapetyanGennadiy Nilov,Sci-Fi,0.4629629629629619,0.7058823529411764
The Lower Circle,Luigi Scarcelli,0.6179775280898877,0.2594095940959409,0.7678571428571428,R,Kimberly Anne BendixMadrid St. AngeloGuy Klinzing,Fantasy,0.8518518518518512,0.47058823529411764
Dangerous Stories,Kazuyuki Izutsu,0.6179775280898877,0.2594095940959409,0.2857142857142858,R,Kiyoshi KurosawaAtaru OikawaJunji Sakamoto,Horror,0.6666666666666643,0.3529411764705882
Karutha Rathrikal,Mahesh,0.6179775280898877,0.2594095940959409,0.4821428571428572,R,MadhuT.K. BalachandranN. Govindankutty,Crime,0.4629629629629619,0.1764705882352941
The Drivetime,Antero Alli,0.6179775280898877,0.2594095940959409,0.5,R,Michael Taylor DonovanAntero AlliGregory Baisden,Crime,0.7222222222222214,0.1764705882352941
The Elk Hotel,Daniel Paul Bates,0.6179775280898877,0.2594095940959409,0.25,R,Laurie BushmanEdisol W. DotsonMichael Ehrenberg,Drama,0.8240740740740726,0.4117647058823529
Collision Moon,Brian Nowak,0.6179775280898877,0.2594095940959409,0.5357142857142858,R,Daniel RadcliffeEmma WatsonRupert Grint,Sci-Fi,0.9629629629629619,0.7058823529411764
Spilt Blood,Willy Adkins,0.6179775280898877,0.2594095940959409,0.4464285714285716,R,Anastasia MorriganPhranque WrightWolf McKinney,Fantasy,0.9074074074074048,0.47058823529411764
Encounter: Omzion,Steven Catizone,0.6179775280898877,0.29889298892988925,0.4107142857142858,Not Rated,Brendan BorisLisa BorisAnn Marie Catizone Rehnert,Animation,0.8611111111111107,0.1176470588235294
Idõugrók 2 - Alternatív jelen,Esses Tamás,0.6179775280898877,0.2594095940959409,0.4464285714285716,R,Esses TamásVéber ZoltánTokodi Sandor,Sci-Fi,0.8796296296296298,0.7058823529411764
Cinco gallinas y el cielo,Rubén W. Cavalloti,0.6179775280898877,0.2594095940959409,0.6964285714285714,R,Narciso Ibáñez MentaLuis ArataIrma Córdoba,Comedy,0.37037037037037024,0.23529411764705882
This Corrosion,Mitch McCabe,0.6179775280898877,0.2594095940959409,0.3214285714285716,R,Elisabeth SeljevoldJulie FinchHobey Echlin,Mystery,0.7962962962962941,0.8235294117647058
Liberation! The Musical,Nils Osmar,0.6179775280898877,0.2594095940959409,0.6071428571428572,R,Meli AlexanderDannie BaldwinMeredith Binder,Action,0.8888888888888893,0.0
Target Audience 9.1,Dominic Mah,0.6179775280898877,0.2594095940959409,0.4821428571428572,R,Mary AngelloKristen BrennanJeanne Chinn,Comedy,0.8333333333333321,0.23529411764705882
The Cookbook,Siavash Afshar,0.6179775280898877,0.2594095940959409,0.3035714285714286,R,Ali AbdaliAli AnvariEbrahim Azizi,Mystery,0.9351851851851833,0.8235294117647058
Origins III: Destiny,Kyle Parish,0.6179775280898877,0.2594095940959409,0.3928571428571428,R,Kyle ParishMatthew SchliesmannJoseph Popma,Action,0.8796296296296298,0.0
I Heart Doomsday,Patrick Downing,0.6179775280898877,0.2594095940959409,0.375,R,Dan BeirneJoe CobdenChristine Ghawi,Comedy,0.8611111111111107,0.23529411764705882
A Dog Called Pain,Luis Eduardo Aute,0.6179775280898877,0.2594095940959409,0.6071428571428572,R,Daniel RadcliffeEmma WatsonRupert Grint,Animation,0.777777777777775,0.1176470588235294
The Dead Speak,Gabriel Soria,0.6179775280898877,0.2594095940959409,0.4107142857142858,R,Julián SolerAmelia de IlisaManuel Noriega,Drama,0.1666666666666643,0.4117647058823529
Marty's Project,Andrew Kent,0.6179775280898877,0.2594095940959409,1.0,R,Naomi AshDavid BedfordJoanna Deering,Comedy,0.8611111111111107,0.23529411764705882
Chronospunk! The Pursuit of Who?,Gustav Heinlein,0.6179775280898877,0.2594095940959409,0.6964285714285714,R,Brandon BerkLarry Day IIGrant Fitch,Comedy,0.8981481481481488,0.23529411764705882
Monolog,Eray Dinç,0.6179775280898877,0.2594095940959409,0.5178571428571428,R,Sertan ArslanTunca ArslanEnis Aybar,Drama,0.8611111111111107,0.4117647058823529
Buljong,Carl Johan De Geer,0.6179775280898877,0.2594095940959409,0.375,R,Iwa BomanCarl Johan De GeerGert Fylking,Drama,0.7222222222222214,0.4117647058823529
Ulemae 7: Dolaon Ulemae,Jong-ho Lim,0.6179775280898877,0.2594095940959409,0.3214285714285716,R,Hyung-rae ShimBong-geol LeeJong-Chol Yang,Sci-Fi,0.6944444444444429,0.7058823529411764
L'invité de la onzième heure,Maurice Cloche,0.6179775280898877,0.2594095940959409,0.3928571428571428,R,Maurice ClocheJean FerryNino Frank,Drama,0.2592592592592595,0.4117647058823529
Traveller: Red,Andrew Merkelbach,0.6179775280898877,0.2594095940959409,0.25,R,Catherine BillinghamJohn KingMarijana Kreso,Sci-Fi,0.8240740740740726,0.7058823529411764
New Machine: Ulemae 5,Myeong-hwa Jo,0.6179775280898877,0.2594095940959409,0.5,R,Hyung-rae ShimHye-jin LeeAm Park,Sci-Fi,0.6574074074074048,0.7058823529411764
Blister,Taikan Suga,0.6179775280898877,0.2594095940959409,0.4642857142857144,R,Ken AyugaiDennis GunnPatrick Harlan,Action,0.768518518518519,0.0
Lo que pudo ser 2084,Alex Del Arco,0.6179775280898877,0.2594095940959409,0.8392857142857142,R,Andrea JorqueraEnrique CamachoXena Montañez,Sci-Fi,0.9629629629629619,0.7058823529411764
Wu zui zhi cheng,Chenyang Yin,0.6179775280898877,0.2594095940959409,0.4821428571428572,R,Daniel RadcliffeEmma WatsonRupert Grint,Drama,0.9259259259259238,0.4117647058823529
Vitaminac,Matias Musa,0.6179775280898877,0.2594095940959409,0.267857142857143,R,Daniel RadcliffeEmma WatsonRupert Grint,Sci-Fi,0.8796296296296298,0.7058823529411764
Rifftrax: Super Mario Bros.,Bill Corbett,0.6179775280898877,0.21402214022140217,0.5535714285714286,TV-14,Daniel RadcliffeEmma WatsonRupert Grint,Comedy,0.8981481481481488,0.23529411764705882
Invertebrate,James McAleer,0.6179775280898877,0.2594095940959409,0.642857142857143,R,James McAleer,Sci-Fi,0.8703703703703702,0.7058823529411764
Ku_on,Takayuki Hatamura,0.6179775280898877,0.1180811808118081,0.3928571428571428,Not Rated,Haruna IsaokaSou SatoNana Seino,Action,0.8888888888888893,0.0
The Diamonds of Metro Valley,Aaron Arendt,0.6179775280898877,0.2594095940959409,0.5892857142857144,R,Jordan EnderJon CohnRobert Poe,Action,0.8611111111111107,0.0
Double Happiness Uranium,Cole Larsen,0.6179775280898877,0.2594095940959409,0.1964285714285715,R,Nicholas HopeJodie DryJo Stone,Sci-Fi,0.8888888888888893,0.7058823529411764
The Beginning of the End of the World,Vincent Price,0.6179775280898877,0.2594095940959409,0.3392857142857144,R,Daniel RadcliffeEmma WatsonRupert Grint,Documentary,0.5,0.5882352941176471
Absolute Zero,Ridley Scott,0.6179775280898877,0.2594095940959409,0.3035714285714286,R,Daniel RadcliffeEmma WatsonRupert Grint,Sci-Fi,0.777777777777775,0.7058823529411764
Treta sled slantzeto,Gueorgui Stoyanov,0.6179775280898877,0.2594095940959409,0.3571428571428572,R,Itschak FintziNaum ShopovNikolay Nikolaev,Drama,0.5092592592592595,0.4117647058823529
Sturmaz (Acto y tempestad),Jesús Maestro,0.6179775280898877,0.2594095940959409,0.5892857142857144,R,José Luis Rodríguez AenasDaniel F. AmselemBlanca Fibla,Sci-Fi,0.8703703703703702,0.7058823529411764
Watt Poe to bokura no ohanashi,Shigenori Kageyama,0.6179775280898877,0.2594095940959409,0.75,R,Toshiko FujitaEriko HaraKôichi Kitamura,Animation,0.6574074074074048,0.1176470588235294
The Orbitrons,Chris Frieri,0.6179775280898877,0.2594095940959409,0.4107142857142858,R,Daniel RadcliffeEmma WatsonRupert Grint,Horror,0.6759259259259238,0.3529411764705882
Green Eyes for Anastice,Michael R. Steinbeck,0.6179775280898877,0.2594095940959409,0.5892857142857144,R,Nicholas P. RichardsSamantha PorpsTom Porps,Sci-Fi,0.8055555555555536,0.7058823529411764
Endjährig,Willi Kubica,0.6179775280898877,0.2594095940959409,0.4821428571428572,R,Matthias LierPeter MeinhardtMina Sadic,Sci-Fi,0.9537037037037024,0.7058823529411764
Slipdream,Marc Grant,0.6179775280898877,0.2594095940959409,0.4821428571428572,R,GregorioNiall PaddenDeva Dalporto,Adventure,0.8148148148148131,0.058823529411764705
Apparatspott - Dat mokt wie gistern,Martin Hermann,0.6179775280898877,0.2594095940959409,0.4642857142857144,R,Meelah AdamsThomas BaierSabine Bulthaup,Sci-Fi,0.8425925925925917,0.7058823529411764
Slaveworld,Duane Soebagio,0.6179775280898877,0.2594095940959409,0.5892857142857144,R,Daniel RadcliffeEmma WatsonRupert Grint,Sci-Fi,0.7222222222222214,0.7058823529411764
Atmo HorroX,Pat Tremblay,0.6179775280898877,0.2594095940959409,0.4642857142857144,R,Roch DesrosiersSyl DisjonkClaude Dubé,Comedy,0.9166666666666643,0.23529411764705882
Apparatspott - Gerangel in Ruum un Tied,Martin Hermann,0.6179775280898877,0.2594095940959409,0.4464285714285716,R,Thomas BaierUdo BurmeisterHansjuergen Hespos,Sci-Fi,0.7962962962962941,0.7058823529411764
Je3 sedae: Ulemae 6,Cheong-gi Kim,0.6179775280898877,0.2594095940959409,0.267857142857143,R,Jeong-ho HanJong-a KimYong-soo Eom,Sci-Fi,0.6666666666666643,0.7058823529411764
We Are All Cylons,Ilana Rein,0.6179775280898877,0.2594095940959409,0.7142857142857144,R,David ChiricoMichael HoganLacy Alexis Pline,Documentary,0.8703703703703702,0.5882352941176471
Back on Track,Ilmar Joubert,0.6179775280898877,0.2594095940959409,0.642857142857143,R,Niek DijkermanNiels ToondersPari Koree,Drama,0.8703703703703702,0.4117647058823529
The Chorus,Dan Starling,0.6179775280898877,0.2594095940959409,0.5,R,Brennan CampbellNyla CarpentierStephanie Cho,Sci-Fi,0.9351851851851833,0.7058823529411764
Eutamnesia,Patrick Rizzi,0.6179775280898877,0.2594095940959409,0.375,R,Emanuele De MatteisAntonio MatarazzoPaola Mura,Sci-Fi,0.768518518518519,0.7058823529411764
Fiction (+33),Pierre de Suzzoni,0.6179775280898877,0.2594095940959409,0.6607142857142858,R,Amandine CoureauGuillaume PerezAlain Carbonel,Drama,0.7870370370370345,0.4117647058823529
PentaQuad,Jessica Dahlke,0.6179775280898877,0.2594095940959409,0.642857142857143,R,Samuel BereutherChristian LewinPatricia Moresmau,Comedy,0.9351851851851833,0.23529411764705882
Elulu,Gabriel Alfonso Verdugo Soto,0.6179775280898877,0.2594095940959409,0.4107142857142858,R,Daniel RadcliffeEmma WatsonRupert Grint,Animation,0.9629629629629619,0.1176470588235294
Gomer and Ed Lost in Space,Ryan E. Heppe,0.6179775280898877,0.2594095940959409,0.6071428571428572,R,Lucas HeppeRyan E. HeppeAndrew Hicks,Action,0.768518518518519,0.0
Kinnikuman: Ôabare! Seigi chôjin,Takeshi Shirato,0.6179775280898877,0.2594095940959409,0.3571428571428572,R,Akira KamiyaMinori MatsushimaHideyuki Tanaka,Animation,0.6203703703703702,0.1176470588235294
Desolate,Rob Grant,0.6179775280898877,0.11439114391143909,0.5535714285714286,Not Rated,Daniel RadcliffeEmma WatsonRupert Grint,Drama,0.8888888888888893,0.4117647058823529
Metal,Alice Cox Neff,0.6179775280898877,0.2594095940959409,0.4821428571428572,R,Natalie FlanaganMichael BlairRachel Palleschi,Drama,0.777777777777775,0.4117647058823529
The World in the Year 2000,Ahmad Fuad,0.6179775280898877,0.2594095940959409,0.5357142857142858,R,Seif AbdelrahmanAhmad AddasAbdessalam Al-Tayeb,Sci-Fi,0.5092592592592595,0.7058823529411764
Klop 75 ili Mayakovskiy smeyotsya,Anatoliy Karanovich,0.6179775280898877,0.2594095940959409,0.3392857142857144,R,Leonid BronevoyGalina VolchekIya Savvina,Animation,0.5462962962962941,0.1176470588235294
Nightfur,Jason Corgan Brown,0.6179775280898877,0.14760147601476012,0.267857142857143,Not Rated,Jason Corgan BrownJeter Rhodes,Fantasy,0.8703703703703702,0.47058823529411764
Cryptic Road,Moosa Saleem,0.6179775280898877,0.2594095940959409,0.7857142857142858,R,Vijay Ashok SharmaAastha GautamAkshay Loomba,Mystery,0.9166666666666643,0.8235294117647058
Joel D. Wynkoop's the Craiglon Incident II Aftermath,Joel D. Wynkoop,0.6179775280898877,0.2594095940959409,0.4464285714285716,R,Ken Anthony IIJustin BowerDerek Braasch,Sci-Fi,0.9629629629629619,0.7058823529411764
Last Breach,Christos Filippou,0.6179775280898877,0.2594095940959409,0.6964285714285714,R,Tasos AndreadisTasos AntonaridisKonstantinos Babilas,Action,0.9351851851851833,0.0
Animal Rescue Squad,Xiaoning Feng,0.6179775280898877,0.2594095940959409,0.2142857142857143,R,Jing XitongXiaoguang HuXiaowei Liu,Family,0.9444444444444429,0.6470588235294117
Kuluçka,Mehmet Selçuk Bilge,0.6179775280898877,0.2594095940959409,0.2857142857142858,R,Nur ErtemDilara TekinStefani Terziyan,Fantasy,0.9259259259259238,0.47058823529411764
Kureji no buchamukure daihakken,Kengo Furusawa,0.6179775280898877,0.2594095940959409,0.5714285714285714,R,Hajime HanaHitoshi UekiKei Tani,Comedy,0.48148148148148096,0.23529411764705882
The Reflection of Kripto,Pauli Janhunen Calderón,0.6179775280898877,0.2594095940959409,0.8214285714285714,R,Emilio Janhunen CalderónPauli Janhunen CalderónDavid Anghel,Sci-Fi,0.9166666666666643,0.7058823529411764
Ymadawiad Arthur,Marc Evans,0.6179775280898877,0.2594095940959409,0.4642857142857144,R,Ioan EvansMorgan HopkinsLlyr Ifans,Comedy,0.731481481481481,0.23529411764705882
The Wonderland Express,Greg Nichols,0.6179775280898877,0.2594095940959409,0.4642857142857144,R,Greg Nichols,Comedy,0.8703703703703702,0.23529411764705882
Subconscious Reality,Mark Byrne,0.6179775280898877,0.16605166051660517,0.4107142857142858,Not Rated,Jim ToepperLana WoodConrad Brooks,Action,0.9166666666666643,0.0
Edgar Allan Poe's Plan 13: The House of Elvis,Scott Allen Nollen,0.6179775280898877,0.2594095940959409,0.8214285714285714,R,Bart AikensRon FisherSteve Noe,Sci-Fi,0.6388888888888893,0.7058823529411764
Mindgame,Shawn Martinbrough,0.6179775280898877,0.2594095940959409,0.5357142857142858,R,Tarina PouncyJoe Tom CollinsJim Coope,Mystery,0.7962962962962941,0.8235294117647058
To athoo soma,Nikos Kornilios,0.6179775280898877,0.2594095940959409,0.5178571428571428,R,Iris ChatziantoniouAkilas KarazisisArto Apartian,Drama,0.7407407407407405,0.4117647058823529
Maxwell's Demon,David Clark,0.6179775280898877,0.2594095940959409,0.3214285714285716,R,Andy CurtisDarcy DunlopMark David Stewart,Drama,0.7592592592592595,0.4117647058823529
Adolescence Changes in the Coronavirus Environment. How does a teenager react to a claustrophobic pandemic?,Eleni Anagnostopoulou,0.6179775280898877,0.2594095940959409,0.8392857142857142,R,Eleni AnagnostopoulouSpyros BibilasVicky Driva,Documentary,0.9629629629629619,0.5882352941176471
Metamorfosia,Cosmotropia de Xam,0.6179775280898877,0.2594095940959409,0.6607142857142858,R,Carmen IncarnadineJanet LittwinLarissa Littwin,Horror,0.8981481481481488,0.3529411764705882
TSC 3: Dawn of the Apocalypse,Justin Melick,0.6179775280898877,0.2594095940959409,0.375,R,LaDonna AllisonMadeline BrumbyDavid Lee Denny Jr.,Sci-Fi,0.8703703703703702,0.7058823529411764
Jimmy Tornado,Gerry Schuster,0.6179775280898877,0.2594095940959409,0.5178571428571428,R,Oleg BorissovLeonora EckerMona Filice,Sci-Fi,0.8055555555555536,0.7058823529411764
Enjoy Your Trip to Hell,Scout Tafoya,0.6179775280898877,0.11070110701107008,0.6071428571428572,PG-13,Tori DavisJulian LazareNick Smerkanich,Sci-Fi,0.9259259259259238,0.7058823529411764
Do nebicka,Krystof Hanzlík,0.6179775280898877,0.2594095940959409,0.3214285714285716,R,Anna KárnikováPetr HapkaMichal Dlouhý,Family,0.7407407407407405,0.6470588235294117
"Katuwira, donde nacen y mueren los sueños",Íñigo Vallejo-Nágera,0.6179775280898877,0.2594095940959409,0.2857142857142858,R,Íñigo Vallejo-NágeraTimothy J. Sexton,Adventure,0.731481481481481,0.058823529411764705
Triptosane,Michael DiCerto,0.6179775280898877,0.1402214022140221,0.3392857142857144,Not Rated,Jim LavinTrace BeaulieuLarry Block,Sci-Fi,0.8611111111111107,0.7058823529411764
Crystal Fortune Run,Chris Kin-Sang Li,0.6179775280898877,0.2594095940959409,0.25,R,Sharla CheungSimon YamAnita Yuen,Action,0.7129629629629619,0.0
Elmers Lov,Thomas Gunnari Røtting,0.6179775280898877,0.2594095940959409,0.6607142857142858,R,Thomas Gunnari RøttingVetle Strøm,Action,0.8888888888888893,0.0
The Final Equation,Daniel Ulysses Abella,0.6179775280898877,0.2594095940959409,0.7142857142857144,R,Robert HarriellCassandra CookePaul Weissman,Sci-Fi,0.8518518518518512,0.7058823529411764
Dr. Otto Dekein's Original Design,Dean Sullivan Adams,0.6179775280898877,0.2594095940959409,0.5,R,Ryan DaviesDanny PerezJoe Raspolich,Comedy,0.8518518518518512,0.23529411764705882
An Human,Koushik Kr,0.6179775280898877,0.2594095940959409,0.642857142857143,R,Koushik Kr,Drama,0.8703703703703702,0.4117647058823529
Ekho: Fall of an Empire,Jim McCullough,0.6179775280898877,0.2594095940959409,0.3392857142857144,R,Jim McCulloughAmanda MortenKristin Astourian,Sci-Fi,0.8055555555555536,0.7058823529411764
Jumborg Ace & Giant,Sompote Sands,0.6179775280898877,0.2594095940959409,0.5178571428571428,R,Daniel RadcliffeEmma WatsonRupert Grint,Action,0.527777777777775,0.0
The Leafblower,Dominic DeJoseph,0.6179775280898877,0.2594095940959409,0.4821428571428572,R,Jeanne FossMarco GiudiceJon Hyrns,Comedy,0.75,0.23529411764705882
Where the Journey Ends,Ryan Firth,0.6179775280898877,0.2594095940959409,0.1964285714285715,R,Andriy DemtschukAidan RawnsleyRyan Firth,Action,0.9074074074074048,0.0
Ché OVNI,Aníbal Uset,0.6179775280898877,0.2594095940959409,0.1964285714285715,R,Jorge SobralMarcela López ReyJuan Carlos Altavista,Comedy,0.47222222222222143,0.23529411764705882
Raki II: Raki vs. Nemesis,Lewis C. Austin,0.6179775280898877,0.2594095940959409,0.4464285714285716,R,Andrew RobertsValerie MeachumMichael Evanichko,Family,0.731481481481481,0.6470588235294117
Robot Taekwon V: Wooju jakjeon,Cheong-gi Kim,0.6179775280898877,0.2594095940959409,0.3214285714285716,R,Daniel RadcliffeEmma WatsonRupert Grint,Animation,0.5462962962962941,0.1176470588235294
Young-guwa hwanggeum bakjwi,Ki-nam Nam,0.6179775280898877,0.2594095940959409,0.4107142857142858,R,Daniel RadcliffeEmma WatsonRupert Grint,Action,0.6944444444444429,0.0
Space Specks,Rick Dunbar,0.6179775280898877,0.2594095940959409,0.5714285714285714,R,Tom SellwoodKrista WelterGreg Salomone,Comedy,0.7962962962962941,0.23529411764705882
The Man Near Skitter Creek,Jake Swing,0.6179775280898877,0.2594095940959409,0.4464285714285716,R,Jake Swing,Comedy,0.8796296296296298,0.23529411764705882
Earth Without War,J. Carlos Portela,0.6179775280898877,0.2594095940959409,0.4821428571428572,R,Swaylee LoughnaneLee WestwickDaniel Eghan,Sci-Fi,0.9259259259259238,0.7058823529411764
Yo Alien,Foster V. Corder,0.6179775280898877,0.2594095940959409,0.5535714285714286,R,Dick DeCoitTichina ArnoldCylk Cozart,Sci-Fi,0.7870370370370345,0.7058823529411764
Puerta del tiempo,Pedro Delgado,0.6179775280898877,0.2594095940959409,0.4821428571428572,R,Sandra JaraInma GallegoJavier Gurruchaga,Animation,0.7870370370370345,0.1176470588235294
Star Wars: The Dark Reckoning,Mark Newton,0.6179775280898877,0.2594095940959409,0.375,R,Brian WoodwardAlexander DoddySarah Greiner-Dudaniec,Sci-Fi,0.9259259259259238,0.7058823529411764
Eunhaeseo on Byeolddong wangja,Do-won Seok,0.6179775280898877,0.2594095940959409,0.642857142857143,R,Geon-ju LeeYong-shik LeeHyeong-jung Kim,Action,0.6481481481481488,0.0
Gekijôban G No Reconguista III: Uchû kara no isan,Yoshiyuki Tomino,0.6179775280898877,0.2594095940959409,0.5892857142857144,R,Yoshiyuki Tomino,Animation,0.9629629629629619,0.1176470588235294
Pioneer 12,Aaron N. Feldman,0.6179775280898877,0.2594095940959409,0.3571428571428572,R,Christopher MurneyAlice PlaytenChristopher Wisner,Fantasy,0.7592592592592595,0.47058823529411764
New World,Peter John Ross,0.6179775280898877,0.2594095940959409,0.2321428571428572,R,George CaleodisFritz CargouldMilan A. Cargould,Action,0.7870370370370345,0.0
The Thin Time,J.R. Hughto,0.6179775280898877,0.2594095940959409,0.375,R,Jason DeckerJason Joel HarrisDarryl Hughto,Sci-Fi,0.8240740740740726,0.7058823529411764
Roshtalivik,Nicholas J. Moore,0.6179775280898877,0.0959409594095941,0.3928571428571428,Not Rated,Hauke BahrDavid CharlesLee McCarty,Sci-Fi,0.9166666666666643,0.7058823529411764
Idõugrók 3 - Lidércháborús Múlt,Esses Tamás,0.6179775280898877,0.2594095940959409,0.2857142857142858,R,Esses TamásNémeth TündeTokodi Sandor,Sci-Fi,0.8888888888888893,0.7058823529411764
The Parchene Conspiracy,David Daring,0.6179775280898877,0.2594095940959409,0.5178571428571428,R,John AlexanderCrockett AndersonTony Armstrong,Sci-Fi,0.8518518518518512,0.7058823529411764
Omni: Verse,Grier Dill,0.6179775280898877,0.2594095940959409,0.5535714285714286,R,Grier DillSean GillJulie Gomez,Adventure,0.9166666666666643,0.058823529411764705
Mr. Suzuki: A Man in God's Country,Omoi Sasaki,0.6179775280898877,0.2594095940959409,0.5892857142857144,R,Daniel RadcliffeEmma WatsonRupert Grint,Sci-Fi,0.9537037037037024,0.7058823529411764
Fairie,Willo Hausman,0.6179775280898877,0.2594095940959409,0.5,R,Jack WallaceEd GaleRichard Parent,Sci-Fi,0.7870370370370345,0.7058823529411764
"Minor Daemon, Volume 1",Jon Rafman,0.6179775280898877,0.2594095940959409,0.7857142857142858,R,Daniel RadcliffeEmma WatsonRupert Grint,Animation,0.9629629629629619,0.1176470588235294
The Dragons of Jim Green,Randy M. Salo,0.6179775280898877,0.2594095940959409,0.6607142857142858,R,Daniel RadcliffeEmma WatsonRupert Grint,Documentary,0.8796296296296298,0.5882352941176471
Presence,Bryan Kramer,0.6179775280898877,0.2594095940959409,0.3571428571428572,R,Bryant CookTim CummingsPaula Mitchell Manning,Horror,0.8425925925925917,0.3529411764705882
The Follow,Glenn Triggs,0.6179775280898877,0.2594095940959409,0.3392857142857144,R,Daniel RadcliffeEmma WatsonRupert Grint,Sci-Fi,0.8055555555555536,0.7058823529411764
Koyakatsi,Ayoub Qanir,0.6179775280898877,0.2594095940959409,0.6785714285714286,R,Daniel RadcliffeEmma WatsonRupert Grint,Action,0.8981481481481488,0.0
Cultivision (Collapsing Stars),Neill Calabro,0.6179775280898877,0.2594095940959409,0.642857142857143,R,Danny VinsonMonica AmbroseScott Brantley,Sci-Fi,0.7870370370370345,0.7058823529411764
Oko Boga,Piotr Krzywiec,0.6179775280898877,0.2594095940959409,0.5714285714285714,R,Ryszard DolinskiIwona SzczesnaAndrzej Beja-Zaborski,Drama,0.777777777777775,0.4117647058823529
The Zombie Hero,Nicholas Jackson,0.6179775280898877,0.2594095940959409,0.375,R,Nicholas Jackson,Action,0.8611111111111107,0.0
Knightquest,Joe Monroe,0.6179775280898877,0.2594095940959409,0.5892857142857144,R,Doria AnselmoBen FletcherMatt Howell,Sci-Fi,0.777777777777775,0.7058823529411764
Blonde Ringlet,Steven A. Kowal,0.6179775280898877,0.2594095940959409,0.6250000000000002,R,Peter NezafatiFrank Kowal IIIDavid Hartley,Crime,0.8611111111111107,0.1764705882352941
Atar Mass 2019,Nithin,0.6179775280898877,0.2594095940959409,0.5535714285714286,R,Daniel RadcliffeEmma WatsonRupert Grint,Action,0.9259259259259238,0.0
Stunted Trees and Broken Bridges,Tom Leach,0.6179775280898877,0.2594095940959409,0.5714285714285714,R,Tom LeachHeather BleasdaleSophie Gerrish,Sci-Fi,0.8888888888888893,0.7058823529411764
The Lords of Praxton,Peter Anthony Fields,0.6179775280898877,0.2594095940959409,0.4821428571428572,R,Peter Anthony FieldsEvonne Fields-GouldCornelius Gould,Fantasy,0.8240740740740726,0.47058823529411764
VigasioSexploitation Vol.2,Sebastiano Montresor,0.6179775280898877,0.2594095940959409,0.267857142857143,R,EvelineMatteo LucchiChiara Pavoni,Action,0.8703703703703702,0.0
Escape the Dark,Matthew Chilelli,0.6179775280898877,0.2594095940959409,0.3928571428571428,R,Karli KaiserErik MoodySarah Nicklin,Horror,0.9259259259259238,0.3529411764705882
Missy,Elias Pate,0.6179775280898877,0.09225092250922509,0.6250000000000002,Not Rated,Daniel RadcliffeEmma WatsonRupert Grint,Drama,0.777777777777775,0.4117647058823529
El Sab'a Afandi,Ahmed Khorshed,0.6179775280898877,0.2594095940959409,0.3214285714285716,R,Sayed Abu BakrShadiaFarid Shawqi,Comedy,0.3148148148148131,0.23529411764705882
