Title,Director,MetaScore,Duration (minutes),IMDb Rating,Certificates,Star Cast,Genre,Year
Gladiator,Ridley Scott,67.0,155.0,8.5,R,David FranzoniJohn LoganWilliam Nicholson,Action,2000
Mission: Impossible - Dead Reckoning Part One,Christopher McQuarrie,81.0,163.0,7.7,PG-13,Tom CruiseHayley AtwellVing Rhames,Action,2023
Rebel Moon - Part Two: The Scargiver,Zack Snyder,35.0,122.0,5.2,PG-13,Zack SnyderKurt JohnstadShay Hatten,Action,2024
Inglourious Basterds,Quentin Tarantino,69.0,153.0,8.4,R,Brad PittDiane KrugerEli Roth,Adventure,2009
Borderlands,Eli Roth,66.9,116.3,7.1,R,Eli RothJoe Crombie,Action,2024
Jurassic Park,Steven Spielberg,68.0,127.0,8.2,PG-13,Michael CrichtonDavid Koepp,Action,1993
The Fifth Element,Luc Besson,52.0,126.0,7.6,PG-13,Luc BessonRobert Mark Kamen,Action,1997
Inside Out,Pete Docter,94.0,95.0,8.1,PG,Pete DocterRonnie Del CarmenMeg LeFauve,Animation,2015
Descendants: The Rise of Red,Jennifer Phang,66.9,116.3,7.1,TV-G,Rita OraJoshua ColleyChina Anne McClain,Action,2024
Wish,Chris Buck,47.0,95.0,5.6,PG,Jennifer LeeAllison MooreChris Buck,Animation,2023
The Hunger Games,Gary Ross,68.0,142.0,7.2,PG-13,Gary RossSuzanne CollinsBilly Ray,Action,2012
Rebel Moon - Part One: A Child of Fire,Zack Snyder,31.0,133.0,5.6,PG-13,Zack SnyderKurt JohnstadShay Hatten,Action,2023
Harry Potter and the Sorcerer's Stone,Chris Columbus,65.0,152.0,7.6,PG,Daniel RadcliffeRupert GrintEmma Watson,Adventure,2001
Wonka,Paul King,66.0,116.0,7.0,PG,Roald DahlPaul KingSimon Farnaby,Adventure,2023
Inception,Christopher Nolan,74.0,148.0,8.8,PG-13,Leonardo DiCaprioJoseph Gordon-LevittElliot Page,Action,2010
The Lord of the Rings: The Fellowship of the Ring,Peter Jackson,92.0,178.0,8.9,PG-13,J.R.R. TolkienFran WalshPhilippa Boyens,Action,2001
Twister,Jan de Bont,68.0,113.0,6.5,PG-13,Helen HuntBill PaxtonCary Elwes,Action,1996
Damsel,Juan Carlos Fresnadillo,46.0,110.0,6.1,PG-13,Millie Bobby BrownRay WinstoneAngela Bassett,Action,2024
Dune,David Lynch,41.0,137.0,6.3,PG-13,Kyle MacLachlanVirginia MadsenFrancesca Annis,Action,1984
Arthur the King,Simon Cellan Jones,54.0,107.0,7.0,PG-13,Mark WahlbergSimu LiuJuliet Rylance,Adventure,2024
Kung Fu Panda 4,Mike Mitchell,54.0,94.0,6.3,PG,Jonathan AibelGlenn BergerDarren Lemke,Animation,2024
Mad Max Beyond Thunderdome,George Miller,71.0,107.0,6.2,PG-13,Terry HayesGeorge MillerByron Kennedy,Action,1985
Manjummel Boys,Chidambaram,66.9,116.3,8.4,R,Soubin ShahirSreenath BhasiBalu Varghese,Adventure,2024
Golden Kamuy,Shigeaki Kubo,66.9,116.3,6.4,R,Kento YamazakiAnna YamadaYûma Yamoto,Action,2024
Interstellar,Christopher Nolan,74.0,169.0,8.7,PG-13,Matthew McConaugheyAnne HathawayJessica Chastain,Adventure,2014
Planet of the Apes,Franklin J. Schaffner,79.0,112.0,8.0,G,Michael WilsonRod SerlingPierre Boulle,Adventure,1968
Barbie,Greta Gerwig,80.0,114.0,6.8,PG-13,Margot RobbieRyan GoslingIssa Rae,Adventure,2023
Twisters,Lee Isaac Chung,66.9,116.3,7.1,PG-13,Mark L. SmithJoseph KosinskiMichael Crichton,Action,2024
The Hunger Games: The Ballad of Songbirds & Snakes,Francis Lawrence,54.0,157.0,6.7,PG-13,Rachel ZeglerTom BlythViola Davis,Action,2023
Inside Out 2,Kelsey Mann,66.9,100.0,7.1,PG,Amy PoehlerPhyllis SmithLewis Black,Animation,2024
Bad Boys: Ride or Die,Adil El Arbi,66.9,116.3,7.1,R,Will SmithMartin LawrenceVanessa Hudgens,Action,2024
Mad Max 2: The Road Warrior,George Miller,77.0,96.0,7.6,R,Terry HayesGeorge MillerBrian Hannant,Action,1981
Godzilla Minus One,Takashi Yamazaki,81.0,124.0,7.9,PG-13,Ryunosuke KamikiMinami HamabeSakura Andô,Action,2023
Love Lies Bleeding,Rose Glass,77.0,104.0,6.7,R,Anna BaryshnikovKristen StewartDave Franco,Action,2024
Dawn of the Planet of the Apes,Matt Reeves,79.0,130.0,7.6,PG-13,Mark BombackRick JaffaAmanda Silver,Action,2014
Planet of the Apes,Tim Burton,50.0,120.0,5.7,PG-13,Pierre BoulleWilliam Broyles Jr.Lawrence Konner,Action,2001
Mad Max,George Miller,73.0,88.0,6.8,R,James McCauslandGeorge MillerByron Kennedy,Action,1979
War for the Planet of the Apes,Matt Reeves,82.0,140.0,7.4,PG-13,Mark BombackMatt ReevesRick Jaffa,Action,2017
Ghostbusters: Frozen Empire,Gil Kenan,46.0,115.0,6.2,PG-13,Gil KenanJason ReitmanIvan Reitman,Adventure,2024
Thelma the Unicorn,Jared Hess,64.0,93.0,5.8,PG,Brittany HowardWill ForteJon Heder,Animation,2024
Dune,Denis Villeneuve,74.0,155.0,8.0,PG-13,Jon SpaihtsDenis VilleneuveEric Roth,Action,2021
The Garfield Movie,Mark Dindal,31.0,101.0,5.9,PG,Paul A. KaplanMark TorgoveDavid Reynolds,Animation,2024
Godzilla x Kong: The New Empire,Adam Wingard,47.0,115.0,6.2,PG-13,Terry RossioAdam WingardSimon Barrett,Action,2024
Madame Web,S.J. Clarkson,26.0,116.0,3.9,PG-13,Matt SazamaBurk SharplessClaire Parker,Action,2024
Civil War,Alex Garland,75.0,109.0,7.4,R,Kirsten DunstWagner MouraCailee Spaeny,Action,2024
Mad Max: Fury Road,George Miller,90.0,120.0,8.1,R,Tom HardyCharlize TheronNicholas Hoult,Action,2015
Atlas,Brad Peyton,37.0,118.0,5.6,PG-13,Jennifer LopezSimu LiuSterling K. Brown,Action,2024
Dune: Part Two,Denis Villeneuve,79.0,166.0,8.6,PG-13,Timothée ChalametZendayaRebecca Ferguson,Action,2024
Kingdom of the Planet of the Apes,Wes Ball,66.0,145.0,7.2,PG-13,Owen TeagueFreya AllanKevin Durand,Action,2024
Furiosa: A Mad Max Saga,George Miller,79.0,148.0,7.9,R,Anya Taylor-JoyChris HemsworthTom Burke,Action,2024
WALL·E,Andrew Stanton,95.0,98.0,8.4,G,Andrew StantonPete DocterJim Reardon,Animation,2008
Spider-Man: Beyond the Spider-Verse,Joaquim Dos Santos,66.9,116.3,7.1,R,Shameik MooreHailee SteinfeldBrian Tyree Henry,Animation,2015
Hercules,Ron Clements,74.0,93.0,7.3,G,Ron ClementsJohn MuskerDon McEnery,Animation,1997
Sing,Garth Jennings,59.0,108.0,7.1,PG,Matthew McConaugheyReese WitherspoonSeth MacFarlane,Animation,2016
Castle in the Sky,Hayao Miyazaki,78.0,125.0,8.0,PG,Hayao MiyazakiJonathan Swift,Animation,1986
"Monsters, Inc.",Pete Docter,79.0,92.0,8.1,G,Pete DocterJill CultonJeff Pidgeon,Animation,2001
Tangled,Nathan Greno,71.0,100.0,7.7,PG,Mandy MooreZachary LeviDonna Murphy,Animation,2010
Up,Pete Docter,88.0,96.0,8.3,PG,Pete DocterBob PetersonTom McCarthy,Animation,2009
Toy Story,John Lasseter,96.0,81.0,8.3,G,John LasseterPete DocterAndrew Stanton,Animation,1995
Puss in Boots: The Last Wish,Joel Crawford,73.0,102.0,7.8,PG,Paul FisherTommy SwerdlowTom Wheeler,Animation,2022
Encanto,Jared Bush,75.0,102.0,7.2,PG,Charise Castro SmithJared BushByron Howard,Animation,2021
Coco,Lee Unkrich,81.0,105.0,8.4,PG,Lee UnkrichJason KatzMatthew Aldrich,Animation,2017
Frozen,Chris Buck,75.0,102.0,7.4,PG,Jennifer LeeHans Christian AndersenChris Buck,Animation,2013
Mufasa: The Lion King,Barry Jenkins,66.9,116.3,7.1,R,Linda WoolvertonIrene MecchiJonathan Roberts,Animation,2024
Howl's Moving Castle,Hayao Miyazaki,82.0,119.0,8.2,PG,Chieko BaishôTakuya KimuraTatsuya Gashûin,Animation,2004
Zootopia,Byron Howard,78.0,108.0,8.0,PG,Byron HowardRich MooreJared Bush,Animation,2016
Teenage Mutant Ninja Turtles: Mutant Mayhem,Jeff Rowe,74.0,99.0,7.2,PG,Seth RogenEvan GoldbergJeff Rowe,Animation,2023
Kung Fu Panda,Mark Osborne,74.0,92.0,7.6,PG,Jonathan AibelGlenn BergerEthan Reiff,Animation,2008
The Lion King,Jon Favreau,55.0,118.0,6.8,PG,Jeff NathansonIrene MecchiJonathan Roberts,Animation,2019
Spider-Man: Into the Spider-Verse,Bob Persichetti,87.0,117.0,8.4,PG,Phil LordRodney Rothman,Animation,2018
The Incredibles,Brad Bird,90.0,115.0,8.0,PG,Craig T. NelsonSamuel L. JacksonHolly Hunter,Animation,2004
Mars Express,Jérémie Périn,76.0,88.0,7.5,Not Rated,Léa DruckerMathieu AmalricDaniel Njo Lobé,Animation,2023
Shrek 2,Andrew Adamson,75.0,93.0,7.3,PG,William SteigAndrew AdamsonJoe Stillman,Animation,2004
Your Name.,Makoto Shinkai,81.0,116.3,8.4,R,Makoto ShinkaiClark Cheng,Animation,2016
Elemental,Peter Sohn,58.0,101.0,7.0,PG,John HobergKat LikkelBrenda Hsueh,Animation,2023
Ratatouille,Brad Bird,96.0,111.0,8.1,G,Brad BirdJan PinkavaJim Capobianco,Animation,2007
Moana,Ron Clements,81.0,107.0,7.6,PG,Ron ClementsJohn MuskerDon Hall,Animation,2016
Harold and the Purple Crayon,Carlos Saldanha,66.9,92.0,7.1,PG,Zachary LeviLil Rel HoweryBenjamin Bottani,Animation,2024
Finding Nemo,Andrew Stanton,90.0,100.0,8.2,G,Andrew StantonBob PetersonDavid Reynolds,Animation,2003
Sing 2,Garth Jennings,49.0,110.0,7.3,PG,Matthew McConaugheyReese WitherspoonScarlett Johansson,Animation,2021
Trolls Band Together,Walt Dohrn,53.0,91.0,6.0,PG,Anna KendrickJustin TimberlakeKenan Thompson,Animation,2023
Transformers One,Josh Cooley,66.9,116.3,7.1,R,Chris HemsworthBrian Tyree HenryScarlett Johansson,Animation,2024
The Boy and the Heron,Hayao Miyazaki,91.0,124.0,7.6,PG-13,Hayao Miyazaki,Animation,2023
The Lion King,Roger Allers,88.0,88.0,8.5,G,Irene MecchiJonathan RobertsLinda Woolverton,Animation,1994
Cars,John Lasseter,73.0,116.0,7.2,G,John LasseterJoe RanftJorgen Klubien,Animation,2006
Shrek,Andrew Adamson,84.0,90.0,7.9,PG,William SteigTed ElliottTerry Rossio,Animation,2001
Spirited Away,Hayao Miyazaki,96.0,125.0,8.6,PG,Hayao Miyazaki,Animation,2001
Moana 2,David G. Derrick Jr.,66.9,116.3,7.1,R,Gil KenanJason ReitmanIvan Reitman,Animation,2024
The Super Mario Bros. Movie,Aaron Horvath,46.0,92.0,7.0,PG,Aaron HorvathMichael JelenicPierre Leduc,Animation,2023
The Lord of the Rings: The War of the Rohirrim,Kenji Kamiyama,66.9,116.3,7.1,R,Jeffrey AddissPhoebe GittinsWill Matthews,Animation,2024
Despicable Me 4,Chris Renaud,66.9,95.0,7.1,PG,Steve CarellKristen WiigJoey King,Animation,2024
Migration,Benjamin Renner,56.0,83.0,6.7,PG,Mike WhiteBenjamin RennerKen Daurio,Animation,2023
Spider-Man: Across the Spider-Verse,Joaquim Dos Santos,86.0,140.0,8.6,PG,Shameik MooreHailee SteinfeldBrian Tyree Henry,Animation,2023
Inside Out,Pete Docter,94.0,95.0,8.1,PG,Pete DocterRonnie Del CarmenMeg LeFauve,Animation,2015
Wish,Chris Buck,47.0,95.0,5.6,PG,Jennifer LeeAllison MooreChris Buck,Animation,2023
Kung Fu Panda 4,Mike Mitchell,54.0,94.0,6.3,PG,Jonathan AibelGlenn BergerDarren Lemke,Animation,2024
Inside Out 2,Kelsey Mann,66.9,100.0,7.1,PG,Amy PoehlerPhyllis SmithLewis Black,Animation,2024
Thelma the Unicorn,Jared Hess,64.0,93.0,5.8,PG,Brittany HowardWill ForteJon Heder,Animation,2024
The Garfield Movie,Mark Dindal,31.0,101.0,5.9,PG,Paul A. KaplanMark TorgoveDavid Reynolds,Animation,2024
IF,John Krasinski,46.0,104.0,6.7,PG,Cailey FlemingRyan ReynoldsJohn Krasinski,Animation,2024
Taxi Driver,Martin Scorsese,94.0,114.0,8.2,R,"Robert De Niro,Jodie Foster,Cybill Shepherd",Crime,1976
Kill Bill: Vol. 1,Quentin Tarantino,69.0,111.0,8.2,R,"Quentin Tarantino ,Uma Thurman",Action,2003
We're the Millers,Rawson Marshall Thurber,44.0,110.0,7.0,R,"Bob FisherSteve , FaberSean Anders",Comedy,2013
The Green Mile,Frank Darabont,61.0,189.0,8.6,R,Tom HanksMichael Clarke DuncanDavid Morse,Crime,1999
Animal,Sandeep Reddy Vanga,33.0,204.0,6.2,Not Rated,Suresh BandaruSaurabh GuptaPranay Reddy Vanga,Action,2023
Prisoners,Denis Villeneuve,70.0,153.0,8.2,R,Hugh JackmanJake GyllenhaalViola Davis,Crime,2013
12 Angry Men,Sidney Lumet,97.0,96.0,9.0,Approved,Reginald Rose,Crime,1957
Joker,Todd Phillips,59.0,122.0,8.4,R,Todd PhillipsScott SilverBob Kane,Crime,2019
Sicario,Denis Villeneuve,82.0,121.0,7.7,R,Emily BluntJosh BrolinBenicio Del Toro,Action,2015
Baby Driver,Edgar Wright,86.0,113.0,7.5,R,Ansel ElgortJon BernthalJon Hamm,Action,2017
The Crow,Alex Proyas,71.0,102.0,7.5,R,Brandon LeeMichael WincottRochelle Davis,Action,1994
Léon: The Professional,Luc Besson,64.0,110.0,8.5,R,Jean RenoGary OldmanNatalie Portman,Action,1994
In the Land of Saints and Sinners,Robert Lorenz,60.0,106.0,6.3,R,Kerry CondonDesmond EastwoodConor MacNeill,Action,2023
The Equalizer,Antoine Fuqua,57.0,132.0,7.2,R,Denzel WashingtonMarton CsokasChloë Grace Moretz,Action,2014
The Equalizer 3,Antoine Fuqua,58.0,109.0,6.8,R,Denzel WashingtonDakota FanningEugenio Mastrandrea,Action,2023
Wicked Little Letters,Thea Sharrock,58.0,100.0,7.0,R,Jessie BuckleyOlivia ColmanTimothy Spall,Comedy,2023
Beverly Hills Cop,Martin Brest,66.0,105.0,7.4,R,Daniel Petrie Jr.Danilo Bach,Action,1984
The Silence of the Lambs,Jonathan Demme,86.0,118.0,8.6,R,Jodie FosterAnthony HopkinsScott Glenn,Crime,1991
Heat,Michael Mann,76.0,170.0,8.3,R,Al PacinoRobert De NiroVal Kilmer,Action,1995
No Country for Old Men,Ethan Coen,92.0,122.0,8.2,R,Tommy Lee JonesJavier BardemJosh Brolin,Crime,2007
Se7en,David Fincher,65.0,127.0,8.6,R,Morgan FreemanBrad PittKevin Spacey,Crime,1995
John Wick: Chapter 4,Chad Stahelski,78.0,169.0,7.7,R,Keanu ReevesLaurence FishburneGeorge Georgiou,Action,2023
The Talented Mr. Ripley,Anthony Minghella,76.0,139.0,7.4,R,Matt DamonGwyneth PaltrowJude Law,Crime,1999
The Outsiders,Francis Ford Coppola,45.0,91.0,7.0,PG,C. Thomas HowellMatt DillonRalph Macchio,Crime,1983
The Departed,Martin Scorsese,85.0,151.0,8.5,R,Leonardo DiCaprioMatt DamonJack Nicholson,Crime,2006
Goodfellas,Martin Scorsese,92.0,145.0,8.7,R,Nicholas PileggiMartin Scorsese,Biography,1990
MaXXXine,Ti West,66.9,103.0,7.1,R,Ti West,Crime,2024
The Wolf of Wall Street,Martin Scorsese,75.0,180.0,8.2,R,Leonardo DiCaprioJonah HillMargot Robbie,Biography,2013
The Batman,Matt Reeves,72.0,176.0,7.8,PG-13,Matt ReevesPeter CraigBob Kane,Action,2022
The Courier,Daniel Calparsoro,66.9,116.3,6.0,R,Arón PiperMaría PedrazaLuis Tosar,Crime,2024
The Dark Knight,Christopher Nolan,84.0,152.0,9.0,PG-13,Jonathan NolanChristopher NolanDavid S. Goyer,Action,2008
Killers of the Flower Moon,Martin Scorsese,89.0,206.0,7.6,R,Leonardo DiCaprioRobert De NiroLily Gladstone,Crime,2023
Pulp Fiction,Quentin Tarantino,95.0,154.0,8.9,R,Quentin TarantinoRoger Avary,Crime,1994
Force of Nature: The Dry 2,Robert Connolly,58.0,120.0,6.0,R,Eric BanaAnna TorvDeborra-Lee Furness,Crime,2024
The Crow,Rupert Sanders,66.9,116.3,7.1,R,Bill SkarsgårdFKA twigsDanny Huston,Action,2024
Anatomy of a Fall,Justine Triet,86.0,151.0,7.7,R,Sandra HüllerSwann ArlaudMilo Machado-Graner,Crime,2023
The Bikeriders,Jeff Nichols,73.0,116.0,7.5,R,Jodie ComerAustin ButlerTom Hardy,Crime,2023
The Godfather,Francis Ford Coppola,100.0,175.0,9.2,R,Mario PuzoFrancis Ford Coppola,Crime,1972
The Gentlemen,Guy Ritchie,51.0,113.0,7.8,R,Guy RitchieIvan AtkinsonMarn Davies,Action,2019
The Judge,David Dobkin,48.0,141.0,7.4,R,Nick SchenkBill DubuqueDavid Dobkin,Crime,2014
The Last Stop in Yuma County,Francis Galluppi,72.0,90.0,7.0,R,Jim CummingsFaizon LoveJocelin Donahue,Crime,2023
Beverly Hills Cop: Axel F,Mark Molloy,66.9,115.0,7.1,R,Will BeallTom GormicanKevin Etten,Action,2024
Bad Boys: Ride or Die,Adil El Arbi,66.9,116.3,7.1,R,Will SmithMartin LawrenceVanessa Hudgens,Action,2024
Love Lies Bleeding,Rose Glass,77.0,104.0,6.7,R,Anna BaryshnikovKristen StewartDave Franco,Action,2024
Hit Man,Richard Linklater,83.0,115.0,7.4,R,Adria ArjonaGlen PowellRetta,Action,2023
Longlegs,Oz Perkins,66.9,101.0,7.1,R,Nicolas CageMaika MonroeAlicia Witt,Crime,2024
Disturbia,D.J. Caruso,62.0,105.0,6.8,PG-13,Christopher LandonCarl Ellsworth,Crime,2007
A Simple Favor,Paul Feig,67.0,117.0,6.8,R,Anna KendrickBlake LivelyHenry Golding,Comedy,2018
Emilia Perez,Jacques Audiard,70.0,116.3,7.2,R,Jacques AudiardThomas BidegainNicolas Livecchi,Comedy,2024
Boy Kills World,Moritz Mohr,47.0,111.0,6.5,R,Tyler Burton SmithArend RemmersMoritz Mohr,Action,2023
Monster,Rako Prijanto,66.9,86.0,4.6,TV-MA,Marsha TimothyAlex AbbadAnantya Kirana,Horror,2023
Glass,M. Night Shyamalan,43.0,129.0,6.6,PG-13,M. Night Shyamalan,Drama,2019
Lisa Frankenstein,Zelda Williams,47.0,101.0,6.1,PG-13,Kathryn NewtonLiza SoberanoJenna Davis,Comedy,2024
It,Andy Muschietti,69.0,135.0,7.3,R,Chase PalmerCary Joji FukunagaGary Dauberman,Fantasy,2017
Smile,Parker Finn,68.0,115.0,6.5,R,Sosie BaconJessie T. UsherKyle Gallner,Horror,2022
The Dead Don't Die,Jim Jarmusch,53.0,104.0,5.5,R,Bill MurrayAdam DriverTilda Swinton,Comedy,2019
Nosferatu,Robert Eggers,66.9,116.3,7.1,R,Aaron Taylor-JohnsonBill SkarsgårdNicholas Hoult,Fantasy,2024
A Serbian Film,Srdjan Spasojevic,66.9,104.0,5.0,NC-17,Srdjan 'Zika' TodorovicSergej TrifunovicJelena Gavrilovic,Horror,2010
Mandy,Panos Cosmatos,83.0,121.0,6.5,Not Rated,Panos CosmatosAaron Stewart-AhnCasper Kelly,Action,2018
The Crow,Alex Proyas,71.0,102.0,7.5,R,Brandon LeeMichael WincottRochelle Davis,Action,1994
The Prodigy,Nicholas McCarthy,45.0,92.0,5.9,R,Taylor SchillingJackson Robert ScottPeter Mooney,Fantasy,2019
Split,M. Night Shyamalan,63.0,117.0,7.3,PG-13,James McAvoyAnya Taylor-JoyHaley Lu Richardson,Horror,2016
The Menu,Mark Mylod,71.0,107.0,7.2,R,Ralph FiennesAnya Taylor-JoyNicholas Hoult,Comedy,2022
Nope,Jordan Peele,77.0,130.0,6.8,R,Daniel KaluuyaKeke PalmerBrandon Perea,Horror,2022
Five Nights at Freddy's,Emma Tammi,33.0,109.0,5.5,PG-13,Scott CawthonSeth CuddebackEmma Tammi,Horror,2023
Alien,Ridley Scott,89.0,117.0,8.5,R,Dan O'BannonRonald Shusett,Horror,1979
A Quiet Place,John Krasinski,82.0,90.0,7.5,PG-13,Bryan WoodsScott BeckJohn Krasinski,Drama,2018
The First Omen,Arkasha Stevenson,65.0,119.0,6.7,R,Tim SmithArkasha StevensonKeith Thomas,Horror,2024
Midsommar,Ari Aster,72.0,148.0,7.1,R,Florence PughJack ReynorVilhelm Blomgren,Drama,2019
The Killing of a Sacred Deer,Yorgos Lanthimos,73.0,121.0,7.0,R,Barry G. BernsonHerb CaillouetBill Camp,Drama,2017
Talk to Me,Danny Philippou,76.0,95.0,7.1,R,Ari McCarthyHamish PhillipsKit Erhart-Bruce,Horror,2022
Hereditary,Ari Aster,87.0,127.0,7.3,R,Toni ColletteMilly ShapiroGabriel Byrne,Drama,2018
Dream Scenario,Kristoffer Borgli,74.0,102.0,6.9,R,Lily BirdNicolas CageJulianne Nicholson,Comedy,2023
MaXXXine,Ti West,66.9,103.0,7.1,R,Ti West,Crime,2024
Exhuma,Jang Jae-hyun,66.9,116.3,7.0,R,Jang Jae-hyun,Horror,2024
Shaitaan,Vikas Bahl,66.9,132.0,6.7,Not Rated,Aamil Keeyan KhanKrishnadev Yagnik,Drama,2024
28 Days Later,Danny Boyle,73.0,113.0,7.5,R,Cillian MurphyNaomie HarrisChristopher Eccleston,Drama,2002
Alien: Romulus,Fede Alvarez,66.9,116.3,7.1,R,Fede AlvarezRodo SayaguesDan O'Bannon,Horror,2024
Arcadian,Benjamin Brewer,60.0,92.0,5.5,R,Nicolas CageJaeden MartellMaxwell Jenkins,Action,2024
A Quiet Place: Day One,Michael Sarnoski,66.9,116.3,7.1,R,Michael SarnoskiJohn KrasinskiBryan Woods,Drama,2024
Barbarian,Zach Cregger,78.0,102.0,7.0,R,Georgina CampbellBill SkarsgårdJustin Long,Horror,2022
The Coffee Table,Caye Casas,72.0,91.0,6.8,16+,David ParejaEstefanía de los SantosJosep Maria Riera,Comedy,2022
Immaculate,Michael Mohan,57.0,89.0,5.8,R,Sydney SweeneyÁlvaro MorteSimona Tabasco,Horror,2024
Pearl,Ti West,76.0,103.0,7.0,R,Ti WestMia Goth,Drama,2022
The Crow,Rupert Sanders,66.9,116.3,7.1,R,Bill SkarsgårdFKA twigsDanny Huston,Action,2024
The Invitation,Jessica M. Thompson,45.0,105.0,5.3,PG-13,Nathalie EmmanuelThomas DohertySean Pertwee,Horror,2022
The Watchers,Ishana Shyamalan,66.9,102.0,7.1,PG-13,Dakota FanningGeorgina CampbellOlwen Fouéré,Fantasy,2024
In a Violent Nature,Chris Nash,65.0,116.3,5.7,R,Chris Nash,Drama,2024
The Strangers,Bryan Bertino,47.0,86.0,6.1,R,Scott SpeedmanLiv TylerGemma Ward,Horror,2008
Tarot,Spenser Cohen,36.0,92.0,4.9,PG-13,Harriet SlaterAdain BradleyJacob Batalon,Horror,2024
X,Ti West,80.0,105.0,6.5,R,Mia GothJenna OrtegaBrittany Snow,Horror,2022
Sting,Kiah Roache-Turner,57.0,92.0,5.7,R,Jermaine FowlerRyan CorrAlyla Browne,Horror,2024
Godzilla Minus One,Takashi Yamazaki,81.0,124.0,7.9,PG-13,Ryunosuke KamikiMinami HamabeSakura Andô,Action,2023
I Saw the TV Glow,Jane Schoenbrun,84.0,100.0,6.9,PG-13,Justice SmithBrigette Lundy-PaineIan Foreman,Drama,2024
Late Night with the Devil,Cameron Cairnes,72.0,93.0,7.1,R,David DastmalchianLaura GordonIan Bliss,Horror,2023
Longlegs,Oz Perkins,66.9,101.0,7.1,R,Nicolas CageMaika MonroeAlicia Witt,Crime,2024
The Substance,Coralie Fargeat,83.0,116.3,8.0,R,Margaret QualleyDemi MooreDennis Quaid,Drama,2024
Abigail,Matt Bettinelli-Olpin,62.0,109.0,6.7,R,Melissa BarreraDan StevensAlisha Weir,Horror,2024
The Strangers: Chapter 1,Renny Harlin,43.0,91.0,5.0,R,Madelaine PetschRyan BownMatus Lajcak,Horror,2024
Beetlejuice Beetlejuice,Tim Burton,66.9,116.3,7.1,R,Alfred GoughMiles MillarSeth Grahame-Smith,Comedy,2024
Alien,Ridley Scott,89.0,117.0,8.5,R,Dan O'BannonRonald Shusett,Horror,1979
A Quiet Place,John Krasinski,82.0,90.0,7.5,PG-13,Bryan WoodsScott BeckJohn Krasinski,Drama,2018
Deadpool 2,David Leitch,66.0,119.0,7.6,R,Rhett ReesePaul WernickRyan Reynolds,Action,2018
Avengers: Endgame,Anthony Russo,78.0,181.0,8.4,PG-13,Christopher MarkusStephen McFeelyStan Lee,Action,2019
Despicable Me 4,Chris Renaud,66.9,95.0,7.1,PG,Steve CarellKristen WiigJoey King,Animation,2024
Ghostbusters: Afterlife,Jason Reitman,45.0,124.0,7.0,PG-13,Gil KenanJason ReitmanIvan Reitman,Adventure,2021
Spider-Man: Across the Spider-Verse,Joaquim Dos Santos,86.0,140.0,8.6,PG,Shameik MooreHailee SteinfeldBrian Tyree Henry,Animation,2023
Star Wars: Episode I - The Phantom Menace,George Lucas,51.0,136.0,6.5,PG,Ewan McGregorLiam NeesonNatalie Portman,Action,1999
Spider-Man: No Way Home,Jon Watts,71.0,148.0,8.2,PG-13,Chris McKennaErik SommersStan Lee,Action,2021
Ghostbusters,Ivan Reitman,71.0,105.0,7.8,PG,Bill MurrayDan AykroydSigourney Weaver,Action,1984
Rebel Moon - Part Two: The Scargiver,Zack Snyder,35.0,122.0,5.2,PG-13,Zack SnyderKurt JohnstadShay Hatten,Action,2024
The Matrix,Lana Wachowski,73.0,136.0,8.7,R,Keanu ReevesLaurence FishburneCarrie-Anne Moss,Action,1999
Borderlands,Eli Roth,66.9,116.3,7.1,R,Eli RothJoe Crombie,Action,2024
Blade Runner 2049,Denis Villeneuve,81.0,164.0,8.0,R,Hampton FancherMichael GreenPhilip K. Dick,Action,2017
Jurassic Park,Steven Spielberg,68.0,127.0,8.2,PG-13,Michael CrichtonDavid Koepp,Action,1993
The Fifth Element,Luc Besson,52.0,126.0,7.6,PG-13,Luc BessonRobert Mark Kamen,Action,1997
The Hunger Games,Gary Ross,68.0,142.0,7.2,PG-13,Gary RossSuzanne CollinsBilly Ray,Action,2012
Godzilla vs. Kong,Adam Wingard,59.0,113.0,6.3,PG-13,Terry RossioMichael DoughertyZach Shields,Action,2021
Rebel Moon - Part One: A Child of Fire,Zack Snyder,31.0,133.0,5.6,PG-13,Zack SnyderKurt JohnstadShay Hatten,Action,2023
28 Days Later,Danny Boyle,73.0,113.0,7.5,R,Cillian MurphyNaomie HarrisChristopher Eccleston,Drama,2002
Alien: Romulus,Fede Alvarez,66.9,116.3,7.1,R,Fede AlvarezRodo SayaguesDan O'Bannon,Horror,2024
Inception,Christopher Nolan,74.0,148.0,8.8,PG-13,Leonardo DiCaprioJoseph Gordon-LevittElliot Page,Action,2010
A Quiet Place: Day One,Michael Sarnoski,66.9,116.3,7.1,R,Michael SarnoskiJohn KrasinskiBryan Woods,Drama,2024
Dune,David Lynch,41.0,137.0,6.3,PG-13,Kyle MacLachlanVirginia MadsenFrancesca Annis,Action,1984
Mad Max Beyond Thunderdome,George Miller,71.0,107.0,6.2,PG-13,Terry HayesGeorge MillerByron Kennedy,Action,1985
Interstellar,Christopher Nolan,74.0,169.0,8.7,PG-13,Matthew McConaugheyAnne HathawayJessica Chastain,Adventure,2014
Her,Spike Jonze,91.0,126.0,8.0,R,Joaquin PhoenixAmy AdamsScarlett Johansson,Drama,2013
Planet of the Apes,Franklin J. Schaffner,79.0,112.0,8.0,G,Michael WilsonRod SerlingPierre Boulle,Adventure,1968
The Hunger Games: The Ballad of Songbirds & Snakes,Francis Lawrence,54.0,157.0,6.7,PG-13,Rachel ZeglerTom BlythViola Davis,Action,2023
Upgrade,Leigh Whannell,67.0,100.0,7.5,R,Logan Marshall-GreenMelanie VallejoSteve Danielsen,Action,2018
Mad Max 2: The Road Warrior,George Miller,77.0,96.0,7.6,R,Terry HayesGeorge MillerBrian Hannant,Action,1981
Sting,Kiah Roache-Turner,57.0,92.0,5.7,R,Jermaine FowlerRyan CorrAlyla Browne,Horror,2024
Godzilla Minus One,Takashi Yamazaki,81.0,124.0,7.9,PG-13,Ryunosuke KamikiMinami HamabeSakura Andô,Action,2023
Dawn of the Planet of the Apes,Matt Reeves,79.0,130.0,7.6,PG-13,Mark BombackRick JaffaAmanda Silver,Action,2014
Rise of the Planet of the Apes,Rupert Wyatt,68.0,105.0,7.6,PG-13,James FrancoAndy SerkisFreida Pinto,Action,2011
Planet of the Apes,Tim Burton,50.0,120.0,5.7,PG-13,Pierre BoulleWilliam Broyles Jr.Lawrence Konner,Action,2001
Mad Max,George Miller,73.0,88.0,6.8,R,James McCauslandGeorge MillerByron Kennedy,Action,1979
War for the Planet of the Apes,Matt Reeves,82.0,140.0,7.4,PG-13,Mark BombackMatt ReevesRick Jaffa,Action,2017
Ghostbusters: Frozen Empire,Gil Kenan,46.0,115.0,6.2,PG-13,Gil KenanJason ReitmanIvan Reitman,Adventure,2024
Poor Things,Yorgos Lanthimos,88.0,141.0,7.9,R,Emma StoneMark RuffaloWillem Dafoe,Comedy,2023
Dune,Denis Villeneuve,74.0,155.0,8.0,PG-13,Jon SpaihtsDenis VilleneuveEric Roth,Action,2021
Deadpool & Wolverine,Shawn Levy,66.9,116.3,7.1,R,Shawn LevyRhett ReeseRyan Reynolds,Action,2024
Godzilla x Kong: The New Empire,Adam Wingard,47.0,115.0,6.2,PG-13,Terry RossioAdam WingardSimon Barrett,Action,2024
Madame Web,S.J. Clarkson,26.0,116.0,3.9,PG-13,Matt SazamaBurk SharplessClaire Parker,Action,2024
Megalopolis,Francis Ford Coppola,58.0,116.3,7.0,R,Adam DriverGiancarlo EspositoNathalie Emmanuel,Drama,2024
Mad Max: Fury Road,George Miller,90.0,120.0,8.1,R,Tom HardyCharlize TheronNicholas Hoult,Action,2015
Atlas,Brad Peyton,37.0,118.0,5.6,PG-13,Jennifer LopezSimu LiuSterling K. Brown,Action,2024
Dune: Part Two,Denis Villeneuve,79.0,166.0,8.6,PG-13,Timothée ChalametZendayaRebecca Ferguson,Action,2024
Kingdom of the Planet of the Apes,Wes Ball,66.0,145.0,7.2,PG-13,Owen TeagueFreya AllanKevin Durand,Action,2024
Furiosa: A Mad Max Saga,George Miller,79.0,148.0,7.9,R,Anya Taylor-JoyChris HemsworthTom Burke,Action,2024
The Lion King,Jon Favreau,55.0,118.0,6.8,PG,Jeff NathansonIrene MecchiJonathan Roberts,Animation,2019
Spider-Man: Into the Spider-Verse,Bob Persichetti,87.0,117.0,8.4,PG,Phil LordRodney Rothman,Animation,2018
The Incredibles,Brad Bird,90.0,115.0,8.0,PG,Craig T. NelsonSamuel L. JacksonHolly Hunter,Animation,2004
Charlie and the Chocolate Factory,Tim Burton,72.0,115.0,6.7,PG,Johnny DeppFreddie HighmoreDavid Kelly,Adventure,2005
Harry Potter and the Chamber of Secrets,Chris Columbus,63.0,161.0,7.4,PG,Daniel RadcliffeRupert GrintEmma Watson,Adventure,2002
Shrek 2,Andrew Adamson,75.0,93.0,7.3,PG,William SteigAndrew AdamsonJoe Stillman,Animation,2004
