Title,Director,MetaScore,Duration (minutes),IMDb Rating,Certificates,Star Cast,Genre,Year
Gettysburg,Ron Maxwell,66.0,271.0,7.6,PG,Tom BerengerMartin SheenStephen Lang,Drama,1993
Foxcatcher,Bennett Miller,81.0,134.0,7.0,R,Steve CarellChanning TatumMark Ruffalo,Biography,2014
The Other Boleyn Girl,Justin Chadwick,50.0,115.0,6.7,PG-13,Natalie PortmanScarlett JohanssonEric Bana,Biography,2008
Pride,Matthew Warchus,79.0,119.0,7.8,R,Bill NighyImelda StauntonDominic West,Biography,2014
Amistad,Steven Spielberg,64.0,155.0,7.3,R,Djimon HounsouMatthew McConaugheyAnthony Hopkins,Biography,1997
"Lust, Caution",Ang Lee,61.0,157.0,7.5,NC-17,Tony Leung Chiu-waiTang WeiJoan Chen,Drama,2007
The Trial of the Chicago 7,Aaron Sorkin,76.0,129.0,7.7,R,Eddie RedmayneAlex SharpSacha Baron Cohen,Drama,2020
The 13th Warrior,John McTiernan,42.0,102.0,6.6,R,Antonio BanderasDiane VenoraDennis Storhøi,Action,1999
Hotel Mumbai,Anthony Maras,62.0,123.0,7.6,R,Dev PatelArmie HammerNazanin Boniadi,Action,2018
Vice,Adam McKay,61.0,132.0,7.2,R,Christian BaleAmy AdamsSteve Carell,Biography,2018
The Finest Hours,Craig Gillespie,58.0,117.0,6.7,PG-13,Scott SilverPaul TamasyEric Johnson,Action,2016
The Outpost,Rod Lurie,71.0,123.0,6.8,R,Scott EastwoodCaleb Landry JonesOrlando Bloom,Action,2019
Escape from Germany,T.C. Christensen,66.0,97.0,7.4,PG,Sebastian BarrJoseph BatzelIscha Bee,Drama,2024
Boston Strangler,Matt Ruskin,58.0,112.0,6.5,R,Keira KnightleyCarrie CoonChris Cooper,Crime,2023
The Killing Fields,Roland Joffé,76.0,141.0,7.8,R,Sam WaterstonHaing S. NgorJohn Malkovich,Biography,1984
The Bounty,Roger Donaldson,62.0,132.0,7.0,PG,Mel GibsonAnthony HopkinsLaurence Olivier,Adventure,1984
Megan Leavey,Gabriela Cowperthwaite,66.0,116.0,7.1,PG-13,Kate MaraRamón RodríguezTom Felton,Action,2017
Outlaw King,David Mackenzie,59.0,121.0,6.9,R,Bathsheba DoranDavid MackenzieJames MacInnes,Action,2018
Elizabeth,Shekhar Kapur,75.0,124.0,7.4,R,Cate BlanchettLiz GilesRod Culbertson,Biography,1998
The Post,Steven Spielberg,83.0,116.0,7.2,PG-13,Meryl StreepTom HanksSarah Paulson,Biography,2017
Origin,Ava DuVernay,75.0,141.0,7.2,PG-13,Aunjanue Ellis-TaylorJon BernthalNiecy Nash,Drama,2023
Patriots Day,Peter Berg,69.0,133.0,7.3,R,Peter BergMatt CookJoshua Zetumer,Action,2016
Valkyrie,Bryan Singer,56.0,121.0,7.1,PG-13,Tom CruiseBill NighyCarice van Houten,Drama,2008
Lee,Ellen Kuras,59.0,116.0,6.9,R,Liz HannahMarion HumeJohn Collee,Biography,2023
Shakespeare in Love,John Madden,87.0,123.0,7.1,R,Gwyneth PaltrowJoseph FiennesGeoffrey Rush,Comedy,1998
Deepwater Horizon,Peter Berg,68.0,107.0,7.1,PG-13,Matthew Michael CarnahanMatthew SandDavid Barstow,Action,2016
Bridge of Spies,Steven Spielberg,81.0,142.0,7.6,PG-13,Tom HanksMark RylanceAlan Alda,Drama,2015
The Mauritanian,Kevin Macdonald,53.0,129.0,7.5,R,Michael BronnerRory HainesSohrab Noshirvani,Biography,2021
JFK,Oliver Stone,72.0,189.0,8.0,R,Jim GarrisonJim MarrsOliver Stone,Drama,1991
The Woman King,Gina Prince-Bythewood,76.0,135.0,6.9,PG-13,Dana StevensMaria Bello,Action,2022
Tetris,Jon S. Baird,61.0,118.0,7.4,R,Taron EgertonMara HufMiles Barrow,Biography,2023
Lincoln,Steven Spielberg,87.0,150.0,7.3,PG-13,Daniel Day-LewisSally FieldDavid Strathairn,Biography,2012
Silence,Martin Scorsese,79.0,161.0,7.2,R,Andrew GarfieldAdam DriverLiam Neeson,Drama,2016
Miracle,Gavin O'Connor,68.0,135.0,7.5,PG,Kurt RussellPatricia ClarksonNathan West,Biography,2004
Straight Outta Compton,F. Gary Gray,72.0,147.0,7.8,R,Jonathan HermanAndrea BerloffS. Leigh Savidge,Biography,2015
The King's Speech,Tom Hooper,88.0,118.0,8.0,R,Colin FirthGeoffrey RushHelena Bonham Carter,Biography,2010
The Ten Commandments,Cecil B. DeMille,66.0,220.0,7.9,G,Dorothy Clarke WilsonJ.H. IngrahamA.E. Southon,Adventure,1956
Greyhound,Aaron Schneider,64.0,91.0,7.0,PG-13,Tom HanksElisabeth ShueStephen Graham,Action,2020
The Master,Paul Thomas Anderson,86.0,138.0,7.1,R,Joaquin PhoenixPhilip Seymour HoffmanAmy Adams,Drama,2012
First Man,Damien Chazelle,84.0,141.0,7.3,PG-13,Ryan GoslingClaire FoyJason Clarke,Biography,2018
Glory,Edward Zwick,78.0,122.0,7.8,R,Kevin JarreLincoln KirsteinPeter Burchard,Biography,1989
Silkwood,Mike Nichols,64.0,131.0,7.1,R,Meryl StreepKurt RussellCher,Biography,1983
Midway,Roland Emmerich,47.0,138.0,6.7,PG-13,Ed SkreinPatrick WilsonWoody Harrelson,Action,2019
Marie Antoinette,Sofia Coppola,64.0,123.0,6.5,PG-13,Kirsten DunstJason SchwartzmanRip Torn,Biography,2006
We Were Soldiers,Randall Wallace,65.0,138.0,7.2,R,Mel GibsonMadeleine StoweGreg Kinnear,Action,2002
Spartacus,Stanley Kubrick,87.0,197.0,7.9,PG-13,Dalton TrumboHoward FastPeter Ustinov,Adventure,1960
12 Strong,Nicolai Fuglsig,54.0,130.0,6.5,R,Chris HemsworthMichael ShannonMichael Peña,Action,2018
The Thin Red Line,Terrence Malick,78.0,170.0,7.6,R,Jim CaviezelSean PennNick Nolte,Drama,1998
Colonia,Florian Gallenberger,33.0,110.0,7.0,R,Emma WatsonDaniel BrühlMichael Nyqvist,Biography,2015
Free State of Jones,Gary Ross,53.0,139.0,6.9,R,Gary RossLeonard Hartman,Action,2016
Public Enemies,Michael Mann,70.0,140.0,7.0,R,Ronan BennettMichael MannAnn Biderman,Action,2009
The Death of Stalin,Armando Iannucci,88.0,107.0,7.3,R,Fabien NuryThierry RobinArmando Iannucci,Comedy,2017
The Patriot,Roland Emmerich,63.0,165.0,7.2,R,Mel GibsonHeath LedgerJoely Richardson,Action,2000
13 Hours: The Secret Soldiers of Benghazi,Michael Bay,48.0,144.0,7.3,R,John KrasinskiPablo SchreiberJames Badge Dale,Action,2016
The Long Game,Julio Quintana,65.0,112.0,6.6,PG,Jennifer C. StetsonPaco FariasJulio Quintana,Drama,2023
The Courier,Dominic Cooke,65.0,112.0,7.2,PG-13,Benedict CumberbatchMerab NinidzeRachel Brosnahan,Drama,2020
Argo,Ben Affleck,86.0,120.0,7.7,R,Ben AffleckBryan CranstonJohn Goodman,Biography,2012
Munich,Steven Spielberg,74.0,164.0,7.5,R,Eric BanaDaniel CraigMarie-Josée Croze,Action,2005
12 Years a Slave,Steve McQueen,96.0,134.0,8.1,R,Chiwetel EjioforMichael Kenneth WilliamsMichael Fassbender,Biography,2013
Maestro,Bradley Cooper,77.0,129.0,6.5,R,Carey MulliganBradley CooperMatt Bomer,Biography,2023
Amsterdam,David O. Russell,48.0,134.0,6.1,R,Christian BaleMargot RobbieJohn David Washington,Comedy,2022
The Beguiled,Sofia Coppola,77.0,93.0,6.3,R,Sofia CoppolaThomas CullinanAlbert Maltz,Drama,2017
Apollo 13,Ron Howard,78.0,140.0,7.7,PG,Jim LovellJeffrey KlugerWilliam Broyles Jr.,Adventure,1995
Downfall,Oliver Hirschbiegel,82.0,156.0,8.2,R,Bernd EichingerJoachim FestTraudl Junge,Biography,2004
Robin Hood,Ridley Scott,53.0,140.0,6.6,PG-13,Brian HelgelandEthan ReiffCyrus Voris,Action,2010
The King,David Michôd,62.0,140.0,7.3,R,Tom Glynn-CarneyGábor CzapTom Fisher,Biography,2019
The Last Duel,Ridley Scott,67.0,152.0,7.4,R,Nicole HolofcenerBen AffleckMatt Damon,Action,2021
Hamilton,Thomas Kail,88.0,160.0,8.3,PG-13,Lin-Manuel MirandaPhillipa SooLeslie Odom Jr.,Biography,2020
Dunkirk,Christopher Nolan,94.0,106.0,7.8,PG-13,Fionn WhiteheadBarry KeoghanMark Rylance,Action,2017
BlackBerry,Matt Johnson,78.0,120.0,7.4,R,Jacquie McNishSean SilcoffMatt Johnson,Biography,2023
The Impossible,J.A. Bayona,73.0,114.0,7.5,PG-13,Naomi WattsEwan McGregorTom Holland,Drama,2012
The Promised Land,Nikolaj Arcel,77.0,127.0,7.7,R,Mads MikkelsenAmanda CollinSimon Bennebjerg,Action,2023
Black Hawk Down,Ridley Scott,74.0,144.0,7.7,R,Josh HartnettEwan McGregorTom Sizemore,Action,2001
The Favourite,Yorgos Lanthimos,91.0,119.0,7.5,R,Olivia ColmanEmma StoneRachel Weisz,Biography,2018
The Taste of Things,Anh Hung Tran,85.0,135.0,7.5,PG-13,Juliette BinocheBenoît MagimelEmmanuel Salinger,Drama,2023
1917,Sam Mendes,78.0,119.0,8.2,R,Dean-Charles ChapmanGeorge MacKayDaniel Mays,Action,2019
Zero Dark Thirty,Kathryn Bigelow,95.0,157.0,7.4,R,Jessica ChastainJoel EdgertonChris Pratt,Drama,2012
Society of the Snow,J.A. Bayona,72.0,144.0,7.8,R,J.A. BayonaBernat VilaplanaJaime Marques,Adventure,2023
Hidden Figures,Theodore Melfi,74.0,127.0,7.8,PG,Taraji P. HensonOctavia SpencerJanelle Monáe,Biography,2016
Sound of Freedom,Alejandro Monteverde,36.0,131.0,7.6,PG-13,Jim CaviezelMira SorvinoBill Camp,Biography,2023
The Big Short,Adam McKay,81.0,130.0,7.8,R,Christian BaleSteve CarellRyan Gosling,Biography,2015
The Northman,Robert Eggers,82.0,137.0,7.0,R,Alexander SkarsgårdNicole KidmanClaes Bang,Action,2022
Hacksaw Ridge,Mel Gibson,71.0,139.0,8.1,R,Andrew GarfieldSam WorthingtonLuke Bracey,Biography,2016
One Life,James Hawes,69.0,109.0,7.5,PG,Anthony HopkinsLena OlinJohnny Flynn,Biography,2023
Wicked Little Letters,Thea Sharrock,58.0,100.0,7.0,R,Jessie BuckleyOlivia ColmanTimothy Spall,Comedy,2023
Babylon,Damien Chazelle,61.0,189.0,7.1,R,Brad PittMargot RobbieJean Smart,Comedy,2022
Tombstone,George P. Cosmatos,50.0,130.0,7.8,R,Kurt RussellVal KilmerSam Elliott,Biography,1993
Kingdom of Heaven,Ridley Scott,63.0,144.0,7.3,R,Orlando BloomEva GreenLiam Neeson,Action,2005
Schindler's List,Steven Spielberg,95.0,195.0,9.0,R,Liam NeesonRalph FiennesBen Kingsley,Biography,1993
Sight,Andrew Hyatt,42.0,103.0,7.2,PG-13,Terry ChenGreg KinnearNatasha Mumba,Biography,2023
Dark Waters,Todd Haynes,73.0,126.0,7.6,PG-13,Mark RuffaloAnne HathawayTim Robbins,Biography,2019
Ferrari,Michael Mann,73.0,130.0,6.4,R,Adam DriverShailene WoodleyGiuseppe Festinese,Biography,2023
Killers of the Flower Moon,Martin Scorsese,89.0,206.0,7.6,R,Leonardo DiCaprioRobert De NiroLily Gladstone,Crime,2023
The Zone of Interest,Jonathan Glazer,92.0,105.0,7.4,PG-13,Christian FriedelSandra HüllerJohann Karthaus,Drama,2023
Oppenheimer,Christopher Nolan,90.0,180.0,8.3,R,Cillian MurphyEmily BluntMatt Damon,Biography,2023
Teri Baaton Mein Aisa Uljha Jiya,Amit Joshi,66.0,116.3,6.3,R,Shahid KapoorKriti SanonDharmendra,Comedy,2024
Wreck-It Ralph,Rich Moore,72.0,101.0,7.7,PG,Rich MoorePhil JohnstonJim Reardon,Animation,2012
Sky High,Mike Mitchell,62.0,100.0,6.3,PG,Kurt RussellKelly PrestonMichael Angarano,Action,2005
The Lego Movie,Phil Lord,83.0,100.0,7.7,PG,Phil LordChristopher MillerDan Hageman,Animation,2014
The Return of the Living Dead,Dan O'Bannon,66.0,91.0,7.3,R,Rudy RicciJohn A. RussoRussell Streiner,Comedy,1985
Mars Attacks!,Tim Burton,52.0,106.0,6.4,PG-13,Len BrownWoody GelmanWally Wood,Comedy,1996
Robots,Chris Wedge,64.0,91.0,6.4,PG,David Lindsay-AbaireLowell GanzBabaloo Mandel,Animation,2005
Incredibles 2,Brad Bird,80.0,118.0,7.5,PG,Craig T. NelsonHolly HunterSarah Vowell,Animation,2018
Lilo & Stitch,Dean DeBlois,74.0,85.0,7.3,PG,Chris SandersDean DeBlois,Animation,2002
Minions,Kyle Balda,56.0,91.0,6.4,PG,Sandra BullockJon HammMichael Keaton,Animation,2015
Ghostbusters II,Ivan Reitman,56.0,108.0,6.6,PG,Dan AykroydHarold Ramis,Action,1989
Big Hero 6,Don Hall,74.0,102.0,7.8,PG,Jordan RobertsRobert L. BairdDaniel Gerson,Animation,2014
Guardians of the Galaxy Vol. 2,James Gunn,67.0,136.0,7.6,PG-13,James GunnDan AbnettAndy Lanning,Action,2017
The Adam Project,Shawn Levy,55.0,106.0,6.7,PG-13,Jonathan TropperT.S. NowlinJennifer Flackett,Action,2022
Time Bandits,Terry Gilliam,79.0,110.0,6.9,PG,Sean ConneryShelley DuvallJohn Cleese,Adventure,1981
"Honey, I Shrunk the Kids",Joe Johnston,63.0,93.0,6.4,PG,Stuart GordonBrian YuznaEd Naha,Adventure,1989
Paul,Greg Mottola,57.0,104.0,6.9,R,Simon PeggNick FrostSeth Rogen,Adventure,2011
Ant-Man and the Wasp: Quantumania,Peyton Reed,48.0,124.0,6.1,PG-13,Jeff LovenessStan LeeLarry Lieber,Action,2023
Teenage Mutant Ninja Turtles,Steve Barron,51.0,93.0,6.8,PG,Kevin EastmanPeter LairdBobby Herbeck,Action,1990
Death Race 2000,Paul Bartel,58.0,80.0,6.2,R,David CarradineSylvester StalloneSimone Griffeth,Action,1975
Ghostbusters,Paul Feig,60.0,117.0,6.8,PG-13,Katie DippoldPaul FeigIvan Reitman,Action,2016
Galaxy Quest,Dean Parisot,70.0,102.0,7.4,PG,David HowardRobert Gordon,Adventure,1999
Minions: The Rise of Gru,Kyle Balda,56.0,87.0,6.5,PG,Matthew FogelBrian Lynch,Animation,2022
Despicable Me,Pierre Coffin,72.0,95.0,7.6,PG,Steve CarellJason SegelRussell Brand,Animation,2010
Spaceballs,Mel Brooks,46.0,96.0,7.1,PG,Mel BrooksJohn CandyRick Moranis,Adventure,1987
Back to the Future Part II,Robert Zemeckis,57.0,108.0,7.8,PG,Robert ZemeckisBob Gale,Adventure,1989
Sonic the Hedgehog 2,Jeff Fowler,47.0,122.0,6.5,PG,Pat CaseyJosh MillerJohn Whittington,Action,2022
Men in Black,Barry Sonnenfeld,72.0,98.0,7.3,PG-13,Lowell CunninghamEd Solomon,Action,1997
Sonic the Hedgehog,Jeff Fowler,47.0,99.0,6.5,PG,Pat CaseyJosh MillerYuji Naka,Action,2020
Spider-Man: Far from Home,Jon Watts,69.0,129.0,7.4,PG-13,Chris McKennaErik SommersStan Lee,Action,2019
Teenage Mutant Ninja Turtles: Mutant Mayhem,Jeff Rowe,74.0,99.0,7.2,PG,Seth RogenEvan GoldbergJeff Rowe,Animation,2023
Spider-Man: Into the Spider-Verse,Bob Persichetti,87.0,117.0,8.4,PG,Phil LordRodney Rothman,Animation,2018
Thor: Ragnarok,Taika Waititi,74.0,130.0,7.9,PG-13,Eric PearsonCraig KyleChristopher L. Yost,Action,2017
Don't Look Up,Adam McKay,49.0,138.0,7.2,R,Adam McKayDavid Sirota,Comedy,2021
Weird Science,John Hughes,46.0,94.0,6.6,PG-13,Anthony Michael HallIlan Mitchell-SmithKelly LeBrock,Comedy,1985
Guardians of the Galaxy,James Gunn,76.0,121.0,8.0,PG-13,James GunnNicole PerlmanDan Abnett,Action,2014
Thor: Love and Thunder,Taika Waititi,57.0,118.0,6.2,PG-13,Taika WaititiJennifer Kaytin RobinsonStan Lee,Action,2022
Asteroid City,Wes Anderson,76.0,105.0,6.5,PG-13,Wes AndersonRoman Coppola,Comedy,2023
Free Guy,Shawn Levy,62.0,115.0,7.1,PG-13,Matt LiebermanZak Penn,Action,2021
Guardians of the Galaxy Vol. 3,James Gunn,64.0,150.0,7.9,PG-13,James GunnJim StarlinStan Lee,Action,2023
The Suicide Squad,James Gunn,72.0,132.0,7.2,R,Margot RobbieIdris ElbaJohn Cena,Action,2021
About Time,Richard Curtis,55.0,123.0,7.8,R,Domhnall GleesonRachel McAdamsBill Nighy,Comedy,2013
Back to the Future,Robert Zemeckis,87.0,116.0,8.5,PG,Michael J. FoxChristopher LloydLea Thompson,Adventure,1985
Idiocracy,Mike Judge,66.0,84.0,6.5,R,Mike JudgeEtan Cohen,Adventure,2006
Everything Everywhere All at Once,Daniel Kwan,81.0,139.0,7.8,R,Michelle YeohStephanie HsuJamie Lee Curtis,Action,2022
Deadpool 2,David Leitch,66.0,119.0,7.6,R,Rhett ReesePaul WernickRyan Reynolds,Action,2018
Ghostbusters: Afterlife,Jason Reitman,45.0,124.0,7.0,PG-13,Gil KenanJason ReitmanIvan Reitman,Adventure,2021
Ghostbusters,Ivan Reitman,71.0,105.0,7.8,PG,Bill MurrayDan AykroydSigourney Weaver,Action,1984
Ghostbusters: Frozen Empire,Gil Kenan,46.0,115.0,6.2,PG-13,Gil KenanJason ReitmanIvan Reitman,Adventure,2024
Poor Things,Yorgos Lanthimos,88.0,141.0,7.9,R,Emma StoneMark RuffaloWillem Dafoe,Comedy,2023
The Lost City,Aaron Nee,60.0,112.0,6.1,PG-13,Oren UzielDana FoxAdam Nee,Action,2022
21 Jump Street,Phil Lord,69.0,109.0,7.2,R,Michael BacallJonah HillPatrick Hasburgh,Action,2012
"Lock, Stock and Two Smoking Barrels",Guy Ritchie,67.0,107.0,8.1,R,Jason FlemyngDexter FletcherNick Moran,Action,1998
Hundreds of Beavers,Mike Cheslik,80.0,116.3,7.8,R,Ryland Brickson Cole TewsOlivia GravesWes Tank,Action,2022
Sonic the Hedgehog 2,Jeff Fowler,47.0,122.0,6.5,PG,Pat CaseyJosh MillerJohn Whittington,Action,2022
The Man from U.N.C.L.E.,Guy Ritchie,56.0,116.0,7.2,PG-13,Guy RitchieLionel WigramJeff Kleeman,Action,2015
Pain & Gain,Michael Bay,45.0,129.0,6.4,R,Mark WahlbergDwayne JohnsonAnthony Mackie,Action,2013
Hercules,Ron Clements,74.0,93.0,7.3,G,Ron ClementsJohn MuskerDon McEnery,Animation,1997
Smokey and the Bandit,Hal Needham,50.0,96.0,7.0,PG,Hal NeedhamRobert L. LevyJames Lee Barrett,Action,1977
Men in Black,Barry Sonnenfeld,72.0,98.0,7.3,PG-13,Lowell CunninghamEd Solomon,Action,1997
Sonic the Hedgehog,Jeff Fowler,47.0,99.0,6.5,PG,Pat CaseyJosh MillerYuji Naka,Action,2020
Mr. & Mrs. Smith,Doug Liman,55.0,120.0,6.5,PG-13,Brad PittAngelina JolieAdam Brody,Action,2005
Kick-Ass,Matthew Vaughn,66.0,117.0,7.6,R,Jane GoldmanMatthew VaughnMark Millar,Action,2010
Puss in Boots: The Last Wish,Joel Crawford,73.0,102.0,7.8,PG,Paul FisherTommy SwerdlowTom Wheeler,Animation,2022
Spider-Man: Far from Home,Jon Watts,69.0,129.0,7.4,PG-13,Chris McKennaErik SommersStan Lee,Action,2019
Tropic Thunder,Ben Stiller,71.0,107.0,7.1,R,Justin TherouxBen StillerEtan Cohen,Action,2008
Scott Pilgrim vs. the World,Edgar Wright,69.0,112.0,7.6,PG-13,Michael CeraMary Elizabeth WinsteadKieran Culkin,Action,2010
The Mask,Chuck Russell,59.0,101.0,6.9,PG-13,Jim CarreyCameron DiazPeter Riegert,Action,1994
Jumanji: The Next Level,Jake Kasdan,58.0,123.0,6.7,PG-13,Jake KasdanJeff PinknerScott Rosenberg,Action,2019
Zootopia,Byron Howard,78.0,108.0,8.0,PG,Byron HowardRich MooreJared Bush,Animation,2016
Teenage Mutant Ninja Turtles: Mutant Mayhem,Jeff Rowe,74.0,99.0,7.2,PG,Seth RogenEvan GoldbergJeff Rowe,Animation,2023
Kung Fu Panda,Mark Osborne,74.0,92.0,7.6,PG,Jonathan AibelGlenn BergerEthan Reiff,Animation,2008
Jumanji: Welcome to the Jungle,Jake Kasdan,58.0,119.0,7.0,PG-13,Chris McKennaErik SommersScott Rosenberg,Action,2017
Spider-Man: Into the Spider-Verse,Bob Persichetti,87.0,117.0,8.4,PG,Phil LordRodney Rothman,Animation,2018
Thor: Ragnarok,Taika Waititi,74.0,130.0,7.9,PG-13,Eric PearsonCraig KyleChristopher L. Yost,Action,2017
The Unbearable Weight of Massive Talent,Tom Gormican,68.0,107.0,7.0,R,Nicolas CagePedro PascalTiffany Haddish,Action,2022
Ocean's Eight,Gary Ross,61.0,110.0,6.3,PG-13,Gary RossOlivia MilchGeorge Clayton Johnson,Action,2018
Kingsman: The Secret Service,Matthew Vaughn,60.0,129.0,7.7,R,Jane GoldmanMatthew VaughnMark Millar,Action,2014
The Nice Guys,Shane Black,70.0,116.0,7.4,R,Russell CroweRyan GoslingAngourie Rice,Action,2016
Guardians of the Galaxy,James Gunn,76.0,121.0,8.0,PG-13,James GunnNicole PerlmanDan Abnett,Action,2014
Ready or Not,Matt Bettinelli-Olpin,64.0,95.0,6.9,R,Samara WeavingAdam BrodyMark O'Brien,Action,2019
Bad Boys for Life,Adil El Arbi,59.0,124.0,6.5,R,Peter CraigJoe CarnahanChris Bremner,Action,2020
Thor: Love and Thunder,Taika Waititi,57.0,118.0,6.2,PG-13,Taika WaititiJennifer Kaytin RobinsonStan Lee,Action,2022
Operation Fortune: Ruse de Guerre,Guy Ritchie,51.0,114.0,6.3,R,Jason StathamAubrey PlazaCary Elwes,Action,2023
Bad Boys,Michael Bay,41.0,119.0,6.8,R,George GalloMichael BarrieJim Mulholland,Action,1995
Free Guy,Shawn Levy,62.0,115.0,7.1,PG-13,Matt LiebermanZak Penn,Action,2021
The Family Plan,Simon Cellan Jones,39.0,118.0,6.3,PG-13,Mark WahlbergMichelle MonaghanCiarán Hinds,Action,2023
Guardians of the Galaxy Vol. 3,James Gunn,64.0,150.0,7.9,PG-13,James GunnJim StarlinStan Lee,Action,2023
The Suicide Squad,James Gunn,72.0,132.0,7.2,R,Margot RobbieIdris ElbaJohn Cena,Action,2021
Dungeons & Dragons: Honor Among Thieves,John Francis Daley,72.0,134.0,7.2,PG-13,Jonathan GoldsteinJohn Francis DaleyMichael Gilio,Action,2023
Beverly Hills Cop,Martin Brest,66.0,105.0,7.4,R,Daniel Petrie Jr.Danilo Bach,Action,1984
Aavesham,Jithu Madhavan,66.0,116.3,8.0,R,Fahadh FaasilHipzsterMithun Jai Shankar,Action,2024
Everything Everywhere All at Once,Daniel Kwan,81.0,139.0,7.8,R,Michelle YeohStephanie HsuJamie Lee Curtis,Action,2022
Deadpool 2,David Leitch,66.0,119.0,7.6,R,Rhett ReesePaul WernickRyan Reynolds,Action,2018
Ghostbusters,Ivan Reitman,71.0,105.0,7.8,PG,Bill MurrayDan AykroydSigourney Weaver,Action,1984
Deadpool,Tim Miller,65.0,108.0,8.0,R,Ryan ReynoldsMorena BaccarinT.J. Miller,Action,2016
Kung Fu Panda 4,Mike Mitchell,54.0,94.0,6.3,PG,Jonathan AibelGlenn BergerDarren Lemke,Animation,2024
Bullet Train,David Leitch,49.0,127.0,7.3,R,Brad PittJoey KingAaron Taylor-Johnson,Action,2022
Hit Man,Richard Linklater,83.0,115.0,7.4,R,Adria ArjonaGlen PowellRetta,Action,2023
The Fall Guy,David Leitch,73.0,126.0,7.1,PG-13,Ryan GoslingEmily BluntAaron Taylor-Johnson,Action,2024
Fright Night,Craig Gillespie,64.0,106.0,6.4,R,Marti NoxonTom Holland,Action,2011
Hoodwinked!,Cory Edwards,45.0,80.0,6.5,PG,Cory EdwardsTodd EdwardsTony Leech,Animation,2005
See How They Run,Tom George,60.0,98.0,6.5,PG-13,Kieran HodgsonPearl ChandaGregory Cox,Comedy,2022
Odd Thomas,Stephen Sommers,45.0,97.0,6.8,PG-13,Anton YelchinAshley SommersLeonor Varela,Comedy,2013
Chip 'n Dale: Rescue Rangers,Akiva Schaffer,66.0,97.0,7.0,PG,Andy SambergJohn MulaneyKiKi Layne,Animation,2022
The Losers,Sylvain White,44.0,97.0,6.2,PG-13,Peter BergJames VanderbiltAndy Diggle,Action,2010
The One I Love,Charlie McDowell,66.0,91.0,7.0,R,Mark DuplassElisabeth MossTed Danson,Comedy,2014
Horns,Alexandre Aja,46.0,120.0,6.4,R,Daniel RadcliffeJuno TempleMax Minghella,Comedy,2013
Fletch,Michael Ritchie,68.0,98.0,6.9,PG,Chevy ChaseJoe Don BakerDana Wheeler-Nicholson,Comedy,1985
Gosford Park,Robert Altman,90.0,137.0,7.2,R,Maggie SmithRyan PhillippeMichael Gambon,Comedy,2001
Charade,Stanley Donen,83.0,113.0,7.8,Approved,Peter StoneMarc Behm,Comedy,1963
Monster House,Gil Kenan,68.0,91.0,6.6,PG,Dan HarmonRob SchrabPamela Pettler,Animation,2006
Boss Level,Joe Carnahan,56.0,100.0,6.8,TV-MA,Chris BoreyEddie BoreyJoe Carnahan,Action,2020
Super Troopers,Jay Chandrasekhar,48.0,100.0,7.0,R,Jay ChandrasekharKevin HeffernanSteve Lemme,Comedy,2001
Spenser Confidential,Peter Berg,49.0,111.0,6.2,R,Sean O'KeefeBrian HelgelandRobert B. Parker,Action,2020
Murder Mystery,Kyle Newacheck,38.0,97.0,6.0,PG-13,Adam SandlerJennifer AnistonLuke Evans,Action,2019
The 'Burbs,Joe Dante,45.0,102.0,6.8,PG,Tom HanksBruce DernCarrie Fisher,Comedy,1989
Kiss Kiss Bang Bang,Shane Black,73.0,103.0,7.5,R,Brett HallidayShane Black,Comedy,2005
Chungking Express,Kar-Wai Wong,78.0,102.0,8.0,PG-13,Brigitte LinTakeshi KaneshiroTony Leung Chiu-wai,Comedy,1994
Happy Death Day,Christopher Landon,58.0,96.0,6.6,PG-13,Jessica RotheIsrael BroussardRuby Modine,Comedy,2017
The Witches,Nicolas Roeg,78.0,91.0,6.8,PG,Anjelica HustonMai ZetterlingJasen Fisher,Adventure,1990
Haunted Mansion,Justin Simien,47.0,123.0,6.0,PG-13,LaKeith StanfieldRosario DawsonOwen Wilson,Comedy,2023
They Cloned Tyrone,Juel Taylor,74.0,122.0,6.6,R,John BoyegaJamie FoxxTeyonah Parris,Comedy,2023
Scream 4,Wes Craven,52.0,111.0,6.2,R,Kevin Williamson,Comedy,2011
Guillermo del Toro's Pinocchio,Guillermo del Toro,79.0,117.0,7.6,PG,Guillermo del ToroPatrick McHaleCarlo Collodi,Animation,2022
Inherent Vice,Paul Thomas Anderson,81.0,148.0,6.6,R,Joaquin PhoenixJosh BrolinOwen Wilson,Comedy,2014
Men in Black II,Barry Sonnenfeld,49.0,88.0,6.2,PG-13,Lowell CunninghamRobert GordonBarry Fanaro,Action,2002
Pokémon: Detective Pikachu,Rob Letterman,53.0,104.0,6.5,PG,Dan HernandezBenji SamitRob Letterman,Action,2019
Orion and the Dark,Sean Charmatz,72.0,93.0,6.3,TV-Y7,Charlie KaufmanEmma YarlettLloyd Taylor,Animation,2024
Brave,Mark Andrews,69.0,93.0,7.1,PG,Brenda ChapmanMark AndrewsSteve Purcell,Animation,2012
Now You See Me 2,Jon M. Chu,46.0,129.0,6.4,PG-13,Ed SolomonPeter ChiarelliBoaz Yakin,Action,2016
Dora and the Lost City of Gold,James Bobin,63.0,102.0,6.1,PG,Nicholas StollerMatthew RobinsonTom Wheeler,Action,2019
City Hunter,Yûichi Satô,66.0,102.0,6.3,TV-MA,Ryohei SuzukiMisato MoritaMasanobu Andô,Action,2024
Palm Springs,Max Barbakow,83.0,90.0,7.4,R,Andy SiaraMax Barbakow,Comedy,2020
Who Framed Roger Rabbit,Robert Zemeckis,83.0,104.0,7.7,PG,Jeffrey PricePeter S. SeamanGary K. Wolf,Animation,1988
Clue,Jonathan Lynn,41.0,94.0,7.2,PG,John LandisJonathan LynnAnthony E. Pratt,Comedy,1985
Hot Fuzz,Edgar Wright,81.0,121.0,7.8,R,Simon PeggNick FrostMartin Freeman,Action,2007
Amsterdam,David O. Russell,48.0,134.0,6.1,R,Christian BaleMargot RobbieJohn David Washington,Comedy,2022
Mr. Monk's Last Case: A Monk Movie,Randy Zisk,65.0,97.0,6.7,TV-PG,Andy Breckman,Comedy,2023
The Ballad of Buster Scruggs,Ethan Coen,79.0,133.0,7.2,R,Joel CoenEthan CoenJack London,Comedy,2018
"Confess, Fletch",Greg Mottola,64.0,98.0,6.4,R,Jon HammCaitlin Zerra RoseRoy Wood Jr.,Comedy,2022
Holes,Andrew Davis,71.0,117.0,7.0,PG,Louis Sachar,Adventure,2003
Pain & Gain,Michael Bay,45.0,129.0,6.4,R,Mark WahlbergDwayne JohnsonAnthony Mackie,Action,2013
Zootopia,Byron Howard,78.0,108.0,8.0,PG,Byron HowardRich MooreJared Bush,Animation,2016
Bodies Bodies Bodies,Halina Reijn,69.0,94.0,6.2,R,Amandla StenbergMaria BakalovaMyha'la,Comedy,2022
Ready or Not,Matt Bettinelli-Olpin,64.0,95.0,6.9,R,Samara WeavingAdam BrodyMark O'Brien,Action,2019
Glass Onion,Rian Johnson,81.0,139.0,7.1,PG-13,Daniel CraigEdward NortonKate Hudson,Comedy,2022
Knives Out,Rian Johnson,82.0,130.0,7.9,PG-13,Daniel CraigChris EvansAna de Armas,Comedy,2019
Wicked Little Letters,Thea Sharrock,58.0,100.0,7.0,R,Jessie BuckleyOlivia ColmanTimothy Spall,Comedy,2023
A Simple Favor,Paul Feig,67.0,117.0,6.8,R,Anna KendrickBlake LivelyHenry Golding,Comedy,2018
Ikiru,Akira Kurosawa,92.0,143.0,8.3,Not Rated,Takashi ShimuraNobuo KanekoShin'ichi Himori,Drama,1952
Singin' in the Rain,Stanley Donen,99.0,103.0,8.3,G,Gene KellyDonald O'ConnorDebbie Reynolds,Comedy,1952
Toy Story 3,Lee Unkrich,92.0,103.0,8.3,G,John LasseterAndrew StantonLee Unkrich,Animation,2010
Dr. Strangelove or: How I Learned to Stop Worrying and Love the Bomb,Stanley Kubrick,97.0,95.0,8.3,PG,Stanley KubrickTerry SouthernPeter George,Comedy,1964
Princess Mononoke,Hayao Miyazaki,76.0,134.0,8.3,PG-13,Hayao MiyazakiNeil Gaiman,Animation,1997
Lawrence of Arabia,David Lean,100.0,218.0,8.3,PG,Peter O'TooleAlec GuinnessAnthony Quinn,Adventure,1962
Toy Story,John Lasseter,96.0,81.0,8.3,G,John LasseterPete DocterAndrew Stanton,Animation,1995
Star Wars: Episode VI - Return of the Jedi,Richard Marquand,58.0,131.0,8.3,PG,Lawrence KasdanGeorge Lucas,Action,1983
Reservoir Dogs,Quentin Tarantino,81.0,99.0,8.3,R,Quentin TarantinoRoger Avary,Crime,1992
2001: A Space Odyssey,Stanley Kubrick,84.0,149.0,8.3,G,Stanley KubrickArthur C. Clarke,Adventure,1968
The Hunt,Thomas Vinterberg,77.0,115.0,8.3,R,Mads MikkelsenThomas Bo LarsenAnnika Wedderkopp,Drama,2012
Once Upon a Time in America,Sergio Leone,75.0,229.0,8.3,R,Harry GreyLeonardo BenvenutiPiero De Bernardi,Crime,1984
Eternal Sunshine of the Spotless Mind,Michel Gondry,89.0,108.0,8.3,R,Charlie KaufmanMichel GondryPierre Bismuth,Drama,2004
