Title,Director,MetaScore,Duration (minutes),IMDb Rating,Certificates,Star Cast,Genre,Year
Beyond the Quest,Hosam Ibrahim,66.0,116.3,6.0,R,Janet CarrollChad GordonDrew Pongyan,Mystery,2007
Antaries,Thorin Cupit,66.0,116.3,5.9,R,Nick BucklandMark HealyCarol Lawton,Sci-Fi,2019
Prátelé Bermudského trojúhelníku,Václav Krístek,66.0,116.3,5.3,R,Frantisek CechJirí JustPetr Novotný,Comedy,1987
Chronoslexia,Trevor Fleming,66.0,116.3,5.4,R,Angie WallerTrevor FlemingIan Hayles,Sci-Fi,2011
"Chengdu, I Love You",Fruit Chan,66.0,116.3,5.6,R,AnyaTao GuoXuan Huang,Sci-Fi,2009
Cow Tippers from Outer Space,Matthew W. Enstrom,66.0,116.3,5.0,R,Laurie BeckemanThomas BerdinskiKent Bickle,Comedy,2011
El vivo retrato,Mario Menéndez,66.0,116.3,6.5,R,Mario MenéndezFran VaqueroFrancisco G. Orejas,Sci-Fi,1986
Sacrifice,Bob Nelson,66.0,116.3,6.2,R,Brent HeffronShanda Lee MunsonHeather Liebenow,Sci-Fi,2010
Il tempo dell'inizio,Luigi Di Gianni,66.0,116.3,7.1,R,Sven LastaRada RassimovJean Martin,Drama,1974
After Exodus,Matthew F. Perry,66.0,116.3,5.5,R,Caleb UsryAndy LivengoodChris Drake,Drama,2014
The Grid: Zombie Outlet Maul,Linda Andersson,66.0,91.0,6.0,Not Rated,Linda AnderssonMJ Lallo,Animation,2015
Escape from Chernobourg,Michael A. Martinez,66.0,75.0,5.6,Unrated,David WoodGeorge N. ThompsonBrandon Baca,Adventure,1999
Czarne slonca,Jerzy Zalewski,66.0,116.3,6.1,R,Ewa DalkowskaTomasz DedekJan Frycz,Crime,1992
Memory Transfer,Michael Moeh,66.0,116.3,6.9,R,Laur AllenAndy AquinoBrian Bedell,Adventure,2015
Time-Men,Mark Gumbinger,66.0,86.0,5.6,Not Rated,Ramon FloresSteve NeahousElizabeth Moore,Sci-Fi,2009
Le petit nuage/La chasse au nuage/Le nuage atomique,Antoine Allard,66.0,116.3,5.2,R,Marcel BerteauMarcel CornelisHubert Daix,Sci-Fi,1954
Kam zmizel kuryr,Otakar Fuka,66.0,116.3,5.9,R,Jan KanyzaEva JakoubkováKarel Houska,Sci-Fi,1981
Do zvezdy!,Andrey Noskov,66.0,116.3,6.1,R,Yuriy GaltsevIgor GolovinNatalya Kutasova,Comedy,2023
Inseguito,Luca Guardabascio,66.0,116.3,8.5,R,Irene AielloAndoni Aresti LandaNanni Candelari,Sci-Fi,2002
L.I.N.X.,Bryan Bagby,66.0,116.3,6.0,R,Regan GurrAdam JosephKenn Bartlett,Sci-Fi,2000
Katatonia,Hamed Eslami,66.0,116.3,6.3,R,Amanda AzadShahab HosseiniMehdi Takloo Karimi,Sci-Fi,2015
Zeria,Harry Cleven,66.0,116.3,6.0,R,Daniel RadcliffeEmma WatsonRupert Grint,Animation,2021
Doppelgänger,Stan Douglas,66.0,116.3,6.6,R,Dionne AudainEmma WestKrista Morin,Sci-Fi,2019
Tremor Iê,Lívia de Paiva,66.0,116.3,6.5,R,Lila M. SalúDeyse MaraElena Meirelles,Sci-Fi,2019
SG3: Sword of the Samurai,Erkut Altindag,66.0,116.3,7.4,R,Avni Alp MumcuUgur KurtNeslihan Mertkan,Comedy,2007
Anamnesis,Jonathan Farr,66.0,129.0,5.4,Not Rated,Shekhar BassiMercedes BaxterSimone Bonechi,Sci-Fi,2006
Xabungle Graffiti,Yoshiyuki Tomino,66.0,116.3,5.5,R,Yoshihisa ArakiTsunehisa ItôYoshitake Suzuki,Animation,1983
Rodson - ou (Onde o Sol Não Tem Dó),Clara Chroma,66.0,116.3,7.3,R,Clara ChromaUrutau Maria PintoOrlok Sombra,Sci-Fi,2020
The Battle for First Chair Opening Day Dreams PinPin Twenty,Trailer Tom,66.0,116.3,8.5,R,Ryan KnaptonFfej KnarDavid Kubicka,Sci-Fi,2022
Flag: Issenman no kufura no kiroku,Ryôsuke Takahashi,66.0,116.3,5.9,R,Toru NozakiRyôsuke TakahashiKazuo Terada,Animation,2007
Light Boy,Jolie Hales,66.0,116.3,7.4,R,Dallin HalesJames HalesMallary Madsen,Action,2004
Night of the Shadow People,Blaise Kolodychuk,66.0,116.3,6.6,R,Alana FischerRachael Amo-MensahJennifer Hartley,Fantasy,2016
Magic Lizard,Sompote Sands,66.0,116.3,5.2,R,Daniel RadcliffeEmma WatsonRupert Grint,Action,1985
Ezekiel's Landing,James Treakle,66.0,85.0,7.3,Not Rated,Naphatia St PierreRansom PughAbigail White,Drama,2015
Iqro: My Universe,Iqbal Alfajri,66.0,116.3,6.9,R,Aisyah AmirahIqbal AlfajriBudiyati Abiyoga,Adventure,2019
Retorno,Guillermo Amoedo,66.0,80.0,6.0,Not Rated,Cristián AlmarzaPablo DonetchFelipe Grandón,Crime,2010
New! Improved! Real-life American Fairy Tale,Deborah Magocsi,66.0,116.3,6.1,R,Via LambrosJeff KearneyKate Rodger,Sci-Fi,1993
Unikum,Vitaliy Melnikov,66.0,116.3,5.7,R,Vitaliy MelnikovAleksandr Zhitinsky,Comedy,1984
El Fin,Miguel Alejandro Gomez,66.0,85.0,6.9,Not Rated,Luis Carlos BogantesKurt DyerÁlvaro Marenco,Comedy,2011
Blistayushchiy mir,Bulat Mansurov,66.0,116.3,5.5,R,Tiit HärmIlse LiepaPavel Kadochnikov,Sci-Fi,1984
Une vie en l'air,Emmanuel Malka,66.0,116.3,7.2,R,Antoine BaslerEric LandreinLison Riess,Sci-Fi,2004
The Strange Case of Señor Computer,Tom Sawyer,66.0,116.3,7.4,R,Rick ZieglerTom SawyerSpencer Koerner,Comedy,2000
2k3,Gray Miller,66.0,116.3,6.8,R,Marin GazzanigaAnslem RichardsonStephen Nicholson,Drama,2009
Apollo 54,Giordano Giulivi,66.0,116.3,5.6,R,Silvano BertolinDuccio GiuliviGiordano Giulivi,Sci-Fi,2007
Electric Mind,Nadav Harel,66.0,116.3,7.9,R,Fani AndelmamYoram BrawSchlomi Constantini,Documentary,2010
"Geeks and Goblins, Elves and Elliot",D. Michael Martindale,66.0,116.3,6.7,R,D. Michael MartindaleLaura Mothersill,Comedy,2010
Almost Human,Abe Vilchez-Moran,66.0,116.3,6.2,R,Kera O'BryonCoby BattyAshley Myers,Horror,2011
Severance,Dany Gehshan,66.0,116.3,5.1,R,Ash CatherwoodVanessa BurnsPaul Fowles,Drama,2010
Victor_Robot,Anatoliy Lavrenishyn,66.0,116.3,7.4,R,Mariyka AglotkovaVasily MazurRimma Zyubina,Animation,2020
Die phantastische Welt des Matthew Madson,Helmut Herbst,66.0,116.3,5.7,R,Dietmar BuchmannAngelika DüsingHannes Hatje,Animation,1974
Neverender,Casey Siegel,66.0,116.3,7.3,R,Jesse GiammarvaKimmie MerriamEros Giacalone,Comedy,2011
Duel,Pavel Nikolajev,66.0,116.3,8.3,R,Josh LongElizabeth A. MorrisonJames Molinari,Comedy,2009
Spidertron,Carter Soles,66.0,116.3,6.7,R,Amanda A.Chad AfanadorEmily Afanador,Action,2008
A Taste of Kiss,Ippei Nishihara,66.0,116.3,8.0,R,Tadafumi AndoKazuya HayashiMasana Hirabuki,Drama,2011
The Fix:,Britmic,66.0,116.3,5.7,R,Daniel RadcliffeEmma WatsonRupert Grint,Sci-Fi,2011
The Synthetic Man,Yabiao Wang,66.0,116.3,6.5,R,Shuang DuAiling HuangXiaodong Li,Sci-Fi,1988
Die Welt ohne Maske,Harry Piel,66.0,116.3,6.2,R,Harry PielKurt VespermannAnnie Markart,Comedy,1934
Johnny Shortwave,Michael Bockner,66.0,116.3,5.2,R,Emmanuel MarkJohn TenchMona Matteo,Drama,1995
Single Minded,Luke Tedder,66.0,116.3,6.8,R,Luke TedderJames DearingOliver Gills,Action,2010
La jaula,Vance McLean,66.0,116.3,5.7,R,Ivan CamiloMariana MonclovaNorman Santiago,Sci-Fi,2000
Atrophy,Jason Slingerland,66.0,116.3,7.8,R,Chadwick SuttonHannah DanielZechariah Metzler,Sci-Fi,2018
As the Earth Turned,Bill Taylor,66.0,116.3,7.1,R,Denese McCreadyDamian McDonaldRobert Render,Comedy,2012
Last Days,Andrew Jara,66.0,116.3,5.9,R,Mark OceguedaAlgernon D'AmmassaMarcelle Bowman,Drama,2010
Oigye Eseo on Ulemae 9: Mujeok Ui Paiteo Ulemae,Han-yeol Lee,66.0,116.3,7.0,R,Hyung-rae ShimYu BinMun Hyeok,Action,1993
La grata,Fabio Morichini,66.0,116.3,7.1,R,Francesco CabrasPepita CianfoniFrancesco Corica,Sci-Fi,2009
Roboflash Warrior,Richard J. Thomson,66.0,116.3,5.2,R,Laurent DalliasLuc CendrierNoé Cendrier,Action,1994
Mislandia,Mashti Allan,66.0,116.3,7.4,R,Zahara JohannesRoss JohnsonAleks Nial,Adventure,2019
Zvyozdnaya komandirovka,Boris Ivchenko,66.0,116.3,5.4,R,Yevgeni Shatko,Comedy,1983
Amare,M.M. Izidoro,66.0,116.3,8.6,R,Tassia CabanasVinicius CalderoniM.M. Izidoro,Drama,2018
Ulemae 4: Thunder V chuldong,Myeong-hwa Jo,66.0,116.3,6.2,R,Hyung-rae ShimEun-kyeong JeonKim Su-Mi,Sci-Fi,1987
Retribution in the Year 2050,Brendan Muldowney,66.0,116.3,5.1,R,Aideen BradshawPhilip BredinJohnny Brewer,Sci-Fi,1998
Grandfather's Century,Sam van Zoest,66.0,116.3,7.0,R,Daniel RadcliffeEmma WatsonRupert Grint,Sci-Fi,2020
Die Wahrheit über die Stasi,Alexander Zahn,66.0,116.3,7.8,R,Wolfgang DahlThomas DorlDirk Feinermann,Comedy,1992
Agilem eli fragmentteja Pään elämästä,Ilkka Levä,66.0,116.3,7.0,R,Anne AutiolahtiMarko GylénHannaleena Hauru,Sci-Fi,2018
An American Cyborg,Christian Robert Varley,66.0,73.0,6.2,Not Rated,Carson GrantAlyxx MorgenDiane Quinn,Action,2002
Johnny Be Gone,Trevor Juenger,66.0,116.3,6.1,R,Devlin WilderJoe HammerstoneKatie Deerest,Drama,2011
The Importance of Being Russell,Sean Plemmons,66.0,116.3,5.2,R,Jeff HassenJohn PickleSean Plemmons,Comedy,2006
A Cold Day in Hell,Nickolas Robison,66.0,116.3,6.9,R,Bob RobertsKaylee SteenArin Winger,Drama,2015
Dead Strange Jam,Liam Bond,66.0,116.3,5.5,R,Liam BondNick BoxMarcus Caballero,Comedy,2015
Idealnoe prestuplenie,Igor Voznesensky,66.0,116.3,6.1,R,Zinovi Yuryev,Mystery,1990
Steampunk,Billy T. Boyd,66.0,116.3,5.5,R,Gareth EvansJaime PittengerChad Burns,Action,2010
Karim Patwa's Spaceship,Karim Patwa,66.0,116.3,8.3,R,Daniel RadcliffeEmma WatsonRupert Grint,Biography,2004
Minushi,Tyler Gibb,66.0,94.0,7.2,Not Rated,Jay DonaldsonTyler GibbTara Lutchman,Animation,2007
Embers of the Sky,Justin Calen-Chenn,66.0,116.3,6.3,R,Hayley J WilliamsMaria OlsenRowena Sumner,Drama,2010
Timeshifters 2: Alternate Present,Esses Tamás,66.0,116.3,7.2,R,Szabó AntalBolla AttilaHarczi Bence,Sci-Fi,2012
The Paralyzing Agent,Gene Greenlees,66.0,116.3,6.2,R,Michael AndersonPatrick BarrilleauxCarlie Bass,Drama,2009
Dreamscape,Curt Anderson,66.0,116.3,6.3,R,Sophie BolenSamantha BerendsEthan Knoth,Sci-Fi,2011
The Last Dudes on Earth,Dan Wedeking,66.0,116.3,6.9,R,Courtney KatesRobert Brandon MachadoBrian Marshall,Comedy,2005
Nova Express,Andre Perkowski,66.0,116.3,7.5,R,Peter BergmanWilliam S. BurroughsJürgen Ploog,Sci-Fi,2009
Space Tours: Mission E.V.A.,Andreas Auinger,66.0,116.3,5.5,R,János MischuretzUlli EmmerRainer Kantz,Comedy,2010
Ratstar,Christian Bergmans,66.0,116.3,7.7,R,Daniel RadcliffeEmma WatsonRupert Grint,Comedy,2004
Counter-Clockwise,Denny Wilkins,66.0,116.3,6.0,R,Daniel RadcliffeEmma WatsonRupert Grint,Romance,2011
Prodavetz vozdukha,Vladimir Ryabtzev,66.0,116.3,5.8,R,Pavel KadochnikovArtyom KarapetyanGennadiy Nilov,Sci-Fi,1967
The Lower Circle,Luigi Scarcelli,66.0,116.3,8.2,R,Kimberly Anne BendixMadrid St. AngeloGuy Klinzing,Fantasy,2009
Dangerous Stories,Kazuyuki Izutsu,66.0,116.3,5.5,R,Kiyoshi KurosawaAtaru OikawaJunji Sakamoto,Horror,1989
Karutha Rathrikal,Mahesh,66.0,116.3,6.6,R,MadhuT.K. BalachandranN. Govindankutty,Crime,1967
The Drivetime,Antero Alli,66.0,116.3,6.7,R,Michael Taylor DonovanAntero AlliGregory Baisden,Crime,1995
The Elk Hotel,Daniel Paul Bates,66.0,116.3,5.3,R,Laurie BushmanEdisol W. DotsonMichael Ehrenberg,Drama,2006
Collision Moon,Brian Nowak,66.0,116.3,6.9,R,Daniel RadcliffeEmma WatsonRupert Grint,Sci-Fi,2021
Spilt Blood,Willy Adkins,66.0,116.3,6.4,R,Anastasia MorriganPhranque WrightWolf McKinney,Fantasy,2015
Encounter: Omzion,Steven Catizone,66.0,127.0,6.2,Not Rated,Brendan BorisLisa BorisAnn Marie Catizone Rehnert,Animation,2010
Idõugrók 2 - Alternatív jelen,Esses Tamás,66.0,116.3,6.4,R,Esses TamásVéber ZoltánTokodi Sandor,Sci-Fi,2012
Cinco gallinas y el cielo,Rubén W. Cavalloti,66.0,116.3,7.8,R,Narciso Ibáñez MentaLuis ArataIrma Córdoba,Comedy,1957
This Corrosion,Mitch McCabe,66.0,116.3,5.7,R,Elisabeth SeljevoldJulie FinchHobey Echlin,Mystery,2003
Liberation! The Musical,Nils Osmar,66.0,116.3,7.3,R,Meli AlexanderDannie BaldwinMeredith Binder,Action,2013
Target Audience 9.1,Dominic Mah,66.0,116.3,6.6,R,Mary AngelloKristen BrennanJeanne Chinn,Comedy,2007
The Cookbook,Siavash Afshar,66.0,116.3,5.6,R,Ali AbdaliAli AnvariEbrahim Azizi,Mystery,2018
Origins III: Destiny,Kyle Parish,66.0,116.3,6.1,R,Kyle ParishMatthew SchliesmannJoseph Popma,Action,2012
I Heart Doomsday,Patrick Downing,66.0,116.3,6.0,R,Dan BeirneJoe CobdenChristine Ghawi,Comedy,2010
A Dog Called Pain,Luis Eduardo Aute,66.0,116.3,7.3,R,Daniel RadcliffeEmma WatsonRupert Grint,Animation,2001
The Dead Speak,Gabriel Soria,66.0,116.3,6.2,R,Julián SolerAmelia de IlisaManuel Noriega,Drama,1935
Marty's Project,Andrew Kent,66.0,116.3,9.5,R,Naomi AshDavid BedfordJoanna Deering,Comedy,2010
Chronospunk! The Pursuit of Who?,Gustav Heinlein,66.0,116.3,7.8,R,Brandon BerkLarry Day IIGrant Fitch,Comedy,2014
Monolog,Eray Dinç,66.0,116.3,6.8,R,Sertan ArslanTunca ArslanEnis Aybar,Drama,2010
Buljong,Carl Johan De Geer,66.0,116.3,6.0,R,Iwa BomanCarl Johan De GeerGert Fylking,Drama,1995
Ulemae 7: Dolaon Ulemae,Jong-ho Lim,66.0,116.3,5.7,R,Hyung-rae ShimBong-geol LeeJong-Chol Yang,Sci-Fi,1992
L'invité de la onzième heure,Maurice Cloche,66.0,116.3,6.1,R,Maurice ClocheJean FerryNino Frank,Drama,1945
Traveller: Red,Andrew Merkelbach,66.0,116.3,5.3,R,Catherine BillinghamJohn KingMarijana Kreso,Sci-Fi,2006
New Machine: Ulemae 5,Myeong-hwa Jo,66.0,116.3,6.7,R,Hyung-rae ShimHye-jin LeeAm Park,Sci-Fi,1988
Blister,Taikan Suga,66.0,116.3,6.5,R,Ken AyugaiDennis GunnPatrick Harlan,Action,2000
Lo que pudo ser 2084,Alex Del Arco,66.0,116.3,8.6,R,Andrea JorqueraEnrique CamachoXena Montañez,Sci-Fi,2021
Wu zui zhi cheng,Chenyang Yin,66.0,116.3,6.6,R,Daniel RadcliffeEmma WatsonRupert Grint,Drama,2017
Vitaminac,Matias Musa,66.0,116.3,5.4,R,Daniel RadcliffeEmma WatsonRupert Grint,Sci-Fi,2012
Rifftrax: Super Mario Bros.,Bill Corbett,66.0,104.0,7.0,TV-14,Daniel RadcliffeEmma WatsonRupert Grint,Comedy,2014
Invertebrate,James McAleer,66.0,116.3,7.5,R,James McAleer,Sci-Fi,2011
Ku_on,Takayuki Hatamura,66.0,78.0,6.1,Not Rated,Haruna IsaokaSou SatoNana Seino,Action,2013
The Diamonds of Metro Valley,Aaron Arendt,66.0,116.3,7.2,R,Jordan EnderJon CohnRobert Poe,Action,2010
Double Happiness Uranium,Cole Larsen,66.0,116.3,5.0,R,Nicholas HopeJodie DryJo Stone,Sci-Fi,2013
The Beginning of the End of the World,Vincent Price,66.0,116.3,5.8,R,Daniel RadcliffeEmma WatsonRupert Grint,Documentary,1971
Absolute Zero,Ridley Scott,66.0,116.3,5.6,R,Daniel RadcliffeEmma WatsonRupert Grint,Sci-Fi,2001
Treta sled slantzeto,Gueorgui Stoyanov,66.0,116.3,5.9,R,Itschak FintziNaum ShopovNikolay Nikolaev,Drama,1972
Sturmaz (Acto y tempestad),Jesús Maestro,66.0,116.3,7.2,R,José Luis Rodríguez AenasDaniel F. AmselemBlanca Fibla,Sci-Fi,2011
Watt Poe to bokura no ohanashi,Shigenori Kageyama,66.0,116.3,8.1,R,Toshiko FujitaEriko HaraKôichi Kitamura,Animation,1988
The Orbitrons,Chris Frieri,66.0,116.3,6.2,R,Daniel RadcliffeEmma WatsonRupert Grint,Horror,1990
Green Eyes for Anastice,Michael R. Steinbeck,66.0,116.3,7.2,R,Nicholas P. RichardsSamantha PorpsTom Porps,Sci-Fi,2004
Endjährig,Willi Kubica,66.0,116.3,6.6,R,Matthias LierPeter MeinhardtMina Sadic,Sci-Fi,2020
Slipdream,Marc Grant,66.0,116.3,6.6,R,GregorioNiall PaddenDeva Dalporto,Adventure,2005
Apparatspott - Dat mokt wie gistern,Martin Hermann,66.0,116.3,6.5,R,Meelah AdamsThomas BaierSabine Bulthaup,Sci-Fi,2008
Slaveworld,Duane Soebagio,66.0,116.3,7.2,R,Daniel RadcliffeEmma WatsonRupert Grint,Sci-Fi,1995
Atmo HorroX,Pat Tremblay,66.0,116.3,6.5,R,Roch DesrosiersSyl DisjonkClaude Dubé,Comedy,2016
Apparatspott - Gerangel in Ruum un Tied,Martin Hermann,66.0,116.3,6.4,R,Thomas BaierUdo BurmeisterHansjuergen Hespos,Sci-Fi,2003
Je3 sedae: Ulemae 6,Cheong-gi Kim,66.0,116.3,5.4,R,Jeong-ho HanJong-a KimYong-soo Eom,Sci-Fi,1989
We Are All Cylons,Ilana Rein,66.0,116.3,7.9,R,David ChiricoMichael HoganLacy Alexis Pline,Documentary,2011
Back on Track,Ilmar Joubert,66.0,116.3,7.5,R,Niek DijkermanNiels ToondersPari Koree,Drama,2011
The Chorus,Dan Starling,66.0,116.3,6.7,R,Brennan CampbellNyla CarpentierStephanie Cho,Sci-Fi,2018
Eutamnesia,Patrick Rizzi,66.0,116.3,6.0,R,Emanuele De MatteisAntonio MatarazzoPaola Mura,Sci-Fi,2000
Fiction (+33),Pierre de Suzzoni,66.0,116.3,7.6,R,Amandine CoureauGuillaume PerezAlain Carbonel,Drama,2002
PentaQuad,Jessica Dahlke,66.0,116.3,7.5,R,Samuel BereutherChristian LewinPatricia Moresmau,Comedy,2018
Elulu,Gabriel Alfonso Verdugo Soto,66.0,116.3,6.2,R,Daniel RadcliffeEmma WatsonRupert Grint,Animation,2021
Gomer and Ed Lost in Space,Ryan E. Heppe,66.0,116.3,7.3,R,Lucas HeppeRyan E. HeppeAndrew Hicks,Action,2000
Kinnikuman: Ôabare! Seigi chôjin,Takeshi Shirato,66.0,116.3,5.9,R,Akira KamiyaMinori MatsushimaHideyuki Tanaka,Animation,1984
Desolate,Rob Grant,66.0,77.0,7.0,Not Rated,Daniel RadcliffeEmma WatsonRupert Grint,Drama,2013
Metal,Alice Cox Neff,66.0,116.3,6.6,R,Natalie FlanaganMichael BlairRachel Palleschi,Drama,2001
The World in the Year 2000,Ahmad Fuad,66.0,116.3,6.9,R,Seif AbdelrahmanAhmad AddasAbdessalam Al-Tayeb,Sci-Fi,1972
Klop 75 ili Mayakovskiy smeyotsya,Anatoliy Karanovich,66.0,116.3,5.8,R,Leonid BronevoyGalina VolchekIya Savvina,Animation,1976
Nightfur,Jason Corgan Brown,66.0,86.0,5.4,Not Rated,Jason Corgan BrownJeter Rhodes,Fantasy,2011
Cryptic Road,Moosa Saleem,66.0,116.3,8.3,R,Vijay Ashok SharmaAastha GautamAkshay Loomba,Mystery,2016
Joel D. Wynkoop's the Craiglon Incident II Aftermath,Joel D. Wynkoop,66.0,116.3,6.4,R,Ken Anthony IIJustin BowerDerek Braasch,Sci-Fi,2021
Last Breach,Christos Filippou,66.0,116.3,7.8,R,Tasos AndreadisTasos AntonaridisKonstantinos Babilas,Action,2018
Animal Rescue Squad,Xiaoning Feng,66.0,116.3,5.1,R,Jing XitongXiaoguang HuXiaowei Liu,Family,2019
Kuluçka,Mehmet Selçuk Bilge,66.0,116.3,5.5,R,Nur ErtemDilara TekinStefani Terziyan,Fantasy,2017
Kureji no buchamukure daihakken,Kengo Furusawa,66.0,116.3,7.1,R,Hajime HanaHitoshi UekiKei Tani,Comedy,1969
The Reflection of Kripto,Pauli Janhunen Calderón,66.0,116.3,8.5,R,Emilio Janhunen CalderónPauli Janhunen CalderónDavid Anghel,Sci-Fi,2016
Ymadawiad Arthur,Marc Evans,66.0,116.3,6.5,R,Ioan EvansMorgan HopkinsLlyr Ifans,Comedy,1996
The Wonderland Express,Greg Nichols,66.0,116.3,6.5,R,Greg Nichols,Comedy,2011
Subconscious Reality,Mark Byrne,66.0,91.0,6.2,Not Rated,Jim ToepperLana WoodConrad Brooks,Action,2016
Edgar Allan Poe's Plan 13: The House of Elvis,Scott Allen Nollen,66.0,116.3,8.5,R,Bart AikensRon FisherSteve Noe,Sci-Fi,1986
Mindgame,Shawn Martinbrough,66.0,116.3,6.9,R,Tarina PouncyJoe Tom CollinsJim Coope,Mystery,2003
To athoo soma,Nikos Kornilios,66.0,116.3,6.8,R,Iris ChatziantoniouAkilas KarazisisArto Apartian,Drama,1997
Maxwell's Demon,David Clark,66.0,116.3,5.7,R,Andy CurtisDarcy DunlopMark David Stewart,Drama,1999
Adolescence Changes in the Coronavirus Environment. How does a teenager react to a claustrophobic pandemic?,Eleni Anagnostopoulou,66.0,116.3,8.6,R,Eleni AnagnostopoulouSpyros BibilasVicky Driva,Documentary,2021
Metamorfosia,Cosmotropia de Xam,66.0,116.3,7.6,R,Carmen IncarnadineJanet LittwinLarissa Littwin,Horror,2014
TSC 3: Dawn of the Apocalypse,Justin Melick,66.0,116.3,6.0,R,LaDonna AllisonMadeline BrumbyDavid Lee Denny Jr.,Sci-Fi,2011
Jimmy Tornado,Gerry Schuster,66.0,116.3,6.8,R,Oleg BorissovLeonora EckerMona Filice,Sci-Fi,2004
Enjoy Your Trip to Hell,Scout Tafoya,66.0,76.0,7.3,PG-13,Tori DavisJulian LazareNick Smerkanich,Sci-Fi,2017
Do nebicka,Krystof Hanzlík,66.0,116.3,5.7,R,Anna KárnikováPetr HapkaMichal Dlouhý,Family,1997
"Katuwira, donde nacen y mueren los sueños",Íñigo Vallejo-Nágera,66.0,116.3,5.5,R,Íñigo Vallejo-NágeraTimothy J. Sexton,Adventure,1996
Triptosane,Michael DiCerto,66.0,84.0,5.8,Not Rated,Jim LavinTrace BeaulieuLarry Block,Sci-Fi,2010
Crystal Fortune Run,Chris Kin-Sang Li,66.0,116.3,5.3,R,Sharla CheungSimon YamAnita Yuen,Action,1994
Elmers Lov,Thomas Gunnari Røtting,66.0,116.3,7.6,R,Thomas Gunnari RøttingVetle Strøm,Action,2013
The Final Equation,Daniel Ulysses Abella,66.0,116.3,7.9,R,Robert HarriellCassandra CookePaul Weissman,Sci-Fi,2009
Dr. Otto Dekein's Original Design,Dean Sullivan Adams,66.0,116.3,6.7,R,Ryan DaviesDanny PerezJoe Raspolich,Comedy,2009
An Human,Koushik Kr,66.0,116.3,7.5,R,Koushik Kr,Drama,2011
Ekho: Fall of an Empire,Jim McCullough,66.0,116.3,5.8,R,Jim McCulloughAmanda MortenKristin Astourian,Sci-Fi,2004
Jumborg Ace & Giant,Sompote Sands,66.0,116.3,6.8,R,Daniel RadcliffeEmma WatsonRupert Grint,Action,1974
The Leafblower,Dominic DeJoseph,66.0,116.3,6.6,R,Jeanne FossMarco GiudiceJon Hyrns,Comedy,1998
Where the Journey Ends,Ryan Firth,66.0,116.3,5.0,R,Andriy DemtschukAidan RawnsleyRyan Firth,Action,2015
Ché OVNI,Aníbal Uset,66.0,116.3,5.0,R,Jorge SobralMarcela López ReyJuan Carlos Altavista,Comedy,1968
Raki II: Raki vs. Nemesis,Lewis C. Austin,66.0,116.3,6.4,R,Andrew RobertsValerie MeachumMichael Evanichko,Family,1996
Robot Taekwon V: Wooju jakjeon,Cheong-gi Kim,66.0,116.3,5.7,R,Daniel RadcliffeEmma WatsonRupert Grint,Animation,1976
Young-guwa hwanggeum bakjwi,Ki-nam Nam,66.0,116.3,6.2,R,Daniel RadcliffeEmma WatsonRupert Grint,Action,1992
Space Specks,Rick Dunbar,66.0,116.3,7.1,R,Tom SellwoodKrista WelterGreg Salomone,Comedy,2003
The Man Near Skitter Creek,Jake Swing,66.0,116.3,6.4,R,Jake Swing,Comedy,2012
Earth Without War,J. Carlos Portela,66.0,116.3,6.6,R,Swaylee LoughnaneLee WestwickDaniel Eghan,Sci-Fi,2017
Yo Alien,Foster V. Corder,66.0,116.3,7.0,R,Dick DeCoitTichina ArnoldCylk Cozart,Sci-Fi,2002
Puerta del tiempo,Pedro Delgado,66.0,116.3,6.6,R,Sandra JaraInma GallegoJavier Gurruchaga,Animation,2002
Star Wars: The Dark Reckoning,Mark Newton,66.0,116.3,6.0,R,Brian WoodwardAlexander DoddySarah Greiner-Dudaniec,Sci-Fi,2017
Eunhaeseo on Byeolddong wangja,Do-won Seok,66.0,116.3,7.5,R,Geon-ju LeeYong-shik LeeHyeong-jung Kim,Action,1987
Gekijôban G No Reconguista III: Uchû kara no isan,Yoshiyuki Tomino,66.0,116.3,7.2,R,Yoshiyuki Tomino,Animation,2021
Pioneer 12,Aaron N. Feldman,66.0,116.3,5.9,R,Christopher MurneyAlice PlaytenChristopher Wisner,Fantasy,1999
New World,Peter John Ross,66.0,116.3,5.2,R,George CaleodisFritz CargouldMilan A. Cargould,Action,2002
The Thin Time,J.R. Hughto,66.0,116.3,6.0,R,Jason DeckerJason Joel HarrisDarryl Hughto,Sci-Fi,2006
Roshtalivik,Nicholas J. Moore,66.0,72.0,6.1,Not Rated,Hauke BahrDavid CharlesLee McCarty,Sci-Fi,2016
Idõugrók 3 - Lidércháborús Múlt,Esses Tamás,66.0,116.3,5.5,R,Esses TamásNémeth TündeTokodi Sandor,Sci-Fi,2013
The Parchene Conspiracy,David Daring,66.0,116.3,6.8,R,John AlexanderCrockett AndersonTony Armstrong,Sci-Fi,2009
Omni: Verse,Grier Dill,66.0,116.3,7.0,R,Grier DillSean GillJulie Gomez,Adventure,2016
Mr. Suzuki: A Man in God's Country,Omoi Sasaki,66.0,116.3,7.2,R,Daniel RadcliffeEmma WatsonRupert Grint,Sci-Fi,2020
Fairie,Willo Hausman,66.0,116.3,6.7,R,Jack WallaceEd GaleRichard Parent,Sci-Fi,2002
"Minor Daemon, Volume 1",Jon Rafman,66.0,116.3,8.3,R,Daniel RadcliffeEmma WatsonRupert Grint,Animation,2021
The Dragons of Jim Green,Randy M. Salo,66.0,116.3,7.6,R,Daniel RadcliffeEmma WatsonRupert Grint,Documentary,2012
Presence,Bryan Kramer,66.0,116.3,5.9,R,Bryant CookTim CummingsPaula Mitchell Manning,Horror,2008
The Follow,Glenn Triggs,66.0,116.3,5.8,R,Daniel RadcliffeEmma WatsonRupert Grint,Sci-Fi,2004
Koyakatsi,Ayoub Qanir,66.0,116.3,7.7,R,Daniel RadcliffeEmma WatsonRupert Grint,Action,2014
Cultivision (Collapsing Stars),Neill Calabro,66.0,116.3,7.5,R,Danny VinsonMonica AmbroseScott Brantley,Sci-Fi,2002
Oko Boga,Piotr Krzywiec,66.0,116.3,7.1,R,Ryszard DolinskiIwona SzczesnaAndrzej Beja-Zaborski,Drama,2001
The Zombie Hero,Nicholas Jackson,66.0,116.3,6.0,R,Nicholas Jackson,Action,2010
Knightquest,Joe Monroe,66.0,116.3,7.2,R,Doria AnselmoBen FletcherMatt Howell,Sci-Fi,2001
Blonde Ringlet,Steven A. Kowal,66.0,116.3,7.4,R,Peter NezafatiFrank Kowal IIIDavid Hartley,Crime,2010
Atar Mass 2019,Nithin,66.0,116.3,7.0,R,Daniel RadcliffeEmma WatsonRupert Grint,Action,2017
Stunted Trees and Broken Bridges,Tom Leach,66.0,116.3,7.1,R,Tom LeachHeather BleasdaleSophie Gerrish,Sci-Fi,2013
The Lords of Praxton,Peter Anthony Fields,66.0,116.3,6.6,R,Peter Anthony FieldsEvonne Fields-GouldCornelius Gould,Fantasy,2006
VigasioSexploitation Vol.2,Sebastiano Montresor,66.0,116.3,5.4,R,EvelineMatteo LucchiChiara Pavoni,Action,2011
Escape the Dark,Matthew Chilelli,66.0,116.3,6.1,R,Karli KaiserErik MoodySarah Nicklin,Horror,2017
Missy,Elias Pate,66.0,71.0,7.4,Not Rated,Daniel RadcliffeEmma WatsonRupert Grint,Drama,2001
El Sab'a Afandi,Ahmed Khorshed,66.0,116.3,5.7,R,Sayed Abu BakrShadiaFarid Shawqi,Comedy,1951
Forge,Jason Windsor,66.0,116.3,7.3,R,Luke ClementsAlexander MendelukJeffree Newman,Drama,2010
"Komu vgoru, komu vniz",Stanislav Klymenko,66.0,116.3,5.9,R,Pyotr BenyukAnatoliy KhostikoevSvitlana Kharko,Adventure,1991
The Unity of All Things,Alexander Carver,66.0,116.3,5.5,R,Celia AuAndrea McKinnonJennifer Kim,Comedy,2013
Mirage,Srdjan Keca,66.0,116.3,7.3,R,Daniel RadcliffeEmma WatsonRupert Grint,Documentary,2011
Las aventuras de Jesús María Cristóbal Pequeño,Gilles Gambino,66.0,116.3,7.4,R,Ben VinnicombeAnnick WeertsMontse Olmo,Sci-Fi,2013
Ingenue,Siavash Farahani,66.0,116.3,6.2,R,George GelernterJoey GyondlaDavid Sommer,Fantasy,1999
Speedwagon,Justin Grizzoffi,66.0,116.3,6.9,R,Joe FriaCraig WatkinsonBetsy Baker,Comedy,2015
The Ringing Bell,Casey T. Malone,66.0,116.3,7.7,R,Brandon ColeAnieya WalkerJoelyn Dormady,Drama,2020
Gangu shuriya,Hakubun,66.0,116.3,6.9,R,HakubunYasumi KobayashiNatsu Matsuo,Fantasy,2002
Rifftrax: Avatar,Bill Corbett,66.0,116.3,7.6,TV-14,Daniel RadcliffeEmma WatsonRupert Grint,Action,2010
Alien in the Park,Forrest Emery,66.0,116.3,6.5,Not Rated,Russell NaumanEmilio PalameRoland Ruiz,Comedy,2011
Dans les limbes,Antoine Viviani,66.0,116.3,7.5,R,Jérémy AndréAlain DamasioAntoine Viviani,Documentary,2015
Born on the 8th of March,Lyberis Dionysopoulos,66.0,116.3,5.1,R,Lyberis DionysopoulosDespoina HalidouFoteini Karalidou,Comedy,2019
Subimago,Christophe Leclaire,66.0,116.3,7.3,R,Christophe LeclaireCéline PardouxDuarte Pedro,Drama,2017
Feng kuang de tu zi,Xiaoqin Cui,66.0,116.3,5.5,R,Daniel RadcliffeEmma WatsonRupert Grint,Horror,1997
Schoof,Giuseppe Andrews,66.0,116.3,7.2,R,Giuseppe AndrewsKaren Bo BarenWalt Dongo,Comedy,2008
Cyborgs: Year 0,Leonardo Corbucci,66.0,116.3,7.9,R,Ashton SmileyAnette PuskasQ Fortier,Sci-Fi,2018
Fujiyama Ichiban,Michi Yamato,66.0,116.3,7.2,R,Adam ForrestYuuki LunaHaurjie Gunn,Action,2014
Rinoplasticos: A Warrior's Journey,Pauli Janhunen Calderón,66.0,116.3,8.4,R,Emilio Janhunen CalderónPauli Janhunen CalderónAndrés Calderón,Action,2014
TL-2: La felicidad es una leyenda urbana,Tetsuo Lumiere,66.0,116.3,6.2,R,Tetsuo LumiereDiamela VianiNatalia Santiago,Biography,2009
